quoted_text,emosi
warga ntb dukung ganjar pranowo presiden 2024 ganjarpranowo ganjarcapres ganjarpresiden ganjarmenangtot ganjarpilihanrakyat presiden2024 ganjarpresiden2024 pilpres2024 pemilu2024,senang
ganjar pranowo dukung industri kreatif anak mileni gen z maju bangsa ganjar pimpin indonesia,senang
warga amp pemuda mileni d ringinsari d gedang kec sumbermanj wetan kab malang jatim deklarasi dukung amp kawal ganjarpranowo gabung dlm gera rawan cangkir kopi nusantara rapat baris menang ganjar pilpr,netral
dukung ganjar pranowo presiden ganjarcapres,senang
alumnus universita padjadjaran dukung ganjar pranowo ganjarcapres,senang
dukung ganjar pranowo presiden 2024 ganjarcapres,senang
dukung ganjarpranowo makkkk wuzzzzz ganjar lampung gabung gelar deklarasi rawan utk menang ganjar pranowo presiden ri,senang
poll buka tribunwow tribun video tribun pontianak ani menang prabowo subianto ganjar pranowo video makzulkanpresidencawe2 makzulkanpresidencawe2,netral
bacapres pdip ganjar pranowo tanggap kait calon wakil presiden bacawapr damping pilpr 2024 sindonew news,netral
ganjar pranowo figur pimpin masuk kalang sosok muda humor santuyi sesi gen z bikin suasana cair ganjaruntuksemua lanjutkanbersamaganjar,senang
damping tuan guru bajang muhammad zainul majdi ganjar pranowo interaksi dg gen z lombok ntb sesi foto2an selfienya lewat,senang
astungkara warga bal bendung ganjar pranowo lapang puput laut dukung ganjar ri matur suksma bal ganjarmenangtot,netral
ganjar pranowo indonesia ema 2045 capai ganjarpranowo ganjarcapres ganjarpresiden ganjarmenangtot ganjarpilihanrakyat presiden2024 ganjarpresiden2024 pilpres2024 pemilu2024,senang
kaum mileni gen z dukung ganjar pranowo presiden 2024 ganjarpranowo ganjarcapres ganjarpresiden ganjarmenangtot ganjarpilihanrakyat presiden2024 ganjarpresiden2024 pilpres2024 pemilu2024,senang
alumnus unpad nyata dukung ganjar pranowo presiden 2024 ganjarpranowo ganjarcapres ganjarpresiden ganjarmenangtot ganjarpilihanrakyat presiden2024 ganjarpresiden2024 pilpres2024 pemilu2024,senang
alumnus universita padjajaran jawa barat dukung ganjar pranowo presiden 2024 ganjarpranowo ganjarcapres ganjarpresiden ganjarmenangtot ganjarpilihanrakyat presiden2024 ganjarpresiden2024 pilpres2024 pemilu2024,senang
warga bal dukung ganjar pranowo presiden 2024 ganjarpranowo ganjarcapres ganjarpresiden ganjarmenangtot ganjarpilihanrakyat presiden2024 ganjarpresiden2024 pilpres2024 pemilu2024,senang
ganjar pranowo peneru presiden jokowi ganjarpranowo ganjarcapres ganjarpresiden ganjarmenangtot ganjarpilihanrakyat presiden2024 ganjarpresiden2024 pilpres2024 pemilu2024,senang
alumnus unpad dukung ganjar pranowo presiden 2024 ganjarpranowo ganjarcapres ganjarpresiden ganjarmenangtot ganjarpilihanrakyat presiden2024 ganjarpresiden2024 pilpres2024 pemilu2024,senang
90 persen anak muda bandung dukung ganjar pranowo presiden 2024 ganjarpranowo ganjarcapres ganjarpresiden ganjarmenangtot ganjarpilihanrakyat presiden2024 ganjarpresiden2024 pilpres2024 pemilu2024,senang
calon presiden bacapres ganjar pranowo ajak suami kasih sayang pasang sindonew news,senang
bagi2 sembako rawan ganjar pranowo ricuh lampung utara koalisibonekaistana koalisibonekaistana,marah
partai satu bangun ppp percaya figur menparekraf sandiaga uno penuh kriteria calon wakil presiden cawapr ganjar pranowo sindonew news,marah
serius org mw dijadiin cawapr ganjarpranowo doa airin tuh moga org gk jd cawapr ganjarpranowo kasi partai amp gp kewalahan utk jwb prtnyaan org tingkah konyol org,jijik
tgh tetes air mata doa ganjar pranowo presiden,sedih
erickthohir cawapr teras joss duet ganjar pranowo ganjarerickduetterbaik,terkejut
setyaki22965702 ryu53944310 ganjarpranowo mantap banget ganjar pranowo presiden peneru kerja presiden jokowi rampung indonesia maju sejahtera,senang
ganjar pranowo calon presiden baik ganjarcapres,senang
ganjar pranowo tanggap temu ketua dpp pdip puan maharani ketua partai demokrat agu harimurti yudhoyono ahi ganjarpranowo temu bagu kontek politik kontek bangsa negara,netral
knp dengar nama uno yg ad dpikiran gw tampil debat it setip atm halal mandi lumpur bu li yg gk dicov bpj nurjanah yg tinggal ad yg msi halu uno in,marah
alumnus unpad nyata dukung ganjar pranowo ganjarcapres ganjarpilihanterbaik ganjarbawakemajuan ganjarpresiden2024 ganjarpresiden,senang
dukung ganjar pranowo alir dera kalang komunita ganajrcapres,senang
jokowi ganjarpranowo ganjar pranowo bawa indonesia man,senang
jokowi ganjarpranowo ganjar pranowo the next presid,senang
bungkustukang ganjarpranowo ga polllll ganjar pranowo presiden peneru kerja presiden jokow,senang
subur0204 iyusrusliadi73 ganjar pranowo harga mati nkri harga mati salam wara,senang
hasil musra gorontalo calon presiden 2024 total pesrta 857 1 air langga hartarto 161 2 sandiaga uno 140 3 prabowo subianto 132 4 ganjar pranowo 123 5 mahfud md 85 6 ani baswedan 52 7 muldoko 36 musraindonesia musragorontalo,netral
jhonnisinaga20 ganjarpranowo inti pilih ganjar pranowo bere,senang
masyarakat 90 dukung ganjar pranowo,senang
musra indonesia ix gorontalo vote kejut hasil posisi airlangga hartarto sandiaga uno prabowo subianto pranowo mahfud md ani baswedan musraindonesia musragorontalo,netral
dpw partai nasdem gorontalo usul nama bacapres ani baswedan ganjar pranowo rachmat gobel erick thohir andika perkasa rakernasnasdem2022 partainasd,netral
rstmbcl ganjarpranowo ganjar pranowo presiden peneru kerja presiden jokowi cepat prose bangun ikn nkri harga mati ani rasyid baswedan minat,senang
dukung alir ganjar pranowo sang presiden ganjarcapres,senang
eksklusif ganjar pranowo maju calon presiden beritasat,senang
lengkap erickthohir ganjar pranowo lengkap ganjar politis dpr laku ekonomi erick thohir laku eksekusi ekonomi ganjarerickduetterbaik,netral
warga rawan ganjar sambut riah datang ganjar pranowo ntb,senang
ganjar pranowo pimpin pidato kunjung marka dpw ppp ntb hadap penguru kader ppp ganjar bagi kesan politik lalu pdiperjuangan 50tahunpdip bangunlahjiwadanbadannya solidbergerak menangkanganjar,senang
hansssolo preeeet akal2an dukung capres abadi narik dukung ganjar pranow,marah
calon presiden besut partai demokrasi indonesia juang pdip ganjar pranowo ikut konsolidasi intern pdi juang bal denpasar sabtu suara pilih transaksi lontar ganjar dengar target,netral
mayorita warga ntb rapat dukung penuh ganjar pranowo ganjarcapres,senang
anak muda antusia sambut ganjar pranowo,senang
alumnus unpad dukung ganjar pranowo presiden 2024,senang
survey ani yg buncit serang uji poll buka ganti nama ani sandal jepit tentu pilih sandal jepit retweet ganjar pranowo like prabowo subianto,marah
tanggap ganjar pranowo temu puan ahi bagu,netral
usul cawapr ganjar pranowo sandiaga uno juang mardiono via tribunnew,netral
bal menang ganjar pranowo,senang
mhdyusufhandok1 jokowi bentar pensiun yg gantiin ya ganjar pranowo,senang
ganjar pranowo pimpin indonesia 2024,senang
sabtu 17 juni 2023 dukung calon presiden capres ganjar pranowo penjuru dunia ada kolaborasi ajar jajar pijar ganjar sindonew news,netral
ganjar pranowo dukung kalang,senang
dukung masyarakat bal ganjar pranowo ganjarcapres ganjarpranowo jokowi milu ganjarcapres ganjarcapresespdip ganjarcapreses2024 ganjarcapres indonesiamaju,senang
masyarakat bal dukung ganjar pranowo presiden ganjarcapres ganjarpranowo jokowi milu ganjarcapres ganjarcapresespdip ganjarcapreses2024 ganjarcapres indonesiamaju,senang
agusyudhoyono moga demokrat rapat ganjar pranowo biar si ni ra sido,netral
yunartowijaya survei charta politika ganjar pranow,netral
poll yuk biar rekayasa rakyat indonesia pilih salah capres favorit tunjuk capres pilih benar2 raih suara prabowo like ani baswedan retwit ganjar pranowo komen pollingcapres capreses2024,senang
dukung ganjar pranowo for presiden indonesia 2024 ganjarcapres ganjarpranowo jokowi milu ganjarcapres ganjarcapresespdip ganjarcapreses2024 ganjarcapres indonesiamaju,senang
live ganjar pranowo sambut laut manusia lapang selong lombok timur,netral
dukung warga ntb ganjar pranowo ganjarcapres salmasalsabil gu muhaimin onad iphon 14 pontianak axelsen aang one piec,senang
antusiasm masyarakat ntb sambut ganjar pranowo ganjarcapres salmasalsabil gu muhaimin onad iphon 14 pontianak axelsen aang one piec,senang
warga ntb dukung ganjar pranowo ganjarcapres salmasalsabil gu muhaimin onad iphon 14 pontianak axelsen aang one piec,senang
pekik ganjar pranowo presiden gema lapang nasion selong lombokitaid,terkejut
ganjar pranowo sapa ribu masyarakat lombok timur lapang nasion ntb penuh hangat menangkanganjar generasigotongroyong sahabatganjar ganjarpranowo ganjar,senang
minggu 18 juni 2023 suasana penuh hangat sama liput lapang nasion ntb ganjar pranowo sapa ribu masyarakat lombok timur ada ganjar masyarakat lombok timur lapang nasion bukti nyata,senang
ajak puan masuk poro ubah ambyaaarr ganjar pranowo,marah
detikcom tohir ani baswedan puan maharani ganjar pranowo ahi cebong kampret autobingung cebong kampret auto akur oligarki tertawa,marah
pasang gaet idam amat mileni nilai unggul erickthohir bidang ekonomi bisni lengkap posisi capres ganjar pranowo politis tulen gaspol erick ganjar ganjarerickduetterbaik,senang
gak sabar nunggu ganjar pranowo presiden 10 genap 20 sakit,senang
amat politik uph emru sihomb sebut unggul erick thohir dunia ekonomi bisni lengkap ganjar pranowo birokrat politis tulen piawai pimpin bumn nilai erick thohir ganjarerickduetterbaik gantung plossa,senang
jabar deklarasi dukung ganjar pranowo bacapres 2024,senang
cocok presiden pk presiden indonesia biar ganjar pranowo aj,senang
pemgamat politik emru sihomb menteri bumn erickthohir cocok pasangankan ganjar thohir unggul bidang ekonomi milik jaring ganjarerickduetterbaik,netral
rekomendasi rapat pimpin nasion rapimna partai satu bangun ppp menteri pariwisata ekonomi kreatif menparekraf kader ppp sandiuno tugas cawapr damping ganjarpranowo,netral
calon presiden republik indonesia ganjar pranowo dorong penguru dpd pdi juang ntb rubah strategi kampanye milu 2024 sindonew news,netral
nama tokoh masuk bursa cawapr ganjar pranowo pilpr 2024 kaji dpp pdi juang kecuali nama mantan gubernur nusa tenggara barat tuan guru bajang tgb muhammad zainul majdi,netral
calon presiden capres pdip ganjar pranowo hadir resepsi nikah putri politiku senior pdi juang aria bima the dharmawangsa jakarta kebayoran jakarta selatan minggu malam sindonew news,senang
nama santer kabar menjadai cawapr ganjar pranowo pilpr sekian nama menteri sindonew news,netral
yg sungguh elektabilita yg sbg capres pdip puan maharani retweet ganjar pranowo like,marah
rawan omg riau deklarasi dukung ganjar pranowo presiden 2024 taman motuyoko awang kabupaten siak riau sabtu sindonew news,netral
konsolidasi ganjar pranowo lombok timur banjir kader pdip sukarelawan ganjarpranowo,netral
hadir acara dinas penandatanganan kerjasama bidang seni sanur ganjar pranowo sempat ikut undang jalan sehat lapang renon ribu orang sambut beliau,senang
dipungkiri jokowi kader pdip dukung ganjar pranowo usung pdip merahtegakluru,netral
momen tarik lawat bacapres ganjarpranowo nusa tenggara barat ntb minggu sempat ganjar pranowo sopir ketua hari nasion partai perindo tuan guru bajang tgb hm zainul majdi,netral
kereeen gubernur jawa ganjar pranowo jalan sehat bareng masyarakat grobogan rangka ingat lahir pancasila kabupaten grobogan even yg hadir puluh ribu masyarakat ronaldo axelsen onad innalilahi mandalika onic ronaldo tomcat,senang
pentol pdip amp partai demokrat petinggi 2 partai temu bilang coba ma ahi msk radar pdip baca wapr ganjar pranowo nasdem ma ahi wapr ani dar saran ma ahi ani 1000 gagal nie sayang uang mu sblm lang,netral
romeowalker19 presiden pk cocok presiden indonesia ganjar pranowo aj,senang
terobos ganjar pranowo sempurna sekolah virtual warga miskin difabel iphon 14 onad gint ronaldo onic indonesiaopen2023,terkejut
tuan guru bajang tani ganjar pranowo ziarah makam pahlawan nasion maulanasyaikh tgkh zainuddin abdul madjid pancor selong lombok timur,netral
ganjar pranowo buka suara tgb masuk bursa cawapr damping,netral
thalomoan1 ganjar pranowo peneru pakdh jokowi,senang
calon menang ganjar pranowo,senang
ingat hut ganjarist ketua ganjarist torut menang ganjar pranowo presiden ri,senang
calon presiden ri partai demokrasi indonesia juang pdip ganjar pranowo angkat bicara kelak damping pilpr 2024 sindonew news,netral
lihat video ganjar pranowo tiktok,jijik
ganjar pranowo dorong ekonomi sirkular implementasi misi presiden joko widodo gubernur jawa ganjar pranowo upaya wujud ekonomi sirkular jateng jalan salah misi perintah presiden joko widodo,senang
lari pagi agusyudhoyono apakabar koalisi ubah ani baswedan ubah ganjar pranowo,netral
abaaah test lembaga survey undang istana milik hasil nilai dng pool random twitter ani baswedan prabowo rt ganjar pranowo like cc bangediii kafiradikali doktertif,takut
kunjung calon presiden pdip ganjar pranowo kantor dpw partai perindo ntb damping ketua hari dpp perindo tgb hm zainul majdi,netral
kabar lombok ganjar pranowo,netral
ketua dpw partai satu bangun ppp ntb muzihir aku bahagia kantor partai kunjung langsung ganjar pranowo beliau ganjarpranowo tang pilih presiden pilpr 2024,senang
ganjar pranowo sowan kantor dpw ppp ntb,netral
ganjar pranowo syukur sowan sangu restu moga kuat semangat ganjarpranowo,senang
usung partai gabung pdi juang gabung kerja calon negosiasi ganjar pranowo,netral
hadir ganjar sambut rawan berswafoto rawan rebut foto gubernur jawa ganjar pranowo,senang
bener banget bu atiqoh ganjar pranowo belanja produk umkm tinggal langsung gerak ekonomi otomat daya beli jaga menjngkat cakep smart nih nyuwun sewu,senang
kalung sorban kha ppp ganjar pranowo hadir kantor dpw ppp ntb ganjar pranowo partai logo sahabatganjar,netral
ganjar pranowo peduli seniman,netral
alam usia muda cawapr ganjar pranowo,senang
rapat baris ganjar pranowo sambut riah warga rawan ntb ganjarpresiden ganjarcapreses2024,senang
rawan ganjar menang suara ntb ganjar pranowo kairi blacklist tukeran kiboy gu muhaimin axelsen onic gg onic,netral
konsolidasi menang pilpr 2024 ntb ganjar pranowo kairi blacklist tukeran kiboy gu muhaimin axelsen onic,marah
silaturahmi dpw ppp ntb ganjar pranowo kairi blacklist tukeran kiboy gu muhaimin axelsen onic,marah
sambur riah rawan ganjar lombok ganjar pranowo kairi blacklist tukeran kiboy gu muhaimin axelsen onic,marah
rawan ganesa ntb tunggu datang capres baik ganjar pranowo lombok timur ntb menang pdi juang perindo hanura ppp serta kuat rawan ganjar pranowo semangat kawan everyon ganesa ganjaruntukindonesiasatu,senang
faktor adi cema jokowi jalan dukung ganjar pranowo presiden,senang
kandidat capres rambut putih ganjar pranowo klo belah ngklaim dpt dukung rambutni cat putih dlu,netral
ntb ayooo dukung pilih ganjar pranowo presiden ganjar menang indonesia gemilang ganjar menang total ganesantb ganesa ganjaruntukindonesiasatu,senang
calon presiden ri ganjar pranowo sepeda soekarno 83 ketua penguru anak cabang pac pdi juang sumbawa soekarno salah tokoh gaek pdi juang sumbawa sindonew news,senang
rawan ganjar indoneaia ntb ganesa memerihakan acara silaturohmi capres ganjar pranowo kantor dpd pdi juang ntb kota mataram lapang nasion selong kab lombok timur,senang
gertak pdip utk koalisi perobahan ani cepat pilih ahi utk cawapr gertak jebak cepat tentu siap yg pilih jd calon wakil timbang pdip tentu sesuai cawapr ganjar pranow,takut
dukung warga jateng jatim ganjar pranowo 2024 alir,senang
momen acara maju ganjar mabar bal kemarin ganjar pranowo kenal apk jeknyong kpd masyarakat ajak kolaborasi putri lingkung hidup 2020 putu ayu saraswati bal woow apk dngn ai investasi 80 m lho,netral
kompastv nasdem target pileg pilpr pakai teropong bintang bacapres ganjar pranowo menang pilpr 2024 nasdem perintah hasil survey pesan bayar maknyu bakar kemenyan jumat kliwon eyang,netral
ahi puan maharani singgung cawapr ganjar pranowo,netral
pokok yg baik yaa ganjar pranowo org tau pakdementorganjar,senang
ganjar pranowo imam aja,marah
ganjar pranowo target menang 51 persen suara ntb blacklist axelsen tukeran kiboy erina gg onic gu muhaimin wanwan yoshi junkyu ekonomi fisika,marah
ganjar pranowo ajak kader pdip raih menang ntb blacklist axelsen tukeran kiboy erina gg onic gu muhaimin wanwan yoshi junkyu ekonomi fisika,marah
ganjar pranowo silaturahmi dpw ppp ntb blacklist axelsen tukeran kiboy erina gg onic gu muhaimin wanwan yoshi junkyu ekonomi fisika,senang
survei bukti ganjar pranowo pimpin indonesia kerja ganjar bukti warga negara ganjar baik,senang
hasil survei cnbc indonesia 2 mei 2023 prabowo subianto 17 ganjar pranowo 16 ani baswedan 67,netral
romeowalker19 agu pintar gabung pdip cawapr pa biar ganjar pranowo menang presiden ahi menteri biar alam kerja perintah tpi klu ag dukung ani psti klh dn opsi lg,takut
safari politik ntb ganjar pranowo sambang marka dpw ppp nusa tenggara barat datang ganjar pranowo sambut hangat kader partai logo kalung selendang kader partai kunjung ganjar harap kolaborasi,senang
kalung sorban kha ppp ganjar pranowo hadir kantor dpw ppp ntb ganjar pranowo partai logo sahabatganjar ganjarpranowo ganjar menangkanganjar generasigotongroyong,senang
ribu simpatisan sahabat ganjar mengaw datang ganjar pranowo kabupaten lombok timur minggu masyarakat lengkap atribut dukung pasti lewat momen temu sang calon presiden sambut,senang
ganjar dukung alih ganjar pranowo bukti ganjar pimpin indonesia,senang
calon presiden ri ganjar pranowo tekan kader penguru pdi juang ntb hasil baik presiden joko widodo masyarakat ntb sindonew news,senang
ganjar pranowo pilih rakyat indonesia blacklist pontianak axelsen kiboy honda erina tukeran wanwan besok senin choi seungcheol aang kairi worst concert gu muhaimin gg onic yoshi,marah
narasi kecuali jegal ani ulang ulang cm biar exi dimedso sdh alami buntu tau yg tampil sosok ani baswedan yg elektabilitasnya terjun beba ganjar pranowo menang 1 putar,terkejut
ganjar pranowo langsung tinjau baik sekolah komitmen blacklist bruno mar kairi erina kiboy worst concert pontianak tukeran axelsen choi seungcheol wanwan aang honda markhyuck jaya jaya jaya besok senin gg onic,senang
alfatih212426 yg tau kalo ganjar pranowo d dukung tukang sebar berita hoax jhonnisinaga2,marah
ratus kader pdip lombok amp masyarakat riuh sambut capres ganjar pranowo bandara lombok jokowi moga ganjar kelak menang lanjut cepat bangun ntb yg canang presiden jokowi,senang
sandiaga uno nilai cawapr jiwa muda tuga aspirasi generasi muda juang selara visi calon presiden besut pdi juang ganjar pranowo,senang
setyaki22965702 ganjarpranowo bpk ganjar pranowo lanjut mantap,senang
ganjar pranowo lombok internasion airport nusa tenggara barat datang calon presiden rambut putih langsung serbu ratus warga rawan sahabat ganjar sahabatganjar,senang
pimpin ganjar pranowo moga lanjut estafet pakdementorganjar,senang
capres pdi juang ganjar pranowo sebut partai ppp partai istimewa sikap politik partai lambang kakbah tentu helat politik nasion menangkanganjar generasigotongroyong sahabatganjar ganjarpranowo ganjar,netral
ballambinlov yulham rekam jejak ganjar pranowo 2 period jateng,marah
kmer212 bbrp dedengkot diri bara jp yg dukung ganjar pranowo,marah
rapimna vi ppp putus sandiaga ketua bapilu cawapr damping ganjar pranowo panglima tempur ppp simak lengkap pidato sandiaga uno panglimatempurppp,netral
ganjar pranowo temu rawan ziarah makam pahlawan ntb tempofoto,netral
rela rumah ajar guru honor motor ganjar aulia rizkia rahmawati guru honor sdn 1 karangwad camat tawang grobogan hadiah motor gubernur jawa ganjar pranowo hadiah aulia,senang
mari dukung ganjar pranowo pilpr 2024 ganjarcapres,senang
mantap ganjar pranowo dukung alumnus unpad ganjarcapres,senang
menteri bumn erick thohir konsisten posisi teras sanding prabowo subianto 4ni baswedan ato ganjar pranowo ganjarerickduetterbaik,netral
respon cepat adu aplikasi laporgub ganjar pranowo langsung tinjau baik sekolah komitmen gg onic erina axelsen besok senin tukeran honda pontianak blacklist aang tolol bruno mar kiboy ducati al hilal gu muhaimin yoshi,senang
mas ntb temu ganjarpranowo datang ganjar pranowo sambut sorak sorai nusa tenggara barat rawan sahabat ganjar warga semangat menangkanganjar generasigotongroyong sahabatganjar,senang
buka erickthohir damping ganjar pranowo kontestasi demokrasi berkat negosiasi pan pdip ganjarerickduetterbaik,senang
erick thohir pimpin oleh hasil survei lembaga survei erick thohir cawapr favorit ganjar pranowo oleh dukung kalah mahfud md ahi ridwan kamil ganjarerickduetterbaik,senang
erick thohir gaet suara jawa duet ganjar pranowo nilai potensi menteri bumn erickthohir pasang potensi kuat pilpr duet duet isi ganjarerickduetterbaik,senang
calon presiden pdi juang pdip ganjar pranowo sempat dialog temu kalang santri safari lombok nusa tenggara barat minggu sindonew news,netral
calon presiden capres ganjar pranowo dukung indonesia capres kontestasi pilpr 2024 sindonew news,senang
video jokowi bilang sila maki sila hina suka harap tahu henti utk bangun negeri sosok bilang plonga plongo kuru kere ceke motivasi idola ganjar pranowo,marah
si kutu loncat calon calon wakil ganjarpranowo doa moga gak wujud,jijik
bacapres ganjar pranowo sopir ketua hari nasion partai perindo tuan guru bajang tgb m zainul majdi kota mataram sindonew news,netral
suasana haru ganjar pranowo kunjung kantor dpw ppp ntb minggu doa ganjar air mata tuan guru haji tgh hazmi hamzar net sindonew news,sedih
calon presiden bacapres pdi juang pdip ganjar pranowo aku kagum pondok pesantren darunnahdlatain nwdi pancor lombok timur nusa tenggara barat ntb sindonew news,terkejut
kuat negara ganjar pranowo percaya rakyat kpd pimpin ganjar sabar tampung inspirasi aspirasi ekspresi masyarakat sukses ganjar buah sabar ganjaruntukindonesiamaju,senang
rawan santri dukung ganjar ajak santri doa latih ekonomi kreatif santri kripik singkong pondok pesantren rhodotul uqul ganjarforpresident2024 santridukungganjar ganjarpilihanrakyat,senang
mudah mudah ntb menang ganjar pranow,senang
kmer212 ganjarpranowo ratus kader indramayu asli kader nasdem danberalih perindo dukung ganjar pranowo,senang
nampaknya satu2nya capres yg dukung alas hasil ganjar pranowo salut utk rawan ganjar pranowo dlm ganjar terobos utk hasil rakyat jawa kenegarawanan hadap resesi globa,senang
ganjar pranowo hadir nikah putri politiku pdip aria bima jakarta okezon beritaterkini berita news beritanasion,netral
ayo satu baris dukung ganjar pranowo for presiden 2024 ganjarbawakemajuan ganjarfor2024 dukungganjar,senang
rapat baris ganjar pranowo ganjarbawakemajuan ganjarfor2024 dukungganjar,senang
calon presiden bacapres pdi juang pdip ganjar pranowo kagum pondok pesantren darunnahdlatain nwdi pancor lombok timur nusa tenggara barat ntb sahabatganjar ganjarpranowo ganjar menangkanganjar generasigotongroyong,terkejut
capres pdi juang ganjar pranowo sebut partai ppp partai istimewa sikap politik partai lambang kakbah tentu helat politik nasion sahabatganjar ganjarpranowo ganjar menangkanganjar generasigotongroyong,senang
calon presiden capres pdip ganjar pranowo aku kagum indah alam lombok nusa tenggara barat ntb salah yg blm wujud lombok daki gunung rinjani sahabatganjar ganjarpranowo ganjar menangkanganjar generasigotongroyong,terkejut
ganjar pranowo pimpin sabar sahabatganjar ganjarpranowo ganjar menangkanganjar generasigotongroyong,senang
komunita crypto indonesia ganjarpranowo milik hold ganjar tunjuk dukung ganjar pranowo presiden indonesia price chart buy from pancak swap,senang
salawat kumandang sambut datang ganjar pranowo kantor dpw ppp ntb,senang
dukung gari kera padeh ganjar pranowo masmen bumn erick suara dua tokoh bangsa calon pimpin baik mengggantikan padeh jokowi lanjut program kerja bangun,senang
ayo brsama dukung ganjar pranowo the next presiden ri ganjarcapres,senang
ganjar pranowo yg ganti jokowi mendkung ganjar sosok pimpin yg cinta rakyat ganjarcapres,senang
alumnus unpad nyata dukung ganjar pranowo dkungan ganjar sbg capres 2024 smakin kuat ganjarcapres,senang
alumnus muda unpad ganjar pranowo sosok pimpin berani komunikatif peduli luw,senang
ganjarpranowo bagu dlm bikin kata2 nya sebagu ganjar pranowo capres pdip yg menang pilpr 2024,netral
pilih rakyat yg asli anak pribumi nusantara yai ganjar pranowo yg peneru jokowidodo yg klopun yg asli pribumi ahli capres ngerecokin aja bodoh goblok,marah
mabar maju ganjar ganjarcapres,senang
mutiaraskin69 hasil ganjar pranowo pimpin jawa modal bangun indonesia depan ganjarcapres,senang
bacapres pdip ganjar pranowo temu puluh ribu gemar ntb,senang
asliindonesia11 hasil ganjar pranowo pimpin jawa modal bangun indonesia depan ganjarcapres,senang
jennycantika18 dukung warga ntb ganjar pranowo ganjarcapres,senang
asliindonesia11 ganjar pranowo next presiden ganjarcapres,senang
mutiaraskin69 pilih ganjar pranowo ganjarcapres,senang
asliindonesia11 ganjar pranowo bangun indonesia depan ganjarcapres,senang
asliindonesia11 ganjar pranowo capres baik ganjarcapres,senang
ribu simpatisan sahabat ganjar mngawal datang ganjar pranowo kabupaten lombok timur minggu masyarakat lengkap atribut dukung pasti tdk lewat momen temu sang capres sahabatganjar ganjarpranowo ganjar menangkanganjar,senang
jennycantika18 hasil ganjar pranowo pimpin jawa modal bangun indonesia depan ganjarcapres,senang
jennycantika18 pilih ganjar pranowo ganjarcapres,senang
jennycantika18 ganjar pranowo capres baik ganjarcapres,senang
gen z mileni bal diskus ganjar pranowo,netral
ucap adlh doa amp ucap yg hr negara sbesar indonesia hr dpimpin org yg mncintai agam org yg rawat kebhinekaan krn indonesia trdiri dri brbagai suku agama amp adat istiadat bkn dpimpin sm org yg robek tenun kbangsaan,takut
moga orang ntb pilih ganjar pranowo petuga partai pdip jokowi,senang
alumnus universita padjadjaran dukung ganjar pranowo,senang
