quoted_text,emosi
rstmbcl ganjarpranowo ganjar pranowo presiden peneru kerja presiden jokowi cepat prose bangun ikn nkri harga mati anies rasyid baswedan minat,marah
kalah semangat dr dukung anies baswedan daerah2 sore masyarakat jg dukung anies baswedan semangad,senang
viral hadir anies baswedan laut massa warga gorontalo hadir jalan santai dukung ubah,senang
rusli habibi gubernur gorontalo juru bicara menang mendagri diam tdk tegur anies baswedan gubernur dki salam sdh tegur adil negara,senang
pakai biji mata kau cebong acara jalan santai hadir anies baswedan kota gorontalo masyarakat kota gorontalo bondong ikut anies hati masyarakat gorontalo paham kau cebong,marah
anies baswedan antitesa jokowi bukti jakarta orang gubernur dki normalisasi sungai ciliwung adil ga hirauka,marah
insyaallah allah keluarga d makassar pilih anies basweda,senang
sy jm alumnus universita hasanuddin makassar universita krisnadwipayana jakarta dukung capres anies baswedan presiden,senang
kalo anies baswedan visi misi ngarang,jijik
emg luhut pasal konstitusi yg wajib presiden pilih hr lanjut kkn jokowi dgn proyek unfaedahnya presiden pilih 2024 insyaallah anies baswedan yg atur amp jd boneka oligarki 9 contoh reklamasi teluk jk,senang
anies baswedan ngk capres relawananieseskrimin htifpidukunganies aniesesdidukungkhilafah aniesesnasdemout tenggelamkananiesesbaswedan tenggelamkanpartainasdem aniesesdidukungkoruptor aniesespendukungkhilafah aniesespendukungormasradik,marah
waspada anies baswedan antek khilafah kelompok intoleran relawananieseskrimin htifpidukunganies aniesesdidukungkhilafah aniesesnasdemout tenggelamkananiesesbaswedan tenggelamkanpartainasdem aniesesdidukungkoruptor aniesespendukungkhilafah aniesespendukungormasradik,takut
kerja nyata anies baswedan abisin duit 400 t,marah
poll yuk biar rekayasa rakyat indonesia pilih salah capres favorit tunjuk capres pilih benar2 raih suara prabowo like anies baswedan retwit ganjar pranowo komen pollingcapres capreses2024,marah
husinshihab pilih anies basweda,senang
ekowboy2 wkwkwkwk pers lamben anies basweda,jijik
anies hasil bangun 5 pimpin dki jakarta anies indonesia,senang
ragu pilih anies baswedan beliau kerja rakyat kader bangsa kerja partai kader partai beliau ganti terus proyek yg biaya membebanies negara beliau lanjut,senang
goda pdip demokrat solid dukung anies baswedan pilpres 2024,senang
isnainyudin gade yg retak anies baswedan upaya baik tarap ekonomi masyarakat wilayah,senang
anies baswedan beda reta hubung silaturahmi,senang
calon presiden koalisi ubah satu kpp anies baswedan kritik bijak perintah kait beri subsidi kendara listrik electr hubung cepat cepat program,senang
ardhaniesfariz susan1612 allah tampak kasih sayang nya anies baswedan krn beliau tulu bangun sirkuit bahagia jakarta rakyat indonesia tingkat ekonomi sekitar sirkuit event laksana sehat anies,senang
geiszchalifah bangga baris semangat anies baswedan,senang
sutanmangara pilih anies baswedan serah negara kaum kapitalism sma anies rekrut amerika negeri jelek jelek indonesia anies baswedan asli darah indonesi,senang
dungu syndrom,marah
dssupriyadi kompascom sekolah om rock and roll ae kerja lo malu2in otak udang nyinyir langit gw liat tweet lo aja cring geli level dukung anies baswedan serendah klo debat gak substansi onli hate cupu,marah
outlook lanjut akun twitter tegas nama akun akun yg songsong ubah nama anies baswedan tokoh sentral ubah akun anti rejim biadab memfollow mari juang datang era ubah,marah
bianca01403 anies baswedan sosok leader dg leadership yg matang rekam jejak 1 period dki mjd bukti rk puji sukses beliau tsb aniesespresidenrakyatwara aniesespresidenrakyatwara,marah
diskriminasi minorita 5 anies baswedan pimpin jakarta pimpin anies bawa imbang selaras insyaaallah 2024aniesespresiden,senang
forrezim kakaunpingin ngliat tangkap kpk 2024 pilih anies baswedan presid,marah
husinshihab 2024 pa anies baswedan ri 1,senang
dukung anies basweda,senang
anies baswedan sosok nasional     itstim partainasdem restorasiindonesia gerakanperubahan nasdembersamarakyat aniesesbaswedan,senang
pd tahu sifat asli,jijik
detikfin terimakasih anies basweda,senang
vivacoid hr pilih yg bener2 cerda kerja dgn bukti rekam jejak salah anies baswedan kondisi negara yg rusak utang yg proyek2 mangkraj dpt ubah baik dgn cepat,marah
anies baswedan juluk integrasi rakyatgelarpeoplepow rakyatgelarpeoplepow,marah
abdillah baswedan periksa gratifikasi kominfo merdekadotco,marah
prabawananda aniesesbaswedan kejaksaanri buka link nya,marah
anies baswedan dukung radik pimpin,marah
khawatir dukung ma anies baswedan demokrat setia koalisi ubah moga elit nasdem gak bikin gaduh tunjuk ketidaksukaan terhdap ma ahi klo gak suka yg suka ama yg gak suka,marah
kerja kek gin nyapr anies baswedan pimpin,marah
habisin uang rakyat aja ni anies baswedan yg bangun banyak ga manfaat masyarakat,marah
reaksi anies baswedan baca ai anies baswedan aku gusar tanggap hasil survei jago nama pilpres 2024 aniesesbaswedan pemilu2024 pilpreses2024 tiktokmetrotv presiden capres presiden2024,takut
jadi indonesia anies baswedan presiden presiden beda ya bahaya nkri yg nama bangun lanjut,senang
lari pagi agusyudhoyono apakabar koalisi ubah anies baswedan ubah ganjar pranowo,senang
anies baswedan tegas lanjut program jokowi presiden,senang
abaaah test lembaga survey undang istana milik hasil nilai dng pool random twitter anies baswedan prabowo rt ganjar pranowo like cc bangediii kafiradikali doktertif,marah
laku ustadz dukung anies baswedan sebar hoax amp fitnah jual agama ksp urusin pencapresesan anies ustadz mabuk anies ga tampil tv tv kadrun tayang ustadz usak islam,marah
hti fpi prediksi muncul anies baswedan presiden aniesespencitraan waspadacapresesgag,marah
tfkakbarr tweetmilit smean kyk anies baswedan hiih jilat bool rusi,jijik
salut tims anies baswedan suka lupa beda kuasa kuat anggar gubernur dki jakarta gubernur jateng pokok e ae angel ndue omah nang jakarta ae kalin ra tau normal wi ngerti dew,marah
kegblgnunfaedh teliti memvoni orang salah gak tau salah orang dukung anies basweda,marah
indondsia milik presiden cerda negara hebat yg cerda anies baswedan istri selamat presiden ri 8 anies jegal si tukang cawe2 otomat rakyatgelarpeoplepow rakyatgelarpeoplepow,senang
anies baswedan moga beliau next presiden indonesia,senang
terimakasih teman partai yg tawar kontestasi pileg terimakasih baik foku menang anies baswedan,senang
politiktatakata chleoouk rocki gerung anies baswedan layak calon presiden aniesesnasdem,senang
gaya bahasa anies baswedan bu feri farhati sejuk insyaallah 2024 rakyat yg hau ubah dukung menang anies baswedan 2024,senang
waspada gerombol kadrun buzzer 2 onta main hoax pilpres 2014,marah
vivacoid makasih salah milih ya pilih anies baswedan yaa,marah
kanjeng2022 dijeg takut anies basweda,takut
cutsarina5 sop buzzerp emang kek gitu uji akal sehat ajar anies baswedan lantik gubernur jakarta gak baik beliau pengaruh suks jakarta insyaallah sukses 2024,senang
hasil survei cnbc indonesia 2 mei 2023 prabowo subianto 17 ganjar pranowo 16 anies baswedan 67,senang
anies baswedan mana yaaa,jijik
satriohendri paramadina yg bilang ganteng nilai a dosen nilai2 anies basweda,senang
anies baswedan orang indonesia angkat anggota dewan institut for asean studi oxford school of global and area studi indonesia pimpin kela dunia,senang
emak banso diam2 tolak akang denma emak banso alih ma anies baswedan,senang
kangdede78 erickthohir menakutkanya anies baswedan in,marah
narasi kecuali jegal anies ulang ulang cm biar exi dimedso sdh alami buntu tau yg tampil sosok anies baswedan yg elektabilitasnya terjun beba ganjar pranowo menang 1 putar,marah
antipekin kaji edan yg biaya ma anies baswedan,marah
ganjarpranowo manteman jawa sila ajar kerja prestasi anies baswedan buku rekam jejak anies jakarta cocok diteladanies kepala daerah indonesia rekomen banget,senang
kompastv pk nasdem koalisi radar isu tiup dikuatirkan persepsi konstituen bacapres anies baswedan gampang percaya hasil survey pesan bayar,senang
blom menang aja sdh mo bohong lanjut tapi gk percaya antitesi jokowi anies baswedan tegas lanjut bangun ikn pilih,marah
best predictor for your futur is your past basweda,senang
dennysiregar7 lha sdh ramal anies gagal capres sumber intern partai dukung bukti belum2 sdh nuduh2 yg jegal catat sejarah bacapres yg nama anies baswedan,jijik
husinshihab lurah 2024 pilih anies baswedan presiden 2024,senang
geloraco udah kali rua yg b jumpa bpk yg makan gaji dr negara dgn anies baswedan yg warga negara tulen jabat utk diskus yg sadar si tua offsid hak wni utk pilih milu,marah
anies baswedan atas banjir parkir air trotoar jalan aspal lubang sumur resap sungai natur gak hujan alir laut langgar sunatullah,senang
padmavatiprati1 tanya uah i warga dki yg sak anies baswedan sikap uah,senang
cutsarina5 orang pinter presiden anies basweda,senang
fakta realita masuk akal anies baswedan cakap kelola bijak perintah yg martabat anies baswedan jabat presiden ri,senang
waspada indonesia hancur pimpin anies baswedan,takut
getaranrakyat chleoouk anies baswedan usaha rubah lambang negara pancasila khilafah aniesesnasdem,takut
yg anies baswedan ilmu agama lbh dr kontestan yg blh d adu capres yg,senang
nah2 bongkar2 iwan fal lksp kpk tuntas skandal korupsi jamaah anies baswedan dprd dki,senang
paketayang ganjarpranowo bpk anies basweda,senang
amniesbaubadan chleoouk rocki gerung anies baswedan layak calon presiden aniesesnasdem,senang
pabloherlambang tsamaradki jokowi ganjarpranowo bener2 kalimat dukung anies ya anies baswedan si liber bangga simpatisan bigot mulut biadab spt antum,marah
politiktatakata mridwan1805 chleoouk rocki gerung anies baswedan layak calon presiden aniesesnasdem,senang
yakin ijazah gak ragu asli anies baswedan for presiden 2024,senang
politiktatakata getaranrakyat chleoouk anies baswedan usaha rubah lambang negara pancasila khilafah aniesesnasdem,takut
sakiaruna chleoouk anies baswedan usaha rubah lambang negara pancasila khilafah aniesesnasdem,takut
ganjarpranowo bismillah anies baswedan,senang
alhamdulillah tembu terima kasih ya teman teman dumay dukung anies baswedan,senang
democrazymedia uda tua udah produktip kasi anies baswedan,senang
fadlizon calon wakil presiden anies baswedan aamii,senang
butuh ubah anies baswedan solusi,senang
politiktatakata amniesbaubadan chleoouk rocki gerung anies baswedan layak calon presiden aniesesnasdem,senang
adik bacapres anies baswedan pinter korupsi nggak doyan duit,marah
surabaya jawa timur sambut datang anies baswedan,senang
mridwan1805 chleoouk rocki gerung anies baswedan layak calon presiden aniesesnasdem,senang
anies baswedan layak calon presiden,senang
gk tipu survei krn anies baswedan mesti diata 60 insyaaallah anies baswedan menang pilpres ri thn 2024 putar,senang
wallaaahhh gegara cuit ekowboy2 inyong tahuu klo adik aniesesbaswedan sangkut korupsi kominfo kali inyong bertengkiyuuu ama ent ekowboy2,marah
kumpul hoak catut nama anies baswedan baru simak daftar,marah
amniesbaubadan chleoouk anies baswedan usaha rubah lambang negara pancasila khilafah aniesesnasdem,takut
yulham dukung insyaallah pilih anies basweda,senang
bedah 4 anies baswedan pimpin dki pakar politik tonjol htidukunganies aniesesdidukungkhilafah aniesesnasdemout tenggelamkananiesesbaswedan tenggelamkanpartainasdem goodbyenasdemanies aniesesdidukungkoruptor,jijik
tukangaduayam guna dunia ingat anies baswedan guna dunia,senang
geloraco insyaallah tabarakallah anies baswedan,senang
kangdede78 aniesesbaswedan elo kalang kabut kagak percaya survey anies baswedan for presiden ri 2024,marah
hti fpi prediksi muncul muncul anies baswedan presiden htidukunganies aniesesdidukungkhilafah aniesesnasdemout tenggelamkananiesesbaswedan tenggelamkanpartainasdem goodbyenasdemanies aniesesdidukungkoruptor,marah
mridwan1805 amniesbaubadan chleoouk anies baswedan usaha rubah lambang negara pancasila khilafah aniesesnasdem,marah
politiktatakata chleoouk anies baswedan usaha rubah lambang negara pancasila khilafah aniesesnasdem,marah
parah skenario kuasa jegal anies baswedan menang pilpres jokowisaatnyamundur jokowisaatnyamundur,marah
ekowboy2 adik anies baswedan sangkut korupsi thank eko udah bikin gw,marah
rachlannashidik sdh pdemokrat jati bkn sbg followernya nasdem aplg bebek anies baswedan koalisi dgn mrk yg sempat menang lbh kuasa jd menteri tp lbh drpd jd oposisi hr bgmn,marah
mridwan1805 chleoouk anies baswedan usaha rubah lambang negara pancasila khilafah aniesesnasdem,takut
generasi muda gila bola turun elektabilita anies baswedan analis lsn sebab faktor tetap capres partai nasdem,marah
hasil prabowo subianto unggul provinsi ganjar pranowo dominan provinsi anies baswedan pimpin provinsi provinsi saing prabowo ganjar ketat sulit simpul unggul,senang
waspada anies baswedan antek khilafah bapakpolitikidentita,takut
ekowboy2 mmg berita hoax sy nih klu kayak gin dibiarin aja lama masyarakat percaya bhw berita mmg rugi anies baswedan,marah
dukung anies baswedan insyaallah,senang
beranies tolak politik identita bawa anies baswedan bukti nyata cinta juang utuh nkri hancur axelsen jenni erina bruno mar gint puan onic aang tvri nabilataqiyyah besok senin germangp gu muhaimin yoshi cakep banget lombok arin,senang
membenc maki lawan politik turut kandidat capres gadang maju pilpres 2024 ganjar pranowo anies baswedan putra baik bangsa tuga partai politik maju calon presiden,senang
anies baswedan anugrah allah swt doa 2 amp ter tinda zholimi yg dukung kho phing ho juang bpk anies ber hasil amp selamat,senang
maksa ntb milih anies baswedan paham sisi,senang
juang bpk anies baswedan juang nabi juang fi ber hadap dgn yg zholim rakyat amp nabi selamat umat,senang
anies baswedan depan anies aniesespresidenri2024,senang
sumber gaduh mk dennyindrayana sbyudhoyono dukung anies baswedan kalo hoax tangkapdennyindrayana yg sebar manfaat unk penting kelompok adil listyosigitp,senang
mohmahfudmd oh iya lupa share saudaraaaa satelit wujud nyata gagas narasi anies baswedan mantau kali ciliwung ikan2nya angkasa,senang
anies baswedan matahari indonesia,senang
kalang komunita sepak bola tanah air generasi muda gila bola turun elektabilita anies baswedan analis lsn sebab faktor tetap capres partai nasdem,marah
tolak datang anies baswedan riau mahasiswa yg ngakunya peduli demokrasi tp laku otorit kayak komuni intelek nol koma curi star kmpany satu capres yg tetap kpu dasar bongaaaaak p nteeek,marah
tolak anies baswedan dukung kelompok radik hti fpi,takut
waspada hti fpi prediksi muncul anies baswedan presiden,takut
provinsi ganjar pranowo dominan provinsi anies baswedan pimpin provinsi provinsi saing prabowo ganjar ketat sulit simpul unggul temu lsn kecenderunga,senang
waspada anies baswedan dukung kelompok radik hti fpi ancam bangsa pecah belah umat,takut
hti fpi dukung anies baswedan presiden,senang
anies baswedan antek khilafah,marah
maki lawan politik turut kandidat capres gadang maju pilpres 2024 ganjar pranowo anies baswedan putra baik bangsa tuga partai politik maju calon presiden,marah
ulama bangkal dukung ahi gandeng anies baswedan xr1 agusyudhoyono pdemokrat pd bareng ahi,senang
bahaya tolak anies baswedan,takut
ulama bangkal dukung ahi gandeng anies baswedan 2024 cx7 agusyudhoyono pdemokrat pd bareng ahi,senang
momen ahi silaturahmi rumah anies baswedan sambut hangat dy6 agusyudhoyono pdemokrat pd bareng ahi,senang
tegas bacapres anies baswedan demokrat komitmen ahi go8 agusyudhoyono pdemokrat pd bareng ahi,senang
freedomland3l3l sanusiundin namatanpaspasi tiosat6 amandolok culunsejati1 brianjones2022 bianca01403 sutoposolo48098 cintarosul59 istana genggam pepes kosong genggam pdip jateng kandang banteng istana pasang kaki kaki anies baswedan aniesespresidenrakyatwara aniesespresidenrakyatwara,senang
teman ahi milik chemistri anies baswedan pt9 agusyudhoyono pdemokrat pd bareng ahi,senang
sgits1 orang2 bego dungu sih gak hasil karya anies baswedan,marah
ulama bangkal dukung ahi gandeng anies baswedan lc2 agusyudhoyono pdemokrat pd bareng ahi,senang
ulama bangkal dukung ahi gandeng anies baswedan ef5 agusyudhoyono pdemokrat pd bareng ahi,senang
politik turut kandidat capres gadang maju pilpres 2024 ganjar pranowo anies baswedan putra baik bangsa tuga partai politik maju calon presiden,senang
enam maha karya anies baswedan pimpin dki jakarta,senang
bubar mimpi anies baswedan,marah
vivacoid terima kasih saran insyaallah pilih anies basweda,senang
yg menjeg anies baswedan kecuali parpol dukung,marah
moga demokrat cabut koalisi anies baswedan,marah
cnnindonesia ketua pssi nya anies baswedan goreng buzzer buzerp jare hitam diata kali aja bahan goreng buzzer buzerp,marah
andisinulingga insyaallah 88 suara rakyat ntb utk anies basweda,senang
cnnindonesia rakyat skrg tuju jegal anies baswedan tuju bisni eksploitasi sumber daya alam indonesia asin,marah
mocicang hti fpi prediksi muncul anies baswedan presiden aniesesbaswedan aniesesdidukungkoruptor aniesesgaben,marah
anies baswedan presiden hti fpi potensi muncul ancam pluralism toleransi indonesia milik sejarah kontroversi ganggu stabilita politik maju negara inklusif,takut
rakyat indonesia wujud sbg presiden ubah amp baik bahagia rakyat indonesia 2024,senang
orang ntb biidznillah 88 suara rakyat ntb utk anies basweda,senang
candra25837483 dennysiregar7 ahi puan ganjar menpora sapa yg tau ya gk klok aq gk peduli aq ttp setia mndukung anies baswedan aniesespresidenri202,senang
luhut ditud temu surya paloh london cabut dukung anies baswedan,marah
video hoak,marah
wonogiripd lihat survei karya cipta manusia yg kalah karya cipta allah jadi anies baswedan yg gemilang,senang
hti fpi prediksi muncul anies baswedan presiden aniesesmembawakehancuran tolakanieses2024,takut
rekam jejak buruk anies baswedan aniesesgabecu aniesesgaben aniesesdidukungkoruptor tenggelamkananiesesbaswedan,marah
warga miskin dki jakarta tambah pimpin anies baswedan klik lihat video baca berita iklan download aplikasi,marah
anies baswedan hina rendah membuli memvoni sepele paksa radikal bodoh warga anak bangsa,marah
teddgu sehat suks anies baswedan,senang
budich loe anies baswedan orang yg pikir dg loe dukung anies loe udah gila ya loe dukung denbokep hiduplu mulia,jijik
adik anies baswedan periksa bareskrim polri komisar pelni sindir tohok,marah
anies baswedan gagal total ga kerja janji aniesespembohong aniesesbaswedan aniesespresidenri2024 aniesesgag aniesespendukungormasradik aniesesdidukungkhilafah aniesesantekcendana,marah
presiden ri 2024 anies rasyid baswedan prabowo subianto ganjar pranowo ridwan kamil airlangga hartarto sandiaga uno erick thohir total suara 197108,senang
hti fpi prediksi muncul anies baswedan presiden aniesesbaswedan bapakpolitikidentita aniesesdidukungkhilafah aniesesdidukungkoruptor tolakanies,takut
nugrohodjati76 doktertifa iya klo yg jd pleciden nya anies baswedan lahhh klo yg jd presiden nya ganjar pranowo yaaa nyanyi dgn lirik nya yg sumbang nyinyir,marah
antek khilafah anies baswedan aniesesbaswedan aniesesradik pemiluserentak2024 pemilu2024 likeforlik trend follom trendinghot,jijik
jegal anies baswedan kencang dukung seru lawan,marah
ganjarpranowo tuju biar ganjar tonton menang pilpres anies basweda,senang
sbi dukung anies lho dik agu,marah
alas dosen universita esa unggul jakarta muhammad fauzi undang anies baswedan uji sidang disertasi anies baswedan figur baik bangsa indonesia dlm sidang buka harap dpt bawa manfaat baik aniesesah,senang
teman2 demokrat yg pinter tak mudah khianat anies baswedan amp kelompok ubah bravo demokrat,senang
partai anak muda sang anies baswedan,senang
hancur jakarta anies baswedan axelsen gint aang zoro worst concert tvri onic one piec gantung plossa jungwoo sd inpr  zuko iphon 14 mnctv bruno mar  ive47thwin gangnamxb   knockknock salmasalsabil tudum,marah
sukardi2017 dasar bangsat emng lu sukardi2017 si biawak aje dah hapu postingannya listyosigitp min min turnbackhoax tolong sebar hoax kyk sukardi2017 kandangin aje gampang nyarinya inimah tampang jg,marah
oposisicerda ya udah biar lega hibur selamat anies baswedan 2 lembaga survey yg tempat posisi buncit ipo ilk,marah
kompascom yg salah anies baswedan,marah
kangmanto123 kejaksaanri link berita yg kau post monyet silah buka berita tgl 14 februari 2017 6 thn saat anies nyagub dki,marah
sesat cina tagih utang perintah indonesia anies baswedan ken internasion tempocekfakta cekfakta,marah
tukangrosok22 ha ha ha buzzer2 istana boneka emang tolol2 kakak bina nya aja tolol wakakaka hoax nih,marah
mlu dngn sndirinya stelah mngkritik anies baswedan dngn bngun sirkuit formula e kta tinggal 5 bln lgi amp mnghambur hamburkn uang wrga anies rampung 54 hri 2 bln yg 3 bln kritik,marah
vivacoid inshaa allah sayamah pilih anies baswedan aja,senang
agusyudhoyono tru gimna dgn anies baswedan,marah
antek khilafah tuju anies baswedan diri khilafah nkri waspada aniesesdidukungkoruptor aniesesgabecu aniesesgaben aniesesbikinmalu,takut
tolak anies baswedan aniesesdidukungkoruptor,marah
anies baswedan berment bo buka mental pimpin rakyat,marah
dade88020008 prabusantoso1 agusyudhoyono pdemokrat ooo nasdem pk dukung anies baswedan semangat ma ahi,senang
pdemokrat agusyudhoyono aniesesbaswedan cebong stree ganjar pranowo ngak presiden yg presiden indonesia anies baswedan ubah proyek mercusuar yg rugi uang negara stop ikn kai,marah
anto1157 ahmadsalam0741 jangkrikgengg15 meffendi03 ccindydd86cindi presidenndableg darmara02177184 abee45472430357 farrahsama petanies tekor miskin panen anies angkat sejahtera petanies anies baswedan tirakat kandang banteng nahdliyin atas hadap sawah cilik aniesespresidenrakyatwara aniesespresidenrakyatwara,marah
husinshihab si bro husin jgn panggil habib ya blm te dna kwartir turun yahudi tru husin ga nyamp nalar makna yg anies baswedan,marah
nasdem tenggelam prediksi elektabilita anies baswedan turun,marah
tvonenew pilih anies baswedan masuk surga,senang
nenkmonica anies baswedan presiden ku,senang
husinshihab org yg berak sehat slalu yg baik jd pimpin nya amp insya allah sosok anies baswedan,senang
hilmi28 aamiin moga indonesia pimpin anies baswedan,senang
lebih anies baswedan sungguh komplit heran rakyat puji dukung maju presiden ayo kawal sukses milu 2024 jalan jurdil semangat lihat video satga abw tiktok,senang
indonesia butuh ubah nyata anies baswedan aniesespresidenku aniesespresidenri2024,senang
vivacoid kasar pilih anies baswedan,marah
smg bang anies rasyid baswedan pimpin indonesia 2024 bawa ubah bangsa rakyat yg puruk kuasa yg tdk amanah aamiin,senang
dennysiregar7 kh anies baswedan reformasi intrnasion presiden wapr ideal ubah indonesia stopikn stopmobillistrik stopasen,senang
surabaya pecah anies baswedan jawa timur ubah anies baswedan jokowisaatnyamundur jokowisaatnyamundur,senang
bangsat dukung anies makzul jokowi,marah
aniesesbaswedan pksejahtera nasdem pdemokrat tuju dg anies baswedan semangat gulir narasi bangsa,senang
rawan i love you cinta and i love you almost full,senang
ahi nasib anies baswedan temu partai demokrat pdip cawapr ganjar gint ronaldo gu muhaimin tvri xavi onad sd inpr zoro idul adha sidang isbat capres 2024,marah
vivacoid laksana presiden krn pilih anies baswedan,senang
kakek ayah anies baswedan,senang
asli cebong tolol berita 2017 edit 2023,marah
2009 anies baswedan gera indonesia ajar inspirasi muda indonesia bangun bangsa didik itstim partainasdem restorasiindonesia gerakanperubahan nasdembersamarakyat aniesesbaswedan adityawilli,senang
nasdem aniesesbaswedan mati kt rapat baris unk dukung bpk anies baswedan maju ri 1 202,senang
husinshihab sutanmangara deret harga era anies baswedan 2021 nomor 1 bikin wo,senang
husinshihab yg jokowi yg dendam anies baswedan,marah
capres anies baswedan tahan penting pribadi normalisasi kali item jalan layang non tol mangkrak apbd pakai tugpp jumbo hibah2 orma lsm dukung politik,marah
tarik jakarta anies basweda,senang
vivacoid tenangbpa paham pilih anies baswedan utk indonesia ubah yg lanjut 10 dgn roket hutan,senang
dear dukung anies baswedan debat kusir buzzerp hatersnya mend up prestasi beliau 14 prestasi anies baswedan 5 gubernur dki jakarta,jijik
tuju dapat anies baswedan ngak layak ngak lanjut,marah
ganjarpranowo jokowi lu liat kelompok agama gak pilih anies baswedan beliau layanies dg jiwa jabat gubernur hebat,marah
klo percaya survey kh anies baswedan bohong alim sgt agami lembaga survey nya tokoh publik yg sgt hormat indonesia tifatul 84 masyarakat indonesia dukung kh anies,marah
ganjarpranowo jokowi cengeng komplot lu bulli formula e jakarta dr ngerendahin ngehina ngejeg ngeboikot tutup sponsorship samp ngelaporin kpk anies baswedan undang kasih panggung jokowi puan maharanies acara suks dpt atensi internasion hebat,marah
imamsyakh tinggal partai biru alih partai merah konsisten dukung kh anies baswedan presiden maha indonesia takbii,senang
jegal anies baswedan klaim isap jempol modus 2,senang
dukung juragan bok3p sudut fakta bhw anies baswedan nkri aniesesbaswedanlebihnkr,marah
milu terus program perintah presiden maksud rezim jokowi lempang jalan tuju republik indonesia,marah
helleeeeh nggedabrush jakarta aja tipu indonesia adeknya abang susul,marah
kangdede78 aniesesbaswedan anies rasyid baswedan kereeen mantaaaap,senang
aniesesbaswedan jakartasatu sich gagas aniesesbaswedan kait nasib rakyat indonesia serikat kerja nasion undang anies baswedan diskusi jamso semesta hayat,senang
indonesia sungguh butuh ubah rakyat harap anies baswedan,senang
insyaa alloh anies baswedan presiden ri 2024 aamiin,senang
kompastv insha allah anies rasyid baswedan masyarakat ntb cc,senang
dukung anies baswedan presidenri2024 alumnus itb deklarasi anies baswedan presiden ri 2024,senang
husinshihab rekam jejak yg ban fitnah buzzerrp anies baswedan,jijik
