quoted_text,emosi
film bioskop anies baswedan senyum manies lovestori cristiano ronaldo malm innalillahi tidur tomcat turu sd inpr mandalika suami the prophet arin dennyindrayana nasdem pdemokrat agusyudhoyono pksejahtera argentina argentina indonesia senyummanies,marah
imajinasi karang,netral
gegap gempita kenal anies baswedan dgn judul senyum manies love yg produksi film prose pra produksi sutradara film lihat video senyummanieseslovestorymovi tiktok,netral
dukung anies baswedan presiden ri 2024 pddibegaljokowidimakzulkan pddibegaljokowidimakzulkan,senang
giginpraginanto akhlak moralita ganjar pranowo presiden anies basweda,marah
jakarta kuasa anies baswedan lingkung rusak investor gak hutang numpuk kalo kerja dasar gagas bas narasi ndak tau nanya jakarta hancur kerja ngak becu pilih presid,marah
geiszchalifah lo ngomong udah kayak kentut si manusia astral yohan anies baswedan botak kepala lo gw belah muka yaman lo mulut isi kotor dungu,marah
putraerlangga95 inshaa allah anies rasyid baswedan presidennkri202,senang
kangdede78 aniesesbaswedan drevachaniesago stevaniesehuangg ariemutyara bangediii cutsarina5 geiszchalifah hukumdan musniumar ekowboy2 paham rizal ramli jonan budi sudirman said sus pujiastuti anies baswedan pecat menteri emang butuhin komisar,marah
hmmurah3 juragan rrc budak rrc takut anies baswedan presid,marah
anies baswedan rela makan anj presiden papua,marah
presiden 2024 anies rasyi basweda,senang
uki23 maju orang jawa barat cerda wara pilih anies rasyid baswedan,senang
anies rasyid baswedan didik gelar banget anies bukti rubah jakarta,senang
pk harap demokrat komitmen dukung pencapresesan anies baswedan,senang
fakta bukti anies baswedan sosok pimpin bukti laku adil golong kelompok agama dasar harap bangsa satu kuat wadah,marah
pers psi pimpin pk gagal pimpin gagal pers psi suks bukti sukses anies baswedan jakarta gagal jateng suks,marah
bukti masyarakat jawa timur membenc anies baswedan ibunda laskar gera waniesta indonesia gerwanies organiessasi waniesta sinyalir libat aksi gerwanies anggap salah organiessasi onderbouw pki,marah
dionysuss01 txtdrimedia anies baswedan,netral
indonesiaperks4 sutanmangara udah impa bayar sisa 100 m bantu bayarin rugi wsbk sip,netral
ibli manusia puja yohan nama bapti anies baswedan yohen anei bohong tipu ok oc bohong dp rp 0 tipu naturalisasi omdo yg si yojen waris model loe bodoh udara berktp,marah
buruh kecewa anies baswedan politikidentitasanies tenggelamkananiesesbaswedan htifpidukunganies aniesespendukungormasradik bapakpolitikidentita koruptordanaisafarianies tolakanies,sedih
survei ipo anies baswedan unggul ganjar langkahanies nohceukenohhh bennyharmaniesd rikes komandanvip jarnasabwbpn jarnasabw mileanieses24 aniesesmaniesa olvaholvah,netral
tolak anies baswedan,marah
anies baswedan licik,marah
mudah2 berak hati pilih pimpin ubah adil bidang kerja cari untung wajib mensejatrakannya kaya alam,marah
ekokuntadhi1 liat laku nya kangdede78 link nya 2017 13 juni 2023 buniyanies kena hukum edit tangkap layar dgn sengaja sya listyosigitp akn terap equal befor the la,netral
nul iri sempat cilacap gebernurnya ngajak jalan sehat,netral
moga ide wujud indonwsua,netral
anies baswedan orang gak kerja pimpin aniesesbaswedangakbecu,marah
buruh kecewa anies baswedan aniesesbaswedangakbecu,sedih
andisinulingga biar prabowo unggul anies basweda,netral
anies baswedan matahari sore tenggelam ga laah play victim tuduh jegal menjeg tenggelam uda,marah
geloraco tenang indonesia maju anies baswedan presiden insyaallah santai nikmat pensiunni,senang
anies baswedan doa turun raden batoro katong presiden ri,senang
cnnindonesia insyaallah pa pilih yg normal anies basweda,netral
denmaspudji muhiqr choymarkochoy dunianyasantai nohceukenohhh malika6027 mayapada0812 prestasi anies baswedan jabat gubernur dki jakarta tolong tunjuk prestasi calon mu,senang
cawapr anies baswedan umum demokrat saran koalisi ubah bentuk tim nasion aniesesbaswedan koalisiperubahan pilpreses2024 beritaterkini beritaterbar,netral
bangga tenaga kerja ase citra kwalita proyek yg kerja pimpin bangga tenaga kerja anak negeri kagum dunia anies baswedan nama,senang
damaiharilubi aksioma02 aniesesbaswedan mohmahfudmd krn ahox tdk prestasi anggap sampah anies baswedan jl ngeri krn rival yg kuat cerda capres ri 2024 aseng sdh paniesk takut anies jd presiden 2024 mk tugas budak utk gagal dgn sgl blm has,marah
ma anies baswedan air fakta bukti wonogiri yuk cari solusi,netral
ramai nih mari lihat hasil menang telak pilpres 2024 anies baswedan retwit like komen,senang
sukardi2017 tanggal edit,netral
elfizaenni presiden indonesia pimpin orang turun china jawa gagal rakyat indonesia presiden turun yaman anies rasyid baswedan,marah
habib muhdlor jember jatim santri dukung anies baswedan maju pilpres 2024 santri kalimantan selamat nkri habib muhdlor,netral
geloraco hadeeeehh siluet juueelaass wanies opo ayooo ubah anies rasyid baswedan presiden 2024 menang milik nya,marah
aku83782263 hidup anies basweda,senang
tolak anies baswedan gubernur gagal presiden,marah
pakar dlm bidang sosiolog muka miskin jawa data bantah dapat data semprot dgn data,marah
poll buka akbar faisal uncensor voter pilih anies baswedan unggul prabowo ganjar anies aniesespresidenri2024,netral
kelen yg fitnah ahi amp demokrat silah baca anggota tim 8 koalisi ubah satu kpp sudirman said ban kabar yg partai demokrat paksa ketua ahi pilih sbg cawapr damping anies baswedan,marah
ma anies baswedan komitmen rakyat,senang
yenni wahid cawapr anies baswedan prediksi suks tang pilpres 2024 amat bambang pangi,netral
anies baswedan jadi enemi of the regim situ erti anies baswedanlah hancur oligarki belit rezim pilih rakyat indonesia kuat anies baswedan indonesia,marah
orang juang bukti 100 umat islam dukung anies baswedan sungguh allah kabul doa rakyat yg tertinda terzdholimi insyaallah anies presiden amin,senang
partai buruh kecewa anies baswedan pilih kenyang perut makan soto betawi ketirnbang hadir mayday,sedih
demo buruh kantor heru budi hartono kspi singgung pimpin anies baswedan,marah
pembualndeso jhonnisinaga20 tesahidayat20 link berita asli,netral
jhonnisinaga20 link berita,netral
partai demokrat aku sosok calon wakil presiden cawapr pilih calon presiden capres anies baswedan anies sosok cawapr pilih aniesesbaswedan pemilu2024,netral
cnnindonesia anies rasyid baswedan pilih,senang
jegal anies baswedan akibat bawa sj limbung nyungsep pimpin orang,marah
jegal anies baswedan posisi konsisten buntut gak baik salah orang poll abal2 bkn survey ukur,netral
jegal anies baswedan jalan sj gak hati2 nyungsep got pimpin jalan orang,marah
jegal anies baswedan kata2 yg keren tp gak eksekusi yg ga bukti kerja bener2 lipstick bung tampil yg mewah megah,marah
jegal anies baswedan korup tokoh2 dukung anies,marah
jegal anies baswedan diam sj gak,marah
jegal anies baswedan hoax buat no3 dijeg,marah
jegal anies baswedan ustad kelompok,marah
jegal abi baswedan mulut rekam jejak anies,marah
ma tum ahi ucap terima kasih dukung sekber kib cawapr anies baswedan kibdukunganiesesahi,netral
titik temu strategi rawan anies baswedan ketua partai demokrat ahi tanda kolaborasi kuat bangun indonesia kibdukunganiesesahi,senang
kib aspirasi masyarakat masyarakat sambut bonu demografi anies baswedan damping wakil milit habil ketua kib kibdukunganiesesahi,netral
anggap wakil kaum mileni kib dukung ahi cawapr anies baswedan pilpres 2024 kibdukunganiesesahi,netral
sinergi bangga kader senior ppp golkar dukung anies baswedan temu ahi satu suasana hangat cipta ubah baik kibdukunganiesesahi,netral
baha pilpres 2024 kelompok rawan anies baswedan temu ahi kibdukunganiesesahi,netral
wakil mileni kib dukung ahi cawapr anies baswedan kibdukunganiesesahi,netral
jegal anies dukung doktor s3 spesial ilmu bekerjasama kerja sama2 ngeblank ditingg dijeg dukung jgn smp lambat tinggal doktor2 kadrun nge blank spt anies baswedan amien rai musni umar,marah
buruh anies baswedan pandai janji manies aniesesgagal2024 waspadaanies,sedih
anies baswedan presiden bang andr sy dah ingat kali kali dah rapat k anies baswedan ban,marah
buruh indonesia pendam kecewa anies baswedan aniesesgag,sedih
ketua pan bekas utara pasang spanduk gambar anies baswedan panggil hati,netral
ketua pan bekas utara 75 persen masyarakat dukung anies baswedan,senang
presiden partai buruh said iqbal nama anies baswedan radar bursa capres buruh bapakpolitikidentita aniesespolitisasi,netral
munza19m kangmanto123 dukung anies baswedan orang didik ngomong etika bahasa nya patut contoh kasi banget hati otak sinkron l,sedih
tipu bukti jilat anies baswedan yg bohong tipu,marah
survei elektabilita baru prabowo subianto anies baswedan unggul ganjar pranowo ganjar ajar politik fashion bersa sarcast forma,netral
subur0204 anies rasyid basweda,netral
survei elektabilita baru prabowo subianto anies baswedan hasil unggul persentas signifikan mari harga pilih masyarakat dukung pilih pemilu2024 indonesiamaj,netral
prabowo subianto ganjar pranowo anies baswedan langkah politik tangan tum airlangga sarcasticandform prabowoforpresid,netral
cerita mantan ketua kpu jateng yg skrg juang anies baswedan video 1,netral
ndaxwz anies baswedan jilid 2 harga ntah prestasi n,marah
krisyantooni ganjarpranowo tampang mesum jilat anies baswedan,jijik
bahaya buzzerrp main stigma rakyat benzi anies baswedan alhamdulillah nyata sadar buzzerrp tulang bulak fakt,senang
lanjut vidio 6 mahakarya anies baswedan,netral
ekokuntadhi1 bukti tokoh yg tawar cawapr anies baswedan tdk wapresnya cocok spt amien rai roki gerung denni indrayana riziq rizal ramli said didu tdk org tawar capres anies,netral
democrazymedia rakyat indonesia percaya prabowo istri jokowi anies baswedan pilih rakyat indonesia presiden indonesia 202,senang
elo goblok mental budak arab anies rasyid baswedan,marah
selamat indonesia salah pilih presiden 2024 anies baswedan pilih baik rakyat cerda jokowigilakekuasaan jokowigilakekuasaan,marah
sehat anies basweda,senang
retweet follow yuk follow dukung anies baswedan pimpin prestasi anies ganjar,senang
perlahan suara rakyat ubah anies baswedan presiden 2024,senang
temu jumat ketua simpul rawan gaga sobat anies sumatra utara rangka susun strategi menang anies baswedan aniesespresiden2024,netral
anies baswedan silaturahmi thoriqoh sathoriyyah jatim barakallah,netral
target sangka lawan oposisi menteri inisi syl tuju ganggu koalisi kpp menjeg pencapresesan anies baswedan denni indrayana,netral
anies baswedan ajak keluarga puncak sosok bantul langkahanies tatakujiyati s0batanies jarnasabwbpn komandanvip jarnasabw jarnasabw,netral
kecewa buruh anies baswedan aniesesdidukungkoruptor aniesesgabecu aniesesgaben aniesesbikinmalu,sedih
otak loe bodoh akibat cekok bodoh udara berktp si manusia astral anies baswedan ya,marah
putus mk yg panjang jabat pimpin kpk sungguh upaya jahat istana menjeg calon anies baswedan,sedih
mba leonita coba anies baswedan ngerti ga bonu demografi presiden jangan2 anies bingung krn ga ngerti yg lidah melelet2 doang tuh hahahah,marah
aniesesbaswedan semangat anies baswedan penceraha,senang
sok loe hut si sandi aja getol balik anies istana alergi pencapresesan anies baswedan takut kuasa anies menang,marah
kecewa buruh anies baswedan aniesesgabecu aniesesgaben aniesesdidukungkoruptor tenggelamkananiesesbaswedan,marah
jakarta deklarasi dukung anies baswedan,senang
anies baswedan pandai bicara janji manies aniesesgabecu aniesesgaben aniesesdidukungkoruptor tenggelamkananiesesbaswedan,marah
keren moment anies baswedan temu presiden turki recep tayyip erdogan bukti kl anies baswedan mmg utk indonesia pimpin kela dunia,senang
ahi temu puan demokrat tegas kokoh dukung anies baswedan ketua demokrat agu harimurti yudhoyono ahi politiku puan maharanies agenda temu kawasan gelora karno senayan aniesesahi jarnasab,senang
jakarta survei indonesia polit opinion ipo merili nama menteri tahan ri prabowo sosok nilai beranta korupsi ketimbang gubernur jawa ganjar pranowo mantan gubernur dki jakarta anies baswedan,netral
anies baswedan bacalpr 2024 indonesia malam minggu haram tottenham gint pledi sore,netral
potret kerja tata kelola uang anies baswedan,netral
wi wayah indonesia panggil putra baik bangsa anies baswedan presiden 2024 pilih rakyat jalan amanat dlm wujud sejahtera adil sosial rakyat semangat lihat video 98 tiktok,senang
gaetaway minat nyebarin foto baliho belah anies baswedan ndu,netral
uki23 saat anies baswedan usia 38 muda 1 elo beliau rektor universita usia muda habi hal2 yg sorri bro fakt,senang
anies baswedan ubah iklim krisi iklim rasa,senang
hmmurah3 adeknya abang susul,netral
gak heran ekor kadal betina otak kerdil pikir kadrun tutup dosa utang junjung anies baswedan helat duga aroma korupsi proyek kadrun melawanlupa,marah
strategi partai komuni china rusak pencapresesan anies baswedan rusak kuat politik ekonomi pegang jusuf kalla china operasi naga merah putih pungkas,marah
berita periksa kpk saksi,marah
bimtek amp mitigasi saksi curang milu kota malang gnap linta rawan anies baswedan kolaborasi simpul rawan pro anies bekal teknolog it rekapitung sabtu 17 juni 2023 dpd pk kota malang,netral
tvonenew negara adidaya pondasi ekonomi hr mesti kuat stabilita aman politik dn sosial budaya mesti sdh mantab klo presiden nya anies baswedan insyaallah b wujud oligarki hr tunduk patuh negara,senang
anies baswedan dukung rakyat man ratu persen rakyat indonesia anies baswedan yg waspada rakyat curang 2019 ulang,senang
editengik mamansu30264482 aliamin31984360 sukardi2017 andal si tengik medium beda ama yg,marah
koalisi anies baswedan kumpul bencong drama susah banget ambil putus udah pake korset gi,marah
ngkongros karya allah anies baswedan cipta nya dng fungsi hibur cipta pimpin cada lawak pro,senang
kekecawaan buruh anies baswedan parah sih anies anieseskadrun,sedih
prestasi anies baswedan 0 anieseskadrun,senang
uki23 psi gak bahan bisa nyerang anies baswedan,marah
juluk part psi dr dukung anies baswedan partai mileni salah asuh cocok ga ki,marah
bodoh udara ber ktp era manusia astral anies baswedan bodoh bual ok oc dp rp 0 naturalisasi bohong manusia astral anies baswedan,marah
jhonnisinaga20 ganjarpranowo anies baswedan bak telur ujung tanduk,sedih
anies baswedan 212,netral
idtodayco ya udah biar lega hibur selamat anies baswedan 2 lembaga survey yg tempat posisi buncit ipo ilk,marah
sukardi2017 berita yg coba edit tanggalny tuh kong kalo berita baca isiny judulny doank otak pas2an boleh2 aje ya dongo pelihara,marah
kangmanto123 kejaksaanri gocek berita 2017,marah
bospurwa gpp kafirun munafikun n oligarchi yg gaksuka anies baswedan,marah
ha ha hoax nih survei capres 2024 baru 31 kec elektabilita anies ambyar ganjar prabowo anies baswedan,marah
pantang mundur bela anies basweda,senang
anies rasyid baswedan orang biasa2 rakyat indonesia pd jabat negara orang2 bicara beliau bla bla bla dg tuju mendragadasinya dlm kontestasi capres pd milu 2024 herman tuh sih sebegitumya,netral
kecewa buruh anies baswedan aniesesbaswedan aniesesradik pemiluserentak2024 pemilu2024 likeforlik trend follom trendinghot,sedih
sila manggil anies baswedan klo mau golong hina saran gw mrk yg msh akal sehat alia wara sakit jiwa,marah
prediksi kandidat capres bersa ngak lirik rakyat pilih anies baswedan retwet prabowo subianto like,marah
pakdebude4 geiszchalifah emang loe jungjungan lo si anies baswedan nyapr dg suara nasdem otak wara,marah
anies baswedan mang edan aniesesbaswedan,marah
choymarkochoy tjel0up aja 2x kader gerindra wakil anies dki jakarta ketua yg wakil anies baswedan,marah
jabat yg sombong orang yg pecat bohong anies basweda,marah
kira2 borok ya simpan takut anies baswedan presiden bongkar sudirman said apa anies presiden jik via youtub,marah
pimpin yg hormat orang tua niscaya mudah dlm hidup sehari2 smoga anies presiden 2024 rakyat indonesia adil sejahtera ayo ikhtiar niat utk anies sosok yg pimpin 2024 lihat video anies rasyid baswedan tiktok,senang
tukangtwittt geiszchalifah aniesesbaswedan si anies cerda loe bilang basuh muka loe cuci otak loe lupa pakai bayclean era si wab bahlul anies baswedan udara berktp cerda nyata nya goblok,senang
koalisi anies baswedan pecah calon wakil presiden nasdem tolak agu harimurti yudhoyono peluang menang majalahtempo,netral
aniesesindo juhari02168742 lho surveynya 150 yah rakyat indonesia dukung anies basweda,netral
pimpin aku pimpin,senang
suaraumatnew doktertifa arek suroboyo dukung anies baswedan,senang
anies baswedan yeess ye ye presiden ri 2024 203,senang
dukung anies baswedan wkwkw,jijik
nasdem aniesesbaswedan suka dgn partai nasdem anies calon presiden ri keluarga pilih anies baswedan ri1 moga harap rakyat kabul anies pilih presiden indonesia yg maju adil rakyatni,senang
ambil sembakonya pilih anies baswedan gimana gak korup rakyat dah suap hadeuhhh,sedih
suwandaben kerenn semangat utk bangsa tanah air mana menang anies baswedan presiden 2024 pilih rakyat yg percaya amanah moga indonesia maju sejahtera amin yra,senang
putrafajar1945 aniesesbaswedan jokowi bong lapang bola jkt hancur ahok bangun anies baswedan buzzer jgn cm sebar hoax tunjuk prestasi junjung dasar speci kolam,marah
pan ppp demokrat sadar patut dukung ganjar pranowo seteru yg perna dgn pdip abai damai bangsa sempurna teriak jegal,netral
bule istri idola ganjar pranowo silah berselfi ganjar timnasday axelsen senin apel pagi,netral
ganjar pranowo program jokowi kawal lanjut,netral
kwalita didik jawa ganjar pranowo baik gaji guru honor bijak sambut guru honor ganjar pranowo,senang
ganjar peduli budaya nusantara bangga calon presiden indonesia ganjar pranowo respect peduli budaya nusantara ganjar yg ganti jokowi ntah nasib budaya nusantara depan ganjar peneru jokowi,senang
peduli ganjar pranowo didik spp grati honor sejahtera non formal sejahtera virtual solusi anak putu sekolah,senang
elektabilita calon presiden bacapres usung koalisi ubah satu kpp ani baswedan unggul gubernur jawa ganjar pranowo,netral
dear warga lombok calon presiden 2024 ayoo rapat baris amp ganjarpranowo istana utk lanjut visi misi jokowi bangun indonesia,senang
antusiasm masyarakat bagai daerah ganjar pranowo real coba donk yg foto ani dtg kunjung ga brp juta kira2 yg sambut kepo nih,terkejut
batas beliau stempel pki kalah kontestasi serah bagi,jijik
1 juta miskin entas ganjar pranowo jawa mengiki miskin turun angka mesti langkah nyata smk board jateng adl investasi kelak warga jateng jatuh jurang miskin,takut
ganjar pranowo dorong gen z rawat kembang seni budaya bangsa indonesia majubersamaganjarbangunri jenni bruno mar one piec onad wendi loudest concert rate r powerpuff girl sarap,senang
ken sosok siti atikoh istri ganjar pranowo publik penasaran tarik dibaha pasal sang suami gubernur jawa didapuk calon presiden pilpr 2024 usung pdi juang pepatah balik,netral
rapat baris ganjar pranowo,senang
era ganjar pranowo angka partisipasi kuliah tingkat jabat naik 100 antusias masyarakat jateng kuliah didik berband luru ekonomi masyarakat,senang
ganjar pranowo ribu kader pdip nusa tenggara barat ntb kait potensi politik identita kuat pilpr 2024 majubersamaganjarbangunri jenni bruno mar one piec onad wendi loudest concert rate r powerpuff girl sarap,netral
ganjar pranowo kantor dpd pdip ntb datang calon presiden bacapres sambut ribu dukung seni gamelan majubersamaganjarbangunri jenni bruno mar one piec onad wendi loudest concert rate r powerpuff girl sarap,netral
bule istri idola ganjar pranowo silah berselfi ganjar salmasalsabil nabilataqiyyah one piec pledi,netral
bacapres pdi juang ganjar pranowo masyarakat cerita hasil presiden joko widodo bangun sirkuit mandalika ntb via,senang
putra baik bangsa ganjar pranowo tgb muhammad zainul majdi nya makan canda pikir masalah bangsa,senang
wan ambruk aplikasi sprti ehh hasil yg lapor persekusi jancuuukk,marah
hadir raya ultah barajp jokowi ulang sikap dukung ganjar pranowo,senang
kaum bongdrun partisan hore sorak gembira krn temu ahi puan runtuh koalisi minim informasi benar nya mengganj ganjar fakta trah soekarno jatuh non soekarno,marah
calon presiden indonesia ganjar pranowo silaturahmi dpw ppp safari politik ntb sahabatganjar ganjarpranowo ganjar menangkanganjar generasigotongroyong,senang
cantik sederhana enerjik cerda banget dr sosok atiqoh supriyanti istri dr ganjar pranowo beliau sdh selesai tipe istri yg antar suami anak suks seep,senang
ingat ganjar pranowo sambut hangat riah daerah kunjung rekam jejak capai jabat layak apresiasi layak pilih presiden,senang
puan ahi masuk radar bacawapr pendamp ganjar pranowo kursi menteri tang ahi ganjarmenangtot,netral
gagas ganjar pranowo sekolah virtual program indonesia luncur 2020 silam tuju kurang angka putu sekolah,senang
perhati khusu ajar agama ganjar pranowo kucur rp 277 m utk insentif guru agama,netral
daerah ntb benar2 bilang wooouw ya masyarakat tumpah ruah jalan sambut hadir ganjar pranowo bukti gp kharisma kuat daya tarik daerah tsb,senang
erickthohir chhuda5 mana hadir erik ganjar pranowo ketemu heboh riah amp seru lanjut pimpin negara indonesia cinta,senang
perna kepala daerah peduli dgn didik terkhusu utk warga miskin didik salah kurang angka miskin ganjar pranowo bantu,senang
ganjar pranowo merah renon bal yg warga batas sambut hadir gp renon bal duga saudara bal hadir lebih kapasita laut manusia satu hati saudara indonesia timur lanjut bangun jokowi,senang
hasil capres ganjar pranowo menang lawan capres ani baswedan semuadukungprabowo neruskepakdh,senang
prabowo subianto 38 ganjar pranowo ani baswedan semuadukungprabowo neruskepakdh,netral
semuadukungprabowo neruskepakdh,netral
sejahtera guru honor baik gaji guru honor baik kualita didik ganjar pranowo tetap honorarium gtt satu didik negeri utk umk tambah 10,senang
momen tarik akrab ganjar pranowo tgb zainul majdi makan bareng tokoh masyarakat ganjar menang total ntb,netral
2020 ganjar pranowo bebas biaya spp siswa negeri jateng biaya ambil tanggung bop bantu operasion selenggara,senang
coba poll kotak kosong gp anda lawan ganjar kotak kosong pilpr 2024 pilih kotak kosong retweet ganjar pranowo like aja biar simpel berani jujur hebat,marah
90 persen masyarakat dukung ganjar pranowo ganjarcapres,senang
ganjar pranowo kriteria bacawapr damping hr visi jiwa muda b paham holistik byk anak muda pikir tua byk jg orang tua pikir muda yg jiwa,senang
capres pdip ganjar pranowo sambut riah ribu kader rawan tunggu pagi ria ganjar presiden 2024 gema iring jalan ganjar pranowo masuk lokasi acara,netral
ma ganjar pranowo tani ketua hari nasion dpp perindo tgb muhammad zainul majdi ziarah makam pahlawan nasion tgkh zainuddin abdul madjid silaturahmi tuan guru jemaah lingkup yayasan didik hamzanwadi pancor selong lombok timur,netral
pengaruh tgb ganjar pranowo menang ntb lampau persentas target cc ganjarpranowo,senang
ganjar pranowo tumpang mobil milik istri presiden ri soekarno fatmawati laku kebon vintag car bal classic denpasar hadir lokasi ikut acara gen z tajuk mabar akronim maju ganjar,netral
diskusi santai ganjar pranowo acara mabar maju ganjar tema kaum muda bicara kebon vintag car bal hadir ratus generasi z penuh tepuk tangan gelak tawa ganjar santai humor laden papar,senang
ganjar pranowo tunjuk semesta jaya nusantara,senang
ganjar pranowo bandara internasion lombok wita bandara ganjar sambut ketua dpd pdi juang ntb rachmat hidayat kader pdi juang ntb ganjar kalung selendang tenun kha lombok tanda tamu hormat,senang
ganjar pranowo temu soekarno kunjung kota mataram ntb momen ganjar pranowo pidato hadap kader partai kantor pdip provinsi ntb ganjar pranowo panggil salah kader nama soekarno 83 sumbawa,netral
ntb sambut ganjar pranowo ganjarpranowo ganjar pranowo ri1,senang
pencawapresan 10 nama 6 dr 10 nama bursa cawapr ganjar pranowo puan maharani mahfud md erick thohir ridwan kamil sandiaga uno ahi airlangga nama2 lebih masing2 pdip kerucut mjd 1 nama bacawapr ganjar,netral
ganjar pranowo hadir konsolidasi menang pilpr 2024 kota lombok nusa tenggara barat ntb minggu 18 juni,senang
kagum ridwan kamil ganjar pranowo indomi battl one piec baekhyun vietnam love gisel bpj powerpuff girl wendi bruno mar aang nonton balap mark lee thank you senin sarap junkyu,senang
ganjar pranowo sopir ketua hari nasion partai perindo tgb hm zainul majdi kunjung kota mataram nusa tenggara barat ntb momen bacapres ganjar pranowo makan siang tokoh agama tokoh masyarakat elemen,netral
pasang baik yg terus bangun jokowi jaga pancasila kadrun orma larang ganjarpranowo erickthohir giat medium sosial dukung ganjar pranowo pinang erick thohir cawapr,senang
jateng provinsi kaya tp uang negara benar2 manfaat ganjar pranowo utk tekan angka miskin,senang
coba test klo berani ani baswedan retweet prabowo komen ganjar pranowo lik,netral
ekspresi ekspresi jokowi makan ganjar pranowo nyaman senyum foto suasana penuh tegang,takut
strategi program entas miskin ala ma ganjar pranowo mudah lacak jejak digitigalnya contoh salah satu program didik grati,terkejut
strategi gagas ganjar pranowo kikis miskin dunia didik smkn jateng sekolah grati siswa berpretasi tekan angka putu sekolah entas ribu keluarga miskin ganjarpranowo,terkejut
ga pakai jet pribadi payah ga keren jongo oligarki ani ganjar pranowo sambut hangat riah warga lombok rebut selfi salam ganjaruntuksemua lanjutkanbersamaganjar,senang
dukung ganjar pranowo sodara2,senang
elektabilita ani salip ganjar pranowo pepet prabowo,terkejut
kantor dpw partai perindo calon presiden pdi juang ganjar pranowo ziarah makam pahlawan nasion lombok nusa tenggara barat ketua hari nasion partai perindo tuan guru bajang tgb,netral
masyarakat bal all out dukung ganjar pranowo,senang
bacapres ganjar pranowo temu puluh ribu gemar ntb,senang
gubernur bal ajak bupati walikota dukung ganjar pranowo rawan optimi menang putar hattrick ganjaruntuksemua lanjutkanbersamaganjar,senang
