quoted_text,emosi
prabowo hadir rombong lokasi langsung sambut duta china indonesia xiao prabowo subianto,senang
prabowo china indonesia hubung tingkat prabowo subiantoo,netral
prabowo subiantoo capr elektabilita tinggi,senang
simulasi 3 prabowo subiantoo,senang
hasil prabowo unggul lawan ganjar simulasi 2 prabowo subiantoo,terkejut
kalah lawan capr prabowo subiantoo,netral
ma ganjar yg dukung pilpr 2024 kalah jawab mudah prabowo subiantoo presiden republik indonesia period 2024 2029 dukung kritisi dgn hormat,senang
arifin asydad prabowo subianto,senang
arifin asydad pemr kumpar harap depan prabowoaja subiantoo diskusi share session prabowo subianto,netral
wawas negara indonesia dunia titin rosmasari cnn indonesia prabowo subianto,netral
indonesia wawas kait situasi dunia prabowo subianto,netral
bincang prabowoaja kesan titin rosmasari pemr cnn indonesiacom prabowo subianto,netral
diskusi ruang kerja pustaka prabowoaja prabowo subianto,netral
seringkali balut canda tawa riang gembira prabowoaja pimpin redaksi prabowo subianto,senang
dialog pimpin redaksi prabowoaja santai prabowo subianto,netral
diskusi 6 jam prabowo subianto,senang
salam prabowo subianto,senang
sambut langsung prabowoaja subiantoo senyum ramah prabowo subianto,senang
pimpin redaksi medium cetak medium onlin medium televisi hambalang kabupaten bogor prabowo subianto,netral
elektabilita ganjar persen margin of error survei persen hasil prabowoaja puncak salip ganjar pranowo prabowo subianto,terkejut
hasil survei litbang kompa 29 mei 2023 elektabilita prabowoaja subiantoo calon presiden capr persen prabowo subianto,terkejut
faktor gagal piala dunia faktor sosok ma ganjar sorot publik,marah
ganjar pdi juang suara tolak israel indonesia nyata batal tuan rumah juara prabowo subianto,sedih
sisi ari elektabilita ganjar lorot lantar sikap tolak hadir tim nasion israel piala dunia mesti gelar indonesia prabowo subianto,sedih
mesin partai gerindra ubah strategi komunikasi politik prabowoaja,netral
akun twitter gerindra tiket konser blackpink jakarta tengah maret 2023 syarat unggah foto atribut blackpink latar baliho prabowoaja prabowo subianto,senang
sosok prabowoaja persepsi publik temperamen milit kera tertrasnformasikan lembut ya publik silat,marah
ubah persepsi pengaruh komunikasi partai gerindra medium sosial prabowo subianto,marah
ari latar prabowoaja tentara timbul persepsi benak publik prabowoaja temperamen prabowo subianto,marah
ari salah ubah strategi gerindra citra prabowoaja sosok kera latar belakang pensiun milit prabowo subianto,marah
ari acara diskusi kawasan kebayoran jakarta rabu prabowo subianto,netral
oleh suara prabowoaja gerindra prabowoaja salip ganjar gerindra posisi prabowo subianto,terkejut
direktur eksekutif syndic ari nurcahyo nilai elektabilita ketua partai gerindra prabowoaja subiantoo salip gubernur jawa ganjar pranowo buah ubah strategi politik gerindra prabowo subianto,terkejut
lejit elektabilita prabowo ubah citra milit human prabowo subiantoo,terkejut
abdulkholik2024 prabowo kesiragerindra gerindra genx36545403 chaves1305 bangsaygsujud andreassolusi papabowo2024 cnnindonesia geloraco tuju prabowo subiantoo pimpin hebat patriot sejati suks prabowo2024 indonesiamaju,senang
jakarta kalah surut semangat prabowo subiantoo raih tapuk pimpin tinggi indonesia,sedih
prabowo kang dedi mulyadi milik prabowo subiantoo alas kuat dukung beliau sebar prabowo prabowosubiantoo dedimulyadi kangdedimulyadi kdm dekade08 mendingprabowo,senang
prabowo subiantoo unggah potret makan siang bareng jokowi istana bogor prabowosubiantoo,netral
1 4 jabat prabowo subiantoo menhan rencana futur fighter fleet kira harap dar multirol air superior nyata,terkejut
akhlak ilmu sehat prabowoaja moga allah lancar urus cecep prabowo subianto,senang
udah alam beliau adat sopan santun pahkana prabowo subianto,senang
sifat asli rakyat indonesia paham tulu hormat habib ulama bangsa tuli putrakaya prabowo subianto,senang
warganet kagum sikap prabowoaja adab ulama warganet tulis kagum santun prabowoaja subiantoo prabowo subianto,senang
kur rp450 triliun haul cerah cerah prabowoaja prabowo subianto,senang
prabowoaja geser podium video unggah akun tiktok tumgrd prabowoaja subiantoo hadir acara haul habib munzir rawajati jakarta selatan prabowo subianto,terkejut
aksi mengges podium prabowoaja viral medium sosial sorot warganet simak ulas prabowo subianto,terkejut
prabowoaja buka kalimat mengges podium belakang ulama duduk panggung prabowo subianto,marah
prabowoaja sempat sambut acara prabowo subianto,netral
menteri tahan menhan prabowoaja subiantoo hadir acara haul akbar sulthonul qulub habib munzir almusawa rawajati jakarta selatan prabowo subianto,netral
momen prabowo subiantoo geser podium ulama aksi langsung sorot prabowo subianto,terkejut
daerah jawa subiantoo,netral
calon presiden bacapr prabowo subiantoo,netral
aniesmania kickandyshow prabowo subianto,netral
idn time rri elshinta tribunnew tempo hari kompa btv warta kota tvone vivanew tvri jawa po metro tv cnbc jakarta post prabowo subianto,netral
kumpar cnn indonesia net tv republika detikcom gatra bisni indonesia liputan6com sindonew data jak tv majalah swa rakyat merdeka kompa tv prabowo subianto,netral
salah modal bagu ya baik pimpin pikir depan prabowoaja buka share informasi prabowo subianto,netral
diskusi jalan santai seringkali balut canda tawa riang gembira prabowoaja pimpin redaksi bincang ruang kerja pustaka prabowoaja diam prabowo subianto,senang
kristen islam tokoh agama mari sinergi menang prabowo subiantoo pilpr,senang
benyamin harap dukung pendeta harap dampak dukung agama prabowo subiantoo,senang
anggota dprd jawa timur prabowo subiantoo tokoh nasion layak dukung sosok nasional pluralism,netral
depan kebhinekaan junjung manusia salah modal utama pendeta sidoarjo ikrar dukung prabowo subiantoo presiden 2024 terang,senang
prabowo subiantoo sihomb tokoh pluralism indonesia mudah terima semua agama indonesia,senang
menteri tahan prabowo subiantoo ingin indonesia pesawat tempur memb negeri,netral
pendeta sihomb tokoh prabowo subiantoo nasion tonjol nama hembus maju capr 2024,netral
ratus pendeta gereja sidoarjo dukung tum partai gerindra prabowo subiantoo maju pilpr 2024,netral
wajar normal tentara ulama pesantren prabowo subianto,netral
sama juang korban rakyat tentara ulama rebut merdeka prabowo subianto,senang
prabowoaja juang bangsa indonesia rebut merdeka beda prabowo subianto,senang
beber prabowo subianto,senang
beladiri latih prajurit larang jajah prabowo subianto,terkejut
juang merdeka prabowo subianto,netral
prajurit rakyat indonesia latih bela pesantren juang lepa peran ulama prabowo subianto,netral
elektabilita ani baswedan salip ganjar pranowo pepet prabowo subiantoo survei baru ipo,terkejut
ketua tum partai gerindra merdeka bangsa indonesia lepa juang korban rakyat prabowo subianto,netral
prabowoajaaja peran ulama kiai butuh jaga bangsa negara indonesia prabowo subianto,senang
jakarta menteri tahan menhan prabowoajaaja subiantoo ungkap peran ulama kiai jalan merdeka bangsa indonesia prabowo subianto,senang
prabowo subiantoo gera ratus juang lopor ulama prabowo subianto,netral
semangat karyawan defend id antusia sambut prabowo subiantoo menteri tahan capres2024 dekade08 mendingprabowo terusmajubersamaprabow,netral
hashim salah marwah demokrasi negara patut depan dialog komprehensif prabowo subianto,netral
jalan noel ketua dewan nasihat prabowoaja mania 08 hashim djojohadikusumo tuju indonesia milik demokrasi kuat matang dewasa prabowo subianto,senang
sosok prabowoaja nanti rakyat pimpin negeri bukti resistansi wilayah indonesia,netral
syukur masyarakat daerah indonesia antusia prabowoaja subiantoo prabowo subianto,senang
sisi noel rawan jokowi mania sebar 13 provinsi indonesia gerak menang prabowoaja subiantoo pilpr 2024 prabowo subianto,senang
hubung indonesia china kuat forum temu bilater tahun defenc industri cooper meet dicm prabowo subianto,netral
prabowo jalan upaya indonesia komitmen partisipasi aktif upaya kerja dorong cipta damai stabilita region global prabowo subianto,senang
harap kerja sahabat negara tahan semangat saudara prinsip hormat prabowo subianto,senang
forum harap tingkat kerja komprehensif negara signifikan bidang tahan aman prabowo prabowo subianto,senang
kerja tingkat bentuk forum prabowo subianto,terkejut
china capai mitra strategi komprehensif prabowo subianto,terkejut
wuih karyawan defend id gemuruh sambut menteri tahan prabowo subiantoo capres2024 dekade08 mendingprabowo terusmajubersamaprabow,senang
kuasa atur kelola sumber daya kelola kaya bangsa indonesia kuasa setia bangsa,senang
menteri tahan menhan ri kuasa milik penting pribadi gelintir golong prabowo subianto,senang
politik prose atur kuasa kuasa atur kuasa penting rakyat rakyat indonesia,netral
politik atur penting kuasa rakyat indonesia prabowo subianto,netral
prabowoaja kader berani politik prabowo subianto,senang
prabowoaja sambung zoom rumah bogor prabowo subianto,senang
ucap selamat kerja kera panitia pimpin camat kabupaten kotamadya hasil selenggara acara prabowo subianto,senang
prabowoaja apresiasi gelar konsolidasi kader wilayah jakarta barat prabowo subianto,senang
sempat prabowoaja singgung kuas prabowo subianto,netral
ketua partai gerindra prabowoaja subiantoo hadir zoom acara konsolidasi kader partai gerindra lapang bola kebon jeruk jakarta barat minggu prabowo subianto,netral
presiden jokowi makan siang menhan prabowo subiantoo kemarin baha,netral
konsolidasi kader gerindra jakbar prabowo kuasa penting pribadi prabowo subiantoo,netral
seru banget karyawan defend id antusia sambut prabowo subiantoo menteri tahan capres2024 dekade08 mendingprabowo terusmajubersamaprabow,senang
jemaah doa prabowoaja prabowo subianto,senang
sebut silaturahmi prabowoaja rangka sambung cinta kasih sayang cinta prabowo,senang
prabowoaja jalan kaki 200 meter ponp prabowo subianto,terkejut
sambut hadir prabowoaja gang ponp prabowo subianto,terkejut
prabowoaja sandang disabilita hidup layak prabowo subianto,senang
prabowoaja kuasa tahan gembira anak peluk prabowo subianto,senang
terima kasih,senang
amin amin anak hebat anak hebat,senang
hebat salam ya salam,senang
prabowoaja langsung peluk cium elu rambut bahu prabowo subianto,senang
prabowoaja sapa satu gerbang koramil prabowo subianto,netral
tunggu langsung senyum prabowoaja prabowo subianto,senang
datang menteri tahan prabowoaja subiantoo koramil bandung barat jumat 16 juni 2023 sambut disabilita prabowo subianto,senang
datang prabowo lembang sambut senyum disabilita prabowo subiantoo,senang
doa prabowo panjang umur jaga sehat kabul prabowo subianto,senang
gu miftah sambut jemaah doa prabowoaja prabowo subianto,senang
almarhum gu dur orang ikhla indonesia prabowoaja gu miftah prabowo subianto,senang
gu miftah kutip ungkap presiden ri empat abdurrahman wahid gu dur prabowoaja prabowo subianto,netral
kuat gu miftah prabowo subianto,netral
ajar prabowo gu miftah sakit hati prabowo subianto,sedih
sampai acara open hous akbar ada ponp hadir prabowo rabu sleman yogyakarta prabowo subianto,netral
sleman pimpin pondok pesantren ponp os aji gu miftah maulana habiburrahman ajar ikhlas menteri tahan ri prabowo subiantoo kerap alami rundung bulli dendam,sedih
menteri tahan prabowo subiantoo malam rabu hadir acara open hous akbar pondok pesantren os aji pimpin gu miftah,senang
hujat sakit hati gu miftah ngaku ajar ikhla prabowo prabowo subianto,sedih
hormat datang capr prabowo subiantoo,senang
ketua sinod gpm ate werinussa sambut hadir capr prabowo subiantoo,netral
prabowo subiantoo sambut karyawan defend id antusiasm capres2024 dekade08 mendingprabowo terusmajubersamaprabow,senang
nendah prabowo subianto,senang
alhamdulillah beliau hadir camat lembang kali ketemu beliau langsung tatap muka prabowo subianto,senang
habi cium beliau bisik doa isi anak dewasa kelak anak suks,sedih
cium sang prabowoaja bisik doa anak usia kelak anak guna bangsa prabowo subianto,sedih
cerita nendah sumringah prabowo subianto,netral
beliau senang anak beliau senang anak beliau langsung cium cenderamata reaksi anak senang langsung diumpetin nggak prabowo subianto,senang
prabowoaja gendong cium cendera mata prabowo subianto,senang
momen tarik bagi prabowoaja kerumun masyarakat salam spontan langsung hampir anak gendong ibu prabowo subianto,terkejut
heboh karyawan defend id antusia sambut prabowo subiantoo menteri tahan capres2024 dekade08 mendingprabowo terusmajubersamaprabow,senang
kunjung prabowoaja bagi seremoni 25 unit motor bintara bina desa babinsa sapa masyarakat prabowo subianto,senang
koramil lembang prabowo cium doa orang suks prabowo subiantoo,senang
paman polisi istimewa gugur polisi angkat senjata perang polisi komponen hankamrata,sedih
turut polisi komponen tahan aman indonesia prabowo subianto,netral
milik nama dengan anggota polisi istimewa gugur tugas prabowo subianto,sedih
prabowoaja anugerah gelar warga hormat korp brimob polri cerita paman nama subiantoo prabowo subianto,senang
lahir polisi sejarah polisi bentuk koloni polisi angkat senjata perang perang merdeka bahu bahu unsur,netral
sejarah adab manusia negara kuat negara hasil milik polisi unggul polisi hebat polisi cinta rakyat prabowo subianto,senang
negara bangsa rakyat dharma bakti polisi unggul bhayangkara tangguh pesan butuh polisi unggul,senang
sempat prabowoaja pesan prajurit polisi pribadi tangguh unggul cipta pondasi aman negara kuat prabowo subianto,senang
rajut satu satu bangsa kebhinekaan,senang
pesan prabowo sespim lemdiklat polri polisi unggul prabowo subiantoo,netral
tular dukung prabowo subiantoo,netral
dukung pencapresan prabowo subiantoo 2024,senang
mohon maaf keras indonesia kurun kolonial prabowo subianto,sedih
minta maaf langsung jokowi istana presiden bogor 2020 prabowo subianto,sedih
raja belanda willem alexand minta maaf indonesia prabowo subianto,terkejut
turut 17 agustu 1945 tanggal merdeka indonesia aku raja belanda kirim telegram ucap selamat merdeka indonesia prabowo subianto,terkejut
informasi pm belanda mark rutt diskusi parlemen belanda kaji dekolonialisasi aku merdeka indonesia 17 agustu 1945 prabowo subianto,terkejut
anggap dapat proklamasi ya tindak militer agresi resmi terima daulat 49 hasil kmb alhamdulillah aku,senang
prabowoaja merdeka indonesia diproklamirkan agustu 1945 tindak milit belanda kurun agresi milit prabowo subianto,senang
ya alhamdulillah terima kasih maaf indonesia raja maaf,senang
prabowoaja dapat aku merdeka indonesia serta minta maaf belanda rakyat indonesia prabowo subianto,terkejut
maju belanda kukuh indonesia merdeka 27 desemb 1949 seir konferensi meja bundar kmb prabowo subianto,senang
menteri tahan menhan prabowoaja subiantoo sambut aku belanda merdeka indonesia 17 agustu 1945 prabowo subianto,senang
prabowo apresiasi belanda aku merdeka ri maaf prabowo subiantoo,senang
deputi biro medium informasi sekretariat presiden ri bey machmudin agenda makan siang presiden joko widodo menteri tahan menhan prabowo subiantoo istana bogor jawa barat minggu,senang
hati harap doa,takut
harap dukung mejadi presiden doa prabowo subianto,senang
hadap kiai asep santri ponp amanatul ummah prabowo subianto,senang
dukung saudara hati prabowo subianto,senang
pasca maju calon presiden 2024 prabowo subianto,senang
prabowoaja aku datang ponp amanatul ummah urus restu dukung pilpr 2024 prabowo subianto,netral
prabowoaja tolak sempat santriwati foto selfi prabowo subianto,netral
prabowoaja dekat juru santri putri kerumun tarik prabowoaja foto selfi purnawirawan tni prabowo subianto,netral
area baris prabowoaja riak santri putri prabowo subianto,terkejut
prabowoaja nampak santai lempar senyum prabowo subianto,senang
desa hindar ribu santri penuh area masjid prabowo subianto,senang
masjid santri rebut jabat tangan prabowoaja prabowo subianto,netral
momen prabowoaja asuh ponp amanatul ummah kh asep saifudin chalim sapa santri masjid raya kh abdul chalim prabowo subianto,netral
unik kunjung momen duga prabowo subianto,netral
ngopi bareng prabowo subiantoo ruang penuh senjata 5 jam baha koe plu temu jokowi msn prabowo bangkitbersama,netral
polisi komponen tahan aman rakyat semesta hankam,senang
bahu bahu unsur paman polisi istimewa gugur polisi angkat senjata perang,senang
angkat senjata perang merdeka indonesia prabowo subianto,terkejut
prabowoaja dasar sejarah lahir polisi indonesia bentuk koloni prabowo subianto,senang
butuh polisi unggul sejarah adab manusia negara kuat negara hasil polisi unggul polisi hebat polisi cinta rakyat,senang
acara dialog bangsa satu satu bangsa gedung utara sespim lemdiklat polri bandung jumat prabowo subianto,netral
pesan negara bangsa rakyat darma bakti polisi unggul bhayangkara tangguh pesan salah ya,netral
bukti sejarah adab dunia prabowo subianto,netral
prabowoaja menhan beliau tahan negara kerja bareng tahan negara prabowo subianto,netral
beliau dengar langsung tokoh pimpin ponp jatim gulat prabowo subianto,netral
alhamdulillah prabowoaja kunjung jawa timur beliau temu ulama pimpin ponp sepuh jatim prabowo subianto,senang
sekjen gerindra ahmad muzani temu prabowoaja bas membaha prabowo subianto,netral
syukur krisi dunia akibat perang ukraina inflasi jaga prestasi gampang inflasi momok dunia prabowo subianto,senang
prabowoaja tekad baik indonesia terjerumu pusar krisi prabowo subianto,netral
prabowoaja indonesia salah negara untung lantar hasil lolo krisi akibat pandemi perang prabowo subianto,netral
alhamdulillah menteri tahan kontrak bumn industri tahan 800 persen prabowoaja prabowo subianto,senang
prabowoaja selang pekan jabat menhan presiden joko widodo jokowi tuga industri tahan indonesia kuat mandiri prabowo subianto,senang
jabat menhan prabowo suks naik kontrak bumn industri tahan 800 persen prabowo subiantoo,terkejut
prabowoaja datang sambung talus silaturahmi putra sulung presiden joko widodo gibran rakabum raka prabowo subianto,senang
tum gerindra prabowoaja subiantoo aku kaget lantar rawan jokowi jatim rawan gibran dukung prabowo subianto,terkejut
isu muhaimin aku terima informasi langsung prabowo subianto,netral
pasal putra presiden ri joko widodo damping prabowoaja subiantoo calon wakil presiden cawapr prabowo subianto,netral
temu cak imin kembang baru koalisi bangkit indonesia raya kkir prabowo subianto,netral
malang ketua pkb muhaimin iskandar cak imin rencana temu kiai timur jatim jombang ahad malam prabowo subianto,netral
cak imin prabowo jadwal temu kiai timur jombang malam prabowo subianto,netral
tutup bobbi prabowo subianto,netral
presiden resmi defend id target top 50 global compani prabowo subianto,netral
optimisti bimbing perhati menhan prabowoaja industri tahan nasion target wujud prabowo subianto,netral
bobbi kejar target jadi defend id top 50 global compani 2024 prabowo subianto,terkejut
bobbi prabowo subianto,terkejut
angka besar baik sejarah pt 1976 pt len 1965 pesan harap capai rp130 triliun prabowo subianto,senang
dasar lapor uang 2022 usaha pelat merah hasil buku kontrak angka fantasti capai rp84 triliun prabowo subianto,senang
bobbi komitmen menhan prabowoaja maju industri tahan nasion dampak positif kembang defend id prabowo subianto,senang
resmi presiden jalan bimbing menteri tahan optimi defend id maju wujud indonesia maju,senang
bobbi aku era pimpin prabowoaja subiantoo komitmen bangun ekosistem industri tahan kuat modern cepat mandiri industri tahan indonesia nyata prabowo subianto,senang
sejarah indonesia direktur utama len industri direktur hold defend id bobbi rasyidin apresiasi komitmen menhan prabowoaja subiantoo bangun industri tahan nasion prabowo subianto,senang
tahan kuat dunia kera saing bangsa kera prabowo subianto,senang
negara indonesia ganggu tahan lemah prabowo subianto,takut
prabowoaja industri tahan milik peran vital merdeka bangsa indonesia prabowo subianto,senang
tindak budaya mark up liwat budaya bohong budaya tipu hilang industri tahan,marah
salah satu menghapu budaya boros korupsi mark up industri tahan prabowo subianto,marah
sambut prabowoaja indonesia salah negara untung lantar hasil lolo krisi akibat pandemi perang prabowo subianto,senang
prabowoaja hadir acara the 1st defend id s day hanggar pt dirgantara indonesia bandung jawa barat prabowo subianto,netral
menteri tahan menhan prabowoaja subiantoo komitmen menghapu budaya korupsi lingkung industri tahan nasion prabowo subianto,terkejut
menhan prabowo komitmen hapu budaya korupsi industri tahan prabowo subiantoo,terkejut
tum gerindra menhan prabowo subiantoo terima jokowi makan siang istana bogor keren ya teman makan siang presiden politikfashion satir,netral
total karyawan hold defend id hadir pt pal dahana pt pindad pt dirgantara indonesia pt len prabowo subianto,netral
hadir prabowoaja ptdi temu ribu karyawan defend id prabowo subianto,netral
selamat juang maju serah gari pahlawan indonesia vital tahan indonesia,senang
prabowoaja karyawan pahlawan tahan gari gari pahlawan indonesia vital tahan indonesia prabowo subianto,senang
terima kasih sambut riah haru terima kasih gembira bangga saudara,senang
dengar nyata dirut defend id prabowoaja aku bangga gembira karyawan defend id prabowo subianto,senang
jabat tangan menhan wujud,senang
selamat karyawan karyawati defend id besar dukung menhan mandiri defend id bangga,senang
satu salam asal usaha prabowoaja jempol angguk bangga tepuk bahu prabowo subianto,senang
sapa karyawan defend id dar tunggu datang prabowo subianto,senang
prabowoaja langsung senyum turun maung hormat prajurit komcad prabowo subianto,senang
datang menteri tahan prabowoaja subiantoo pt dirgantara indonesia ptdi bandung jawa barat sambut karyawan tahan defend id prabowo subianto,senang
momen prabowo sambut karyawan defend id prabowo subiantoo,netral
dasco sebut ketua gerindra prabowo subiantoo kerap bertengg posisi capr,netral
wow prabowo subiantoo capr favorit anak muda seru capres2024 dekade08 mendingprabowo terusmajubersamaprabow,senang
mantul anak muda demen prabowo subiantoo capr ngerock capres2024 dekade08 mendingprabowo terusmajubersamaprabow,senang
hasil survei hasil nyata turun sambut masyarakat melua prabowo subiantoo turun masyarakat,senang
wow mayorita anak muda pilih prabowo subiantoo capr keren capres2024 dekade08 mendingprabowo terusmajubersamaprabow,terkejut
gilak prabowo subiantoo favorit anak muda capr asik banget capres2024 dekade08 mendingprabowo terusmajubersamaprabow,terkejut
tuh anak muda dukung prabowo subiantoo capr keren abi capres2024 dekade08 mendingprabowo terusmajubersamaprabow,senang
survei baru capr 2024 prabowo v ganjar v ani prabowountukindonesia prabowo subiantoo,netral
seru nih prabowo subiantoo pilih anak muda capr top capres2024 dekade08 mendingprabowo terusmajubersamaprabow,terkejut
anak muda demen prabowo subiantoo capr mantap capres2024 dekade08 mendingprabowo terusmajubersamaprabow,terkejut
prabowo subiantoo kerap undang jokowi temu mata,senang
gilak prabowo subiantoo pilih mayorita anak muda capr asik banget capres2024 dekade08 mendingprabowo terusmajubersamaprabow,terkejut
prabowo subiantoo idola anak muda capr top markotop capres2024 dekade08 mendingprabowo terusmajubersamaprabow,terkejut
heboh anak muda dukung prabowo subiantoo capr keren abi capres2024 dekade08 mendingprabowo terusmajubersamaprabow,terkejut
prabowo subiantoo anggap kini anak muda capr favorit capres2024 dekade08 mendingprabowo terusmajubersamaprabow,terkejut
seru nih anak muda pilih prabowo subiantoo capr gokil capres2024 dekade08 mendingprabowo terusmajubersamaprabow,senang
wow mayorita anak muda dukung prabowo subiantoo capr asyik banget capres2024 dekade08 mendingprabowo terusmajubersamaprabow,terkejut
keren abi anak muda demen prabowo subiantoo capr semangat capres2024 dekade08 mendingprabowo terusmajubersamaprabow,senang
test ombak capr pilih 2024 guy ani baswedan rt prabowo subiantoo komen ganjarpranowo like,senang
prabowo subiantoo puja hati anak muda capr seru banget capres2024 dekade08 mendingprabowo terusmajubersamaprabow,senang
anak muda heboh prabowo subiantoo capr favorit kece capres2024 dekade08 mendingprabowo terusmajubersamaprabow,senang
ketua partai gerindra prabowo subiantoo aku ajar presiden jokowi menteri tahan,netral
menteri tahan menhan prabowo subiantoo ungkap peran ulama kiai,netral
menteri tahan ri ketua partai gerindra prabowo subiantoo terima kunjung pimpin redaksi medium nasion diskus kait kembang situasi aktual cicip kopi kha racik prabowo bogor jawa barat,netral
jahat langgar ham prabowo subiantoo lupa keras keras langgar aja langgar toleransi apa tolak prabowo pimpin indonesia,marah
menteri tahan catat personel tni milit sipil ikut program didik latih australia kerja negara 1967 prabowo subianto,netral
prabowo subiantoo harap kerja indonesia australia dorong kontribusi negara jaga damai stabilita kawasan kitasemuabersat,senang
prabowo subiantoo terima kasih australia latih 18 kadet tni angkat darat royal militari colleg rmc duntroon kitasemuabersat,senang
prabowo subiantoo program kadet investasi hubung antarpribadi kunci tingkat kerja tahan indonesia australia kitasemuabersat,netral
komitmen dukung penuh latih tni adf,netral
prabowo subiantoo kerja tahan indonesia australia latih tni angkat senjata australia adf sempat optimal potensi negara hadap ancam tantang kitasemuabersat,netral
menteri tahan prabowo subiantoo suguh kopi hambalang 32 pimpin redaksi nasion diskusi 6 jam bogor dida2525 prabowo bogorkab mediacetak mediatv mediaonline2018 gerindr,netral
usut langgar ham berat prabowo subiantoo,marah
usung cawapr prabowo subiantoo ani baswedan pilpr 2024 tanggap sus pudjiastuti kilat,netral
prabowo subiantoo nilai beranta korupsi banding capr,terkejut
tunta membaha isu hasil putus dukung prabowo subiantoo airlangga hartarto,netral
