quoted_text,emosi
ya alhamdulillah terima kasih maaf indonesia raja maaf,senang
prabowoaja dapat aku merdeka indonesia serta minta maaf belanda rakyat indonesia prabowo subianto,terkejut
maju belanda kukuh indonesia merdeka 27 desemb 1949 seir konferensi meja bundar kmb prabowo subianto,senang
menteri tahan menhan prabowoaja subiantoo sambut aku belanda merdeka indonesia 17 agustu 1945 prabowo subianto,senang
prabowo apresiasi belanda aku merdeka ri maaf prabowo subiantoo,senang
deputi biro medium informasi sekretariat presiden ri bey machmudin agenda makan siang presiden joko widodo menteri tahan menhan prabowo subiantoo istana bogor jawa barat minggu,senang
hati harap doa,takut
harap dukung mejadi presiden doa prabowo subianto,senang
hadap kiai asep santri ponp amanatul ummah prabowo subianto,senang
dukung saudara hati prabowo subianto,senang
pasca maju calon presiden 2024 prabowo subianto,senang
area baris prabowoaja riak santri putri prabowo subianto,terkejut
prabowoaja nampak santai lempar senyum prabowo subianto,senang
desa hindar ribu santri penuh area masjid prabowo subianto,senang
polisi komponen tahan aman rakyat semesta hankam,senang
bahu bahu unsur paman polisi istimewa gugur polisi angkat senjata perang,senang
angkat senjata perang merdeka indonesia prabowo subianto,terkejut
prabowoaja dasar sejarah lahir polisi indonesia bentuk koloni prabowo subianto,senang
butuh polisi unggul sejarah adab manusia negara kuat negara hasil polisi unggul polisi hebat polisi cinta rakyat,senang
alhamdulillah prabowoaja kunjung jawa timur beliau temu ulama pimpin ponp sepuh jatim prabowo subianto,senang
syukur krisi dunia akibat perang ukraina inflasi jaga prestasi gampang inflasi momok dunia prabowo subianto,senang
alhamdulillah menteri tahan kontrak bumn industri tahan 800 persen prabowoaja prabowo subianto,senang
prabowoaja selang pekan jabat menhan presiden joko widodo jokowi tuga industri tahan indonesia kuat mandiri prabowo subianto,senang
jabat menhan prabowo suks naik kontrak bumn industri tahan 800 persen prabowo subiantoo,terkejut
prabowoaja datang sambung talus silaturahmi putra sulung presiden joko widodo gibran rakabum raka prabowo subianto,senang
tum gerindra prabowoaja subiantoo aku kaget lantar rawan jokowi jatim rawan gibran dukung prabowo subianto,terkejut
bobbi kejar target jadi defend id top 50 global compani 2024 prabowo subianto,terkejut
bobbi prabowo subianto,terkejut
angka besar baik sejarah pt 1976 pt len 1965 pesan harap capai rp130 triliun prabowo subianto,senang
dasar lapor uang 2022 usaha pelat merah hasil buku kontrak angka fantasti capai rp84 triliun prabowo subianto,senang
bobbi komitmen menhan prabowoaja maju industri tahan nasion dampak positif kembang defend id prabowo subianto,senang
resmi presiden jalan bimbing menteri tahan optimi defend id maju wujud indonesia maju,senang
bobbi aku era pimpin prabowoaja subiantoo komitmen bangun ekosistem industri tahan kuat modern cepat mandiri industri tahan indonesia nyata prabowo subianto,senang
sejarah indonesia direktur utama len industri direktur hold defend id bobbi rasyidin apresiasi komitmen menhan prabowoaja subiantoo bangun industri tahan nasion prabowo subianto,senang
tahan kuat dunia kera saing bangsa kera prabowo subianto,senang
negara indonesia ganggu tahan lemah prabowo subianto,takut
prabowoaja industri tahan milik peran vital merdeka bangsa indonesia prabowo subianto,senang
tindak budaya mark up liwat budaya bohong budaya tipu hilang industri tahan,marah
salah satu menghapu budaya boros korupsi mark up industri tahan prabowo subianto,marah
sambut prabowoaja indonesia salah negara untung lantar hasil lolo krisi akibat pandemi perang prabowo subianto,senang
menteri tahan menhan prabowoaja subiantoo komitmen menghapu budaya korupsi lingkung industri tahan nasion prabowo subianto,terkejut
menhan prabowo komitmen hapu budaya korupsi industri tahan prabowo subiantoo,terkejut
selamat juang maju serah gari pahlawan indonesia vital tahan indonesia,senang
prabowoaja karyawan pahlawan tahan gari gari pahlawan indonesia vital tahan indonesia prabowo subianto,senang
terima kasih sambut riah haru terima kasih gembira bangga saudara,senang
dengar nyata dirut defend id prabowoaja aku bangga gembira karyawan defend id prabowo subianto,senang
jabat tangan menhan wujud,senang
selamat karyawan karyawati defend id besar dukung menhan mandiri defend id bangga,senang
satu salam asal usaha prabowoaja jempol angguk bangga tepuk bahu prabowo subianto,senang
sapa karyawan defend id dar tunggu datang prabowo subianto,senang
prabowoaja langsung senyum turun maung hormat prajurit komcad prabowo subianto,senang
datang menteri tahan prabowoaja subiantoo pt dirgantara indonesia ptdi bandung jawa barat sambut karyawan tahan defend id prabowo subianto,senang
wow prabowo subiantoo capr favorit anak muda seru capres2024 dekade08 mendingprabowo terusmajubersamaprabow,senang
mantul anak muda demen prabowo subiantoo capr ngerock capres2024 dekade08 mendingprabowo terusmajubersamaprabow,senang
hasil survei hasil nyata turun sambut masyarakat melua prabowo subiantoo turun masyarakat,senang
wow mayorita anak muda pilih prabowo subiantoo capr keren capres2024 dekade08 mendingprabowo terusmajubersamaprabow,terkejut
gilak prabowo subiantoo favorit anak muda capr asik banget capres2024 dekade08 mendingprabowo terusmajubersamaprabow,terkejut
tuh anak muda dukung prabowo subiantoo capr keren abi capres2024 dekade08 mendingprabowo terusmajubersamaprabow,senang
seru nih prabowo subiantoo pilih anak muda capr top capres2024 dekade08 mendingprabowo terusmajubersamaprabow,terkejut
anak muda demen prabowo subiantoo capr mantap capres2024 dekade08 mendingprabowo terusmajubersamaprabow,terkejut
prabowo subiantoo kerap undang jokowi temu mata,senang
gilak prabowo subiantoo pilih mayorita anak muda capr asik banget capres2024 dekade08 mendingprabowo terusmajubersamaprabow,terkejut
prabowo subiantoo idola anak muda capr top markotop capres2024 dekade08 mendingprabowo terusmajubersamaprabow,terkejut
heboh anak muda dukung prabowo subiantoo capr keren abi capres2024 dekade08 mendingprabowo terusmajubersamaprabow,terkejut
prabowo subiantoo anggap kini anak muda capr favorit capres2024 dekade08 mendingprabowo terusmajubersamaprabow,terkejut
seru nih anak muda pilih prabowo subiantoo capr gokil capres2024 dekade08 mendingprabowo terusmajubersamaprabow,senang
wow mayorita anak muda dukung prabowo subiantoo capr asyik banget capres2024 dekade08 mendingprabowo terusmajubersamaprabow,terkejut
keren abi anak muda demen prabowo subiantoo capr semangat capres2024 dekade08 mendingprabowo terusmajubersamaprabow,senang
test ombak capr pilih 2024 guy ani baswedan rt prabowo subiantoo komen ganjarpranowo like,senang
prabowo subiantoo puja hati anak muda capr seru banget capres2024 dekade08 mendingprabowo terusmajubersamaprabow,senang
anak muda heboh prabowo subiantoo capr favorit kece capres2024 dekade08 mendingprabowo terusmajubersamaprabow,senang
jahat langgar ham prabowo subiantoo lupa keras keras langgar aja langgar toleransi apa tolak prabowo pimpin indonesia,marah
prabowo subiantoo harap kerja indonesia australia dorong kontribusi negara jaga damai stabilita kawasan kitasemuabersat,senang
prabowo subiantoo terima kasih australia latih 18 kadet tni angkat darat royal militari colleg rmc duntroon kitasemuabersat,senang
usut langgar ham berat prabowo subiantoo,marah
prabowo subiantoo nilai beranta korupsi banding capr,terkejut
projo sulawesi selatan putus dukung pasang prabowo subiantoo airlangga hartarto,senang
projo sulsel dukung prabowo subiantoo capr airlangga hartarto cawapr,senang
alam kapasita figur tarung pilpr airlangga hartarto milik kriteria butuh capr inten komunikasi prabowo subiantoo,senang
gempar komunita gapl madura dukung prabowo subiantoo presiden 2024 madurap ikutpakd,terkejut
ketua gerindra prabowo subiantoo,senang
calon presiden 2024 usung partai gerindra prabowo subiantoo aku menyes putus gabung perintah presiden jokowi 2019,sedih
ketua gerindra prabowo subiantoo kader turun langsung masyarakat,senang
tempu mutatur et no mutamur in illud putar amp ubah menantu harto ord tokoh kontroversi reformasi 98 akrab de jokowi gambar matang daddi prabowo aku,marah
pidato prabowo subiantoo bau,jijik
calon presiden gerindra prabowo subiantoo dadak report kunjung bandung jawa barat,sedih
prabowo mania 08,senang
prabowo menhan hubung beliau bidang milit dunia,senang
prabowo subiantoo sejahtera rakyat utama prabowountukindonesia,senang
moga moga prabowo subiantoo wakil ganjar satu satu anak bangsa basmi gerak langkah durjana yg rongrong nkr,sedih
prabowo salam setia bangun prabowo subiantoo,senang
brendskienavarr menhan prabowo subiantoo nilai polisi komponen tahan aman indonesia perang merdeka ri polisi angkat senjata perang polisi komponen tahan aman rakyat,marah
kyarahumanerror menhan prabowo subiantoo ucap terima kasih unsur bekerjasama ajak komponen bangsa bekerjasama dukung bantu satu hadap ancam pandemi covid kitasemuabersat,senang
menhan prabowo subiantoo serah bantu alk tiongkok rumah sakit rujuk tangan prabowo subiantoo,terkejut
beli pesawat beka sadar uang negara beban beli kondisi pilih baik beda pilih jng jatuh wara,marah
medso sih menhan prabowo subiantoo bos mu pura pura nggak tau anak tk aja tau pesawat tempur tua pesawat sukhoi generasi yg bagu,marah
jsuryop1 medso sih menhan prabowo subiantoo bos mu pura pura nggak tau anak tk aja tau pesawat tempur tua pesawat sukhoi generasi yg bagu,marah
pencapresan 2024 2 lolo yapitu ganjar pranowo prabowo subiantoo yg penuh sarat 2 kandidat yg tarung wawas bangsa lanjut bangun yg indonesia,senang
prabowo subiantoo dukung anak muda capr capres2024 dekade08 mendingprabowo terusmajubersamaprabowo,senang
anak muda kini suka prabowo subiantoo capr seru capres2024 dekade08 mendingprabowo terusmajubersamaprabowo,senang
prabowo subiantoo pilih baik anak muda capr keren banget capres2024 dekade08 mendingprabowo terusmajubersamaprabowo,senang
kini banget anak muda demen prabowo subiantoo capr mantap jiwa capres2024 dekade08 mendingprabowo terusmajubersamaprabowo,senang
seru prabowo subiantoo idola anak muda capr keren banget capres2024 dekade08 mendingprabowo terusmajubersamaprabowo,senang
prabowo subiantoo menang suara anak muda capr top capres2024 dekade08 mendingprabowo terusmajubersamaprabowo,senang
joss banget anak muda dukung prabowo subiantoo capr seru abi capres2024 dekade08 mendingprabowo terusmajubersamaprabowo,senang
ciamik prabowo subiantoo pilih utama anak muda capr capres2024 dekade08 mendingprabowo terusmajubersamaprabowo,senang
prabowo subiantoo anggap keren anak muda capr mantap capres2024 dekade08 mendingprabowo terusmajubersamaprabowo,senang
anak muda suka prabowo subiantoo capr semangat capres2024 dekade08 mendingprabowo terusmajubersamaprabowo,senang
prabowo subiantoo pilih mayorita anak muda capr kece badai capres2024 dekade08 mendingprabowo terusmajubersamaprabowo,senang
seru nih anak muda banjir dukung prabowo subiantoo capr joss capres2024 dekade08 mendingprabowo terusmajubersamaprabowo,terkejut
calon presiden gari anak muda prabowo subiantoo capr keren capres2024 dekade08 mendingprabowo terusmajubersamaprabowo,senang
prabowo subiantoo favorit anak muda capr seru deh capres2024 dekade08 mendingprabowo terusmajubersamaprabowo,senang
hasil survei prabowo subiantoo pilih anak muda capr asyik capres2024 dekade08 mendingprabowo terusmajubersamaprabowo,senang
anak muda mayorita dukung prabowo subiantoo capr keren abi capres2024 dekade08 mendingprabowo terusmajubersamaprabowo,senang
prabowo subiantoo primadona anak muda capr seru banget capres2024 dekade08 mendingprabowo terusmajubersamaprabowo,senang
anak muda pilih prabowo subiantoo capr idola woohoo capres2024 dekade08 mendingprabowo terusmajubersamaprabowo,senang
capr favorit anak muda prabowo subiantoo jawab capres2024 dekade08 mendingprabowo terusmajubersamaprabowo,senang
prabowo subiantoo dominasi anak muda dukung beliau capr gokil capres2024 dekade08 mendingprabowo terusmajubersamaprabowo,senang
heboh anak muda pilih prabowo subiantoo capr joss capres2024 dekade08 mendingprabowo terusmajubersamaprabowo,senang
prabowo subiantoo anggap keren anak muda capr favorit capres2024 dekade08 mendingprabowo terusmajubersamaprabowo,senang
mantul anak muda demen prabowo subiantoo capr ngerock capres2024 dekade08 mendingprabowo terusmajubersamaprabowo,senang
wow mayorita anak muda pilih prabowo subiantoo capr keren abi capres2024 dekade08 mendingprabowo terusmajubersamaprabowo,terkejut
gilak prabowo subiantoo pilih anak muda capr asik banget capres2024 dekade08 mendingprabowo terusmajubersamaprabowo,terkejut
tuh anak muda dukung prabowo subiantoo capr top markotop capres2024 dekade08 mendingprabowo terusmajubersamaprabowo,senang
seru nih prabowo subiantoo pilih mayorita anak muda capr capres2024 dekade08 mendingprabowo terusmajubersamaprabowo,senang
hai sobat pira moment prabowo subiantoo makan siang presiden joko widodo istana bogor baha ya pira piraluarbiasa piragoesdigit perempuan piragerindra gerindra gerindramenang 2024prabowopresiden prabowobaik indonesiamaju adilmakmur,takut
zero8ok prabowo andreassolusi bangsaygsujud bengkeldodo chaves1305 ahwal08 tuju prabowo subiantoo pimpin hebat peduli rakyat indonesia moga suks prabowoforindonesi,senang
beli qatar indonesia incar mirag 2000 uea prabowo subiantoo nego,takut
pesawat mirag made in peranc moga indonesia jaya udara menhan prabowo subiantoo nkri,senang
ahwal08 bangsaygsujud florieliciouss bengkeldodo genx36545403 tuju banget prabowo subiantoo pimpin hebat pikir penting rakyat indonesiamaj,senang
sandiaga uno resmi pamit partai gerindra maaf prabowo subiantoo kompa tv prabowo prabowounggul,sedih
prabowo subiantoo anugerah tokoh peduli santri fraksi gerindra prabowo prabowounggul,senang
prabowo subiantoo rahasia materi temu presiden jokowi istana bogor minggu ungkap polhuk adadikompa,terkejut
survey ani yg buncit serang uji poll buka ganti nama ani sandal jepit tentu pilih sandal jepit retweet ganjar pranowo like prabowo subiantoo,marah
prabowo subiantoo politik tuju baik hidup rakyat turut kuasa pribadi,takut
tim bela prabowo subiantoo kalo curang,takut
berita prabowo prabowo subiantoo ngaku menyes gabung jokowi putus detikcom prabowo bangkitbersama,sedih
prabowo subiantoo ngaku menyes gabung jokowi putus detikcom prabowo bangkitbersama,sedih
berita prabowo sosok sukses liga sepakbola rakyat rebut piala prabowo subiantoo viva prabowo bangkitbersama,senang
sosok sukses liga sepakbola rakyat rebut piala prabowo subiantoo viva prabowo bangkitbersama,senang
idam rakyat prabowo dorong kuat tribun jabar ikutpakd,senang
ahwal08 bangsaygsujud bengkeldodo florieliciouss lembayung071 prabowo moga bicara program2 bp jokowi terus bp prabowo pilih presiden hidup susah pimpin berani amp wawas bangsa berkah menang pilpr bp prabowo subiantoo prabowountukindonesia therightmanontherighttim,sedih
2024 prabowo subiantoo takdir presiden 8 ri,terkejut
propos runding prabowo subiantoo langkah maju ikutpakd,takut
rawan pro jokowo projo sulawesi selatan sulsel resmi dukung duat prabowo subiantoo airlangga hartarto sindonew news,senang
prabowo subiantoo kenang sang ibunda netizen pesona cantik viva prabowo prabowounggul,sedih
prabowo subiantoo arah apresiasi kerja kader gerindra wilayah konsolidasi jakarta barat kabupaten bogor,senang
prabowo subiantoo hormat lieu rmol id prabowo prabowounggul,senang
pilih prabowo subiantoo,senang
nih na curang namax kerah kader banjir sosm menang prabowo subiantoo presiden pilpr 2024 milu,marah
organisasi massa pro jokowi projo sulawesi selatan sulsel dukung usul ketua gerindra prabowo subiantoo calon presiden caritau caritaucom pilpr pilpres2024 pemiluindonesi,senang
sakit hati energi dendam syukur tuhan,marah
buset sabar nya rekan prabowo subiantoo ek kasum tni pulak wkwkw,terkejut
habib jindan saksi prabowo subiantoo orang hati prabowo subiantoo,senang
haru warga sagul ciami dapat bantu rp50 juta kk ikutpakd,sedih
didik olahraga makmur masyarakat indonesia juang tolong masyarakat partai gerindra prabowo subiantoo juang,senang
nelayan ideolog juang beras situ gera lepa spirit ibnu ibnu ariebowo sumo peduli prabowo subiantoo gizi anak,senang
ahwal08 bengkeldodo tutup rambut hitam prabowo subiantoo ga kenal bang prabowountukindonesi,marah
hasil prabowo subiantoo unggul provinsi ganjar pranowo dominan provinsi ani baswedan pimpin provinsi provinsi saing prabowo ganjar ketat sulit simpul unggul,terkejut
juang beras situ gera lepa spirit ibnu ibnu ariebowo sumo peduli prabowo subiantoo gizi anak,terkejut
ibnu ariebowo sumo alas prabowo subiantoo juang penting bangsa negara spirit gerindra diri sprit diri gerindra beras kelompok buruh tani nelayan ideolog da,terkejut
dapil kabupaten bekas menang prabowo subiantoo pilpr 2024 jadi slogan gerindra kabupaten bekas tradisi menag aria ketua bina ideolog dpp partai gerindra,senang
sufmi dasco bilang takdir prabowo subiantoo presiden 2024,senang
tekad menang prabowo subiantoo gerindra pilkada konsolidasi hadir ketua bina ideolog dpp partai gera indonesia raya gerindra ibnu ariebowo sumo anggota dpr ri obon tabroni drg,senang
dukung jokowi jatuh pilih prabowo tiga faktor kapabilita pimpin prabowo subiantoo lembaga survei prabowo menteri kerja baik,sedih
empathet clinic inform prabowosubiantoo gerindra pakansaricibinon,sedih
puji sikap kesatria prabowo subiantoo pakansari cibinong rela korban baik moga inspirasi humaninterest music friendli seriou epigrammat sarcast forma,senang
viral video haru iwan bule wasiat prabowo subiantoo tiada terenyuh msn prabowo bangkitbersama,sedih
berita prabowo viral video haru iwan bule wasiat prabowo subiantoo tiada terenyuh msn prabowo bangkitbersama,sedih
tingkat elektabilita prabowo subiantoo pengaruh faktor akrab presiden jokowi kerja baik kabinet indonesia maju pribadi prabowo subiantoo faktor endors presiden jokowi,senang
prabowo subiantoo juang laku masuk perintah kader gerindra gembira nyanyi doorpriz uang tunai puluh motor tim post view,senang
ibnu ariebowo sumo peduli prabowo subiantoo gizi anak didik olahraga makmur masyarakat indonesia juang tolong masyarakat partai gerindra da,senang
pilpr 2024 jadi slogan gerindra kabupaten bekas tradisi menag aria ketua bina ideolog dpp partai gerindra ibnu ariebowo sumo alas prabowo subiantoo juang penting bangsa negar,senang
fadlizon benah politik gerindra indonesia kasih pesawat beka prabowo subiantoo belik pesawat beka cari uang masuk beli alutsista korupsini,senang
prabowo subiantoo presiden pilpr muzani segenap kader gerindra lampung pialang tualang hambat wujud prabowo presiden gerindra menang 2024,takut
ribu kader penguru partai gera indonesia raya gerindra konsolidasi kabupaten bekas jaga tradisi menang tekad menang prabowo subiantoo gerindra pilkada,senang
prabowo subiantoo acung jempol sosok kesatria rela korban terima kasih dedi mulyadi papar indik sikap prabowo informatif prabowokesatria gerindradapil1bogo,senang
pasca cerai hendak sendiri prabowo subiantoo setia pilih hidup cinta,sedih
dedi mulyadi lebih sikap kesatria prabowo subiantoo milik setia cinta prabowo subiantoo hidup,senang
dedi mulyadi pimpin prabowo subiantoo sayang makan nyuapin kuce,senang
sikap kesatria prabowo subiantoo rela korban puluh bakti prajurit tni,sedih
dedi mulyadi sikap kesatria prabowo subiantoo sikap rela korban sayang setia,sedih
acara konsolidasi kader partai gerindra kabupaten bogor mantan politis golkar gabung gerindra dedi mulyadi puji sikap kesatria prabowo subiantoo,senang
jakarta ketua partai gerindra prabowo subiantoo kuas penting pribadi penting rakyat,senang
jakarta ketua partai gerindra prabowo subiantoo kuas penting pribadi penting rakyat,marah
gerindra rumor airlangga hartarto ngebet pengin cawapr prabowo subiantoo,jijik
top kerja prabowo subiantoo negeri pimpin nkri adil makmur prabowo gerindra pilih kita2,senang
konsolidasi penguru rawan prabowo subiantoo menang man dpw provinsi banten jalan lancar,senang
yuk dukung prabowo subiantoo sejahtera rakyat indonesia gerindra prabowo socialissu,senang
yakin dasco prabowo subiantoo presiden ri 2024,senang
kader gerindra gelar konsolidasi 2 wilayah jakarta bogor tugas prabowo subiantoo jakarta ketua partai gerindra prabowo subiantoo kuas penting pribadi penting rakyat,senang
prabowo luarbiasa subianto,senang
prabowopresiden202,senang
hansssolo ganjarpranowo p prabowo subiantoo gp garda prabowo ab prabowo lho lho piy wayah prabow,marah
pasca cerai hendak sendiri prabowo subiantoo kesetiaa,sedih
dedi mulyadi sambut dedi mulyadi pimpin prabowo subiantoo sayang makan nyuapin kuce,senang
sikap kesatria prabowo subiantoo rela korban,sedih
pasca cerai hendak sendiri prabowo subiantoo setia pilih hidup cinta ksatria sejati sejarah kisah mahabarata,sedih
dedi mulyadi lebih sikap kesatria prabowo subiantoo milik prabowo subiantoo hidup,sedih
prabowo subiantoo nilai milik pimpin setia jujur newsupd updat news text,senang
dedi mulyadi lebih sikap kesatria prabowo subiantoo milik iala,senang
prabowo acara konsolidasi kader partai gerindra kabupaten bogor mantan politis golkar gabung gerindra dedi mulyadi puji sikap kesatria prabowo subiantoo,senang
konsolidasi kader stadion pakansari cibinong kabupaten bogor minggu prabowo subiantoo arah apresiasi kerja kader gerindra wilayah konsolidasi jakarta barat kabupaten bogor,senang
jakarta ketua partai gerindra prabowo subiantoo kuas penting pribadi penting rakyat konsolidasi kader partai gerindra jakarta barat lapang bola kebon jeruk jakarta barat,marah
3 sifat istimewa prabowo subiantoo mata kang dedi mulyadi kdm saja deskjabar prabowo prabowounggul,senang
pasca cerai hendak sendiri prabowo subiantoo setia pilih hidup cinta ksatria sejati sejarah kisah mahabarata pilih tapa bangun baik indonesi,sedih
dedi mulyadi pimpin prabowo subiantoo sayang makan nyuapin kucin,senang
jakarta suara jelata partai gerindra prabowo subiantoo kuas penting pribadi penting rakyat,marah
loyal jokowi peluang pendamp prabowo subiantoo kejut prabowo bangkitbersama,terkejut
ketua partai gerindra prabowo subiantoo ajak kader partai gerindra kera menang partai milu 2024,senang
sifat istimewa prabowo subiantoo mata dedi mulyadi,sedih
mimpi dedi mulyadi prabowo subiantoo sma capai presiden 2024,senang
pilpr 2009 megawati sbi temu hasil menang subiantoo lanjut jabat period hubung kian pana,senang
jokowi ganjar pranowo mesra langkah prabowo subiantoo mati jalan dukung jokowi prabowo gint iphon 14 tvri malm minggu onic presid putin gu muhaimin sd inpr zoro one piec sore onad,senang
hasil survei baru capr ani baswedan kejar prabowo subiantoo ganjar pranowo kalah bawah,terkejut
tempodotco prabowo subiantoo ketua partai pilih pimpin yg kuat wibawa suruh layan partai,senang
prabowo subiantoo puji pimpin presiden jokowi prestasi kagum dunia via tribunjambik,senang
prabowo subiantoo puji pimpin presiden jokowi prestasi kagum dunia via tribunjambiku prabowosubiantoo jokow,senang
doa perintah jokowi jalan,senang
ketua gerindra jatim anwar sadad sebut prabowoaja doa kiai perintah jokowi jalan lancar prabowo subianto,senang
beliau harap restu pangestu kiai ulama silaturahmi ngalap berkah,senang
muzani tampik kontek abdi prabowoaja maju capr prabowoaja harap berkah kiai restu maju milu 2024 prabowo subianto,senang
sekjen gerindra ahmad muzani sebut prabowoaja komitmen abdi negara ulama kiai kondang jatim prabowo subianto,senang
prabowoaja momen tunduk cium tangan kiai prabowoaja dorong asuh ponp ploso diri kh nurul huda djazuli duduk kursi roda prabowo subianto,terkejut
harap temu kuat gerindra bumi majapahit jawa timur harap basi prabowoaja prabowo subianto,senang
silaturahmi ngalap berkah,jijik
temu tutup prabowoaja kiai ulama makan siang telah prabowoaja langsung tinggal lokasi prabowo subianto,senang
lansir detikjatim senin prabowoaja damping muzani ketua dpd gerindra jatim anwar sadad temu salah restoran jalan sumatra surabaya jam prabowo subianto,senang
indonesia bhineka tunggal ika beda indonesia bangkit bangsa hebat,senang
aku haru kiai pendeta canda mesra prabowo subianto,senang
canda prabowo subianto,senang
malam kagum sama gu miftah pendeta gilbert prabowo subianto,senang
janji lelah jam acara bas ribu purnawirawan prabowo subianto,marah
ceramah pendeta gilbert canda jamaah jamaah perempuan hadir aji open hous prabowo subianto,senang
pendeta gilbert sempat ceramah 5 menit prabowo subianto,senang
beli permen desa prabowoaja indonesia,marah
lihat sukarno suharto susilo bambang yudhoyono joko widodo besok,marah
gu miftah presiden pilih pilpr 2024 tuli tetap allah swt dasar ramal rongowarsito presiden akhir huruf o prabowo subianto,senang
prabowoaja bilang bangsa rukun,senang
bangsa indonesia rahmat allah swt rukun beda agama prabowo subianto,senang
orang silaturahmi panjang umur lancar rejekinya sehat badan bahagia hidup prabowo subianto,senang
turut silaturahmi silaturahmi panjang umur lancar rejekinya sehat badan sayang prabowoaja prabowo subianto,senang
kenal prabowoaja undang sempat silaturahmi prabowo subianto,senang
acara silaturahmi sambung kasih sayang prabowo subianto,senang
jemaah malaysia hongkong prabowo subianto,senang
lebaran kemarin jamaah pondok pesantren os aji pergi ceramah malaysia hong kong prabowo subianto,senang
gu miftah selenggara aji akbar malam ahad pahe bulan prabowo subianto,senang
acara gelar pondok pesantren os aji milik gu miftah hadir warga prabowoaja rombong sekira wib prabowo subianto,senang
jakarta menteri tahan menhan prabowo subiantoo hadir undang acara open hous akbar pondok pesantren ponp os aji sleman daerah istimewa yogyakarta diy rabu malam,senang
hujat sakit hati gu miftah ngaku ajar ikhla prabowo prabowo subiantoo,sedih
