quoted_text,emosi
insha allah masyarakat ntb mayorita dukung ganjar pranowo blacklist tukeran kiboy wanwan gu muhaimin axelsen erina markhyuck jaya jaya jaya fisika tudum karina kingtheland ganjarpranowo ganjarmenangtot ntb ganjarsatukanrikuat ganjarpilihanterbaik capreses2024,senang
gengsi jaga lingkung,marah
cinta negara indonesia cinta umkm,netral
ganjar pranowo pimpin sejahtera rakyat,senang
ganjar serbu ribu warga bal sambut lapang renon bal datang ganjar pranowo hadir acara creativ fun walk lapang lokasi pers kantor gubernur bal wayan koster,senang
perintah bersih layan,netral
ganjar pranowo pimpin idam kalang,senang
ganjar pranowo pimpin idam rakyat indonesia,senang
ribu masyarakat ntb antusia sambut ganjar pranowo,senang
ganjar pranowo presiden ri 2024,senang
warga ntb dukung ganjar pranowo,senang
bidik pilih muda ganjar pranowo gelar temu diskusi pemuda gen z mileni bal kebon vintag car bal classic denpasar,netral
ayikmz mencarisejati28 aniesbaswedan tyrexmaximu iya ganjar pranowo nonton bokep hobi,marah
moga besok senin berita kejut gu muhaimin gu imin masuk radar cawapr ganjar pranowo lanta lanjut netizen gelar tiket yuk seru nih erina tukeran honda pontianak lombok,takut
ntb dukung ganjar pranowo,senang
ganjar pranowo mobil fatmawati terawang indigo,terkejut
ganjar pranowo dukung industri kreatif anak mileni ganjarcapres ganjarpilihanterbaik ganjarbawakemajuan ganjarpresiden2024 ganjarpresiden,senang
ketua dpd pdip ntb rachmat hidayat provinsi syukur pilih ganjar pranowo pilpr 2024,senang
bal with ganjar pranowo mentari pagi sari lapang renon serta senyum mere ganjarpranowo yg sambut hangat warga ganjar spesial bkan sehat badan tp jg membungahkan hati warga amp yg pandang menangkanganjar,senang
ainurohman next event wawancara nya ganjar pranow,netral
ganjar pranowo taat atur bawaslu aman ya gak langgar atur menangtot 2024menangtot tag jenni demonslay jisoo aang morningg axelsen sore one piec kingthelandep2 bongkarkasusancol lovestori bobbi jeon wonwoo gu muhaimin,marah
ganjar pranowo no aniesbaswedan ye,jijik
ganjar pranowo capres idam rakyat suka kalang,senang
acara temu budaya indonesia raya sambut koster ajak bupati n wali kota pulau bal menang capres pdip ganjar pranowo absen bupati walikota cc aniespresidenrakyatwara aniespresidenrakyatwara,senang
ganjar pranowo ajak kelola bangsa,terkejut
ganjar pranowo kolaborasi gen z ganjarcapres bruno mar lisa tvri iphon 14 gint kingthelandep1 jungkooki yeonjun namjoon gantung plossa,netral
satu rawan satrel ganjarist jakarta selatan dki deklarasi ganjarpranowo bacapres mantap ganjarist optimi ganjar pranowo menang,senang
masyarakat ntb sambut gembira hadir ganjar pranowo bukti ganjar cinta rakyat mana menangtot 2024menangtot tag jenni jisoo onad demonslay one piec kingthelandep2 jeon wonwoo lisa seeyouinmy19thlif theuncannycounter2 axelsen junkyu pledi aang,senang
ganjar kan program lapak ganjar indonesia butuh ganjar pranowo,netral
alumnus unpad nyata dukung ganjar pranowo presiden ri,senang
ganjar pranowo cinta masyarakat ntb ganjarcapres bruno mar lisa tvri iphon 14 gint kingthelandep1 jungkooki yeonjun namjoon gantung plossa,senang
ganjar pranowo megawati prananda koster hadir konsolidasi akbar pdi juang bal upaya aman menang milu pdi juang bal kumpul konsolidasi akbar gema semangat sama,netral
ganjar pranowo politis mitra setia rawan dukung inspirasi arah motivasi gerak maju,netral
kunjung ntb ganjar pranowo sapa rawan dukung lapang nasion lombok lapang nasion lombok ganjar pranowo rendah hati dengar cerita alam rawan dukung,senang
tingkat ttp d yg repli wagub tajyasinmz merinci dapat daerah dr sektor pajak daerah realisasi retribusi daerah hasil kelola kaya daerah yg pisah 100 dll pad yg sah,netral
ganjar pranowo puji sosok tgb kenal dpr gubernur ganjarpranowo,senang
dongeng ganjar pranowo baik gaji honor jawa bijak gaji yg sesuai umk guru yg bantu bijak yg laku ganjar pranowo gaji honor baik kualita didik,marah
ketua dpp pdip puan maharani nama ketua partai demokrat agu harimurti yudhoyono ahi masuk radar calon wakil presiden cawapr damping ganjar pranowo milu puan lontar ahi,netral
mantap dukung ganjar pranowo capres idam rakyat,senang
puluh ribu penguru kader simpatisan pdip temu bacapres pdip ganjar pranowo lapang nasion selong lombok timur konsolidasi akbar rawan ganjar sindonew news,senang
poin tuk kembang dunia didik ala ganjar pranowo ak didik rata penetapam umk guru pegawai honor lingkung didik inovasi teknolog dunia didik,senang
tokoh sanding calon wakil presiden cawapr damping ganjar pranowo pilpr salah satu ketua hari nasion dpp partai perindo tuan guru bujang tgb zainul majdi tuan guru bujang zainul majdi mantan gubernur,netral
sandiaga uno dekat kalang muda modal pilih ganjar pranowo,jijik
yunartowijaya pimpin inga rasa damai nya bawah pimpin presiden jokowi rusa terang tidaaaaaaak butuh sang peneru kalem ramah congkak jiwa asih ganjar pranow,marah
ganjar tumpang mobil presiden ri 1 5 ratu ayu indigo ramal tanda tanda menang ganjar pranowo ganjarpranow,netral
asyiapp mba,jijik
sekjen rumah sandiuno indonesia rsi denni suryo prabowo calon presiden bacapres pdip ganjar pranowo untung pilih sandiaga uno damping kontestasi pilpr sisi,netral
halo sahabat ribu rawan sahabatganjar masyarakat nusa tenggara barat sambut datang ganjarpranowo dgn penuh antusiasm lombok intern airport ganjar pranowo hadir temu dgn elemen masyarakat ntb,netral
hobahhhh gaskeun ganjar dukung ganjar santuy hoak fitnah ganjar pranowo hati salam metal,marah
atikoh ganjar pranowo pesan khusu perempuan indonesia perempuan kuat ajar lupa bahagia pesan singkat makna kaum hawa dengar,senang
airindatanglagi ganjarpranowo erickthohir sandiuno yg usung erickthohir yg usung tolak bu mega so ganjar pranowo ikat kerangkeng gp gk hak tentu cawapr puan cc adearmando61,netral
ganjar pranowo orasi lapang sejarah,netral
ganjar pranowo struktur partai gerak tp,netral
cnnindonesia terang klo dukung prabowo jd percaya dech sdh 2x kalah pilpr klo kalah u tiga klnya hati jd malumaluin aja mend dukung ganjar pranowo dech yg sdh lanjut kerja jokowi suka kerja jokowi lumayan,jijik
tuan guru bajang tgb zainul majdi masuk bursa calon wakil presiden cawapr pendamp ganjar pranowo,netral
anak bandung dukung ganjar pranowo,senang
dialog perempuan indonesia pilih ganjar pijar rumah aspirasi rawan menteng atiqoh cinta produk negeri tuju utk beranta miskin,senang
kopi malang daerah amstirdam ampelgad sumbermanj tirtoyudo dampit ken dg citra yg kha dunia fokus kopi rawan cangkir kopi nusantara malang selatan menang ganjarpranowo,senang
mediaindonesia ketawa bro jd kasihan lihat org ganjar pranowo prestasi jateng terus kerja jokowi sdh tarik hati org tp loe dgn prestasi dki doang 100 malu lanjut kerja jokowi loe dibenc org,marah
catat ya bu atiqoh ganjar pranowo achiev bagu beliau dukung ganjar raih capai lupa mandiri istri jabat,netral
sambut warga ntb ganjar pranowo lepa jokowi effect kali kalah berturut2 tp jokowi bangun ntb tanda terimakasih dukung capres pdip,senang
ganjar pranowo dukung bulli capres myganjar ganjarpranowo ganjar ganjarforpresident2024,senang
ganjar pranowo ajak mileni gen z tentu arah politik,netral
salah beda berita dukung pd ganjarpranowo amp abud klw ganjar berita jendral dukung ganjar dukung ganjar klw abud berita teror amp ex hti dukung abud gmn,jijik
hushbear40 netipedia ganjar pranow,marah
dekat ma ganjarpranowo tgb masyarakat lombok harap inspirasi warga ntb pilih presiden peneru jokowi,senang
kickandyshow ganjar pranowo amp ani undang next tunggu undang prabowo ya ban,netral
temu gbk puan tegas ahi masuk radar cawapr ganjar pranowo kotak masuk,netral
tuan guru bujang zainul majdi masuk bursa cawapr ganjar pranowo bagu,netral
logistik dalem prabowo ani baswedan sandiaga uno kubu ganjar pranowo udah paham,jijik
dpw sahabat ganjar jatim ada senandung sholawat doa raih menang ganjar pranowo pilpr onad bruno mar axelsen pontianak bt is back gint one piec,senang
anak muda bandung dukung ganjar pranowo presiden ri 2024,senang
dukung ganjar pranowo capres ri 2024 ganjarcapres,senang
ani top pilih ani pimpin berani putra tomo pranowo bicara adil komitmen rakyattolakpemilutertutup rakyattolakpemilutertutup,terkejut
ganjar pranowo presiden 2024 pilih rakyat ganjarpranowo ganjarcapres ganjarpresiden ganjarmenangtot ganjarpilihanrakyat presiden2024 ganjarpresiden2024 pilpres2024 pemilu2024,netral
rapat baris ganjar pranowo presiden 2024 sambut riah warga rawan ntb ganjarpranowo ganjarcapres ganjarpresiden ganjarmenangtot ganjarpilihanrakyat presiden2024 ganjarpresiden2024 pilpres2024 pemilu2024,netral
warga ntb dukung ganjar pranowo presiden 2024 ganjarpranowo ganjarcapres ganjarpresiden ganjarmenangtot ganjarpilihanrakyat presiden2024 ganjarpresiden2024 pilpres2024 pemilu2024,senang
ganjar pranowo dukung industri kreatif anak mileni gen z maju bangsa ganjar pimpin indonesia,senang
warga amp pemuda mileni d ringinsari d gedang kec sumbermanj wetan kab malang jatim deklarasi dukung amp kawal ganjarpranowo gabung dlm gera rawan cangkir kopi nusantara rapat baris menang ganjar pilpr,netral
dukung ganjar pranowo presiden ganjarcapres,senang
alumnus universita padjadjaran dukung ganjar pranowo ganjarcapres,senang
dukung ganjar pranowo presiden 2024 ganjarcapres,senang
dukung ganjarpranowo makkkk wuzzzzz ganjar lampung gabung gelar deklarasi rawan utk menang ganjar pranowo presiden ri,senang
poll buka tribunwow tribun video tribun pontianak ani menang prabowo subianto ganjar pranowo video makzulkanpresidencawe2 makzulkanpresidencawe2,netral
bacapres pdip ganjar pranowo tanggap kait calon wakil presiden bacawapr damping pilpr 2024 sindonew news,netral
ganjar pranowo figur pimpin masuk kalang sosok muda humor santuyi sesi gen z bikin suasana cair ganjaruntuksemua lanjutkanbersamaganjar,senang
damping tuan guru bajang muhammad zainul majdi ganjar pranowo interaksi dg gen z lombok ntb sesi foto2an selfienya lewat,senang
astungkara warga bal bendung ganjar pranowo lapang puput laut dukung ganjar ri matur suksma bal ganjarmenangtot,netral
ganjar pranowo indonesia ema 2045 capai ganjarpranowo ganjarcapres ganjarpresiden ganjarmenangtot ganjarpilihanrakyat presiden2024 ganjarpresiden2024 pilpres2024 pemilu2024,senang
kaum mileni gen z dukung ganjar pranowo presiden 2024 ganjarpranowo ganjarcapres ganjarpresiden ganjarmenangtot ganjarpilihanrakyat presiden2024 ganjarpresiden2024 pilpres2024 pemilu2024,senang
alumnus unpad nyata dukung ganjar pranowo presiden 2024 ganjarpranowo ganjarcapres ganjarpresiden ganjarmenangtot ganjarpilihanrakyat presiden2024 ganjarpresiden2024 pilpres2024 pemilu2024,senang
alumnus universita padjajaran jawa barat dukung ganjar pranowo presiden 2024 ganjarpranowo ganjarcapres ganjarpresiden ganjarmenangtot ganjarpilihanrakyat presiden2024 ganjarpresiden2024 pilpres2024 pemilu2024,senang
warga bal dukung ganjar pranowo presiden 2024 ganjarpranowo ganjarcapres ganjarpresiden ganjarmenangtot ganjarpilihanrakyat presiden2024 ganjarpresiden2024 pilpres2024 pemilu2024,senang
ganjar pranowo peneru presiden jokowi ganjarpranowo ganjarcapres ganjarpresiden ganjarmenangtot ganjarpilihanrakyat presiden2024 ganjarpresiden2024 pilpres2024 pemilu2024,senang
alumnus unpad dukung ganjar pranowo presiden 2024 ganjarpranowo ganjarcapres ganjarpresiden ganjarmenangtot ganjarpilihanrakyat presiden2024 ganjarpresiden2024 pilpres2024 pemilu2024,senang
90 persen anak muda bandung dukung ganjar pranowo presiden 2024 ganjarpranowo ganjarcapres ganjarpresiden ganjarmenangtot ganjarpilihanrakyat presiden2024 ganjarpresiden2024 pilpres2024 pemilu2024,senang
calon presiden bacapres ganjar pranowo ajak suami kasih sayang pasang sindonew news,senang
bagi2 sembako rawan ganjar pranowo ricuh lampung utara koalisibonekaistana koalisibonekaistana,marah
partai satu bangun ppp percaya figur menparekraf sandiaga uno penuh kriteria calon wakil presiden cawapr ganjar pranowo sindonew news,marah
serius org mw dijadiin cawapr ganjarpranowo doa airin tuh moga org gk jd cawapr ganjarpranowo kasi partai amp gp kewalahan utk jwb prtnyaan org tingkah konyol org,jijik
tgh tetes air mata doa ganjar pranowo presiden,sedih
erickthohir cawapr teras joss duet ganjar pranowo ganjarerickduetterbaik,terkejut
setyaki22965702 ryu53944310 ganjarpranowo mantap banget ganjar pranowo presiden peneru kerja presiden jokowi rampung indonesia maju sejahtera,senang
ganjar pranowo calon presiden baik ganjarcapres,senang
ganjar pranowo tanggap temu ketua dpp pdip puan maharani ketua partai demokrat agu harimurti yudhoyono ahi ganjarpranowo temu bagu kontek politik kontek bangsa negara,netral
knp dengar nama uno yg ad dpikiran gw tampil debat it setip atm halal mandi lumpur bu li yg gk dicov bpj nurjanah yg tinggal ad yg msi halu uno in,marah
alumnus unpad nyata dukung ganjar pranowo ganjarcapres ganjarpilihanterbaik ganjarbawakemajuan ganjarpresiden2024 ganjarpresiden,senang
dukung ganjar pranowo alir dera kalang komunita ganajrcapres,senang
jokowi ganjarpranowo ganjar pranowo bawa indonesia man,senang
jokowi ganjarpranowo ganjar pranowo the next presid,senang
bungkustukang ganjarpranowo ga polllll ganjar pranowo presiden peneru kerja presiden jokow,senang
subur0204 iyusrusliadi73 ganjar pranowo harga mati nkri harga mati salam wara,senang
hasil musra gorontalo calon presiden 2024 total pesrta 857 1 air langga hartarto 161 2 sandiaga uno 140 3 prabowo subianto 132 4 ganjar pranowo 123 5 mahfud md 85 6 ani baswedan 52 7 muldoko 36 musraindonesia musragorontalo,netral
jhonnisinaga20 ganjarpranowo inti pilih ganjar pranowo bere,senang
masyarakat 90 dukung ganjar pranowo,senang
musra indonesia ix gorontalo vote kejut hasil posisi airlangga hartarto sandiaga uno prabowo subianto pranowo mahfud md ani baswedan musraindonesia musragorontalo,netral
dpw partai nasdem gorontalo usul nama bacapres ani baswedan ganjar pranowo rachmat gobel erick thohir andika perkasa rakernasnasdem2022 partainasd,netral
rstmbcl ganjarpranowo ganjar pranowo presiden peneru kerja presiden jokowi cepat prose bangun ikn nkri harga mati ani rasyid baswedan minat,senang
dukung alir ganjar pranowo sang presiden ganjarcapres,senang
eksklusif ganjar pranowo maju calon presiden beritasat,senang
lengkap erickthohir ganjar pranowo lengkap ganjar politis dpr laku ekonomi erick thohir laku eksekusi ekonomi ganjarerickduetterbaik,netral
warga rawan ganjar sambut riah datang ganjar pranowo ntb,senang
ganjar pranowo pimpin pidato kunjung marka dpw ppp ntb hadap penguru kader ppp ganjar bagi kesan politik lalu pdiperjuangan 50tahunpdip bangunlahjiwadanbadannya solidbergerak menangkanganjar,senang
hansssolo preeeet akal2an dukung capres abadi narik dukung ganjar pranow,marah
calon presiden besut partai demokrasi indonesia juang pdip ganjar pranowo ikut konsolidasi intern pdi juang bal denpasar sabtu suara pilih transaksi lontar ganjar dengar target,netral
mayorita warga ntb rapat dukung penuh ganjar pranowo ganjarcapres,senang
anak muda antusia sambut ganjar pranowo,senang
alumnus unpad dukung ganjar pranowo presiden 2024,senang
survey ani yg buncit serang uji poll buka ganti nama ani sandal jepit tentu pilih sandal jepit retweet ganjar pranowo like prabowo subianto,marah
tanggap ganjar pranowo temu puan ahi bagu,netral
usul cawapr ganjar pranowo sandiaga uno juang mardiono via tribunnew,netral
bal menang ganjar pranowo,senang
mhdyusufhandok1 jokowi bentar pensiun yg gantiin ya ganjar pranowo,senang
ganjar pranowo pimpin indonesia 2024,senang
sabtu 17 juni 2023 dukung calon presiden capres ganjar pranowo penjuru dunia ada kolaborasi ajar jajar pijar ganjar sindonew news,netral
ganjar pranowo dukung kalang,senang
dukung masyarakat bal ganjar pranowo ganjarcapres ganjarpranowo jokowi milu ganjarcapres ganjarcapresespdip ganjarcapreses2024 ganjarcapres indonesiamaju,senang
masyarakat bal dukung ganjar pranowo presiden ganjarcapres ganjarpranowo jokowi milu ganjarcapres ganjarcapresespdip ganjarcapreses2024 ganjarcapres indonesiamaju,senang
agusyudhoyono moga demokrat rapat ganjar pranowo biar si ni ra sido,netral
yunartowijaya survei charta politika ganjar pranow,netral
poll yuk biar rekayasa rakyat indonesia pilih salah capres favorit tunjuk capres pilih benar2 raih suara prabowo like ani baswedan retwit ganjar pranowo komen pollingcapres capreses2024,senang
dukung ganjar pranowo for presiden indonesia 2024 ganjarcapres ganjarpranowo jokowi milu ganjarcapres ganjarcapresespdip ganjarcapreses2024 ganjarcapres indonesiamaju,senang
live ganjar pranowo sambut laut manusia lapang selong lombok timur,netral
dukung warga ntb ganjar pranowo ganjarcapres salmasalsabil gu muhaimin onad iphon 14 pontianak axelsen aang one piec,senang
antusiasm masyarakat ntb sambut ganjar pranowo ganjarcapres salmasalsabil gu muhaimin onad iphon 14 pontianak axelsen aang one piec,senang
warga ntb dukung ganjar pranowo ganjarcapres salmasalsabil gu muhaimin onad iphon 14 pontianak axelsen aang one piec,senang
pekik ganjar pranowo presiden gema lapang nasion selong lombokitaid,terkejut
ganjar pranowo sapa ribu masyarakat lombok timur lapang nasion ntb penuh hangat menangkanganjar generasigotongroyong sahabatganjar ganjarpranowo ganjar,senang
minggu 18 juni 2023 suasana penuh hangat sama liput lapang nasion ntb ganjar pranowo sapa ribu masyarakat lombok timur ada ganjar masyarakat lombok timur lapang nasion bukti nyata,senang
ajak puan masuk poro ubah ambyaaarr ganjar pranowo,marah
detikcom tohir ani baswedan puan maharani ganjar pranowo ahi cebong kampret autobingung cebong kampret auto akur oligarki tertawa,marah
pasang gaet idam amat mileni nilai unggul erickthohir bidang ekonomi bisni lengkap posisi capres ganjar pranowo politis tulen gaspol erick ganjar ganjarerickduetterbaik,senang
gak sabar nunggu ganjar pranowo presiden 10 genap 20 sakit,senang
amat politik uph emru sihomb sebut unggul erick thohir dunia ekonomi bisni lengkap ganjar pranowo birokrat politis tulen piawai pimpin bumn nilai erick thohir ganjarerickduetterbaik gantung plossa,senang
jabar deklarasi dukung ganjar pranowo bacapres 2024,senang
cocok presiden pk presiden indonesia biar ganjar pranowo aj,senang
pemgamat politik emru sihomb menteri bumn erickthohir cocok pasangankan ganjar thohir unggul bidang ekonomi milik jaring ganjarerickduetterbaik,netral
rekomendasi rapat pimpin nasion rapimna partai satu bangun ppp menteri pariwisata ekonomi kreatif menparekraf kader ppp sandiuno tugas cawapr damping ganjarpranowo,netral
calon presiden republik indonesia ganjar pranowo dorong penguru dpd pdi juang ntb rubah strategi kampanye milu 2024 sindonew news,netral
nama tokoh masuk bursa cawapr ganjar pranowo pilpr 2024 kaji dpp pdi juang kecuali nama mantan gubernur nusa tenggara barat tuan guru bajang tgb muhammad zainul majdi,netral
calon presiden capres pdip ganjar pranowo hadir resepsi nikah putri politiku senior pdi juang aria bima the dharmawangsa jakarta kebayoran jakarta selatan minggu malam sindonew news,senang
nama santer kabar menjadai cawapr ganjar pranowo pilpr sekian nama menteri sindonew news,netral
yg sungguh elektabilita yg sbg capres pdip puan maharani retweet ganjar pranowo like,marah
rawan omg riau deklarasi dukung ganjar pranowo presiden 2024 taman motuyoko awang kabupaten siak riau sabtu sindonew news,netral
konsolidasi ganjar pranowo lombok timur banjir kader pdip sukarelawan ganjarpranowo,netral
hadir acara dinas penandatanganan kerjasama bidang seni sanur ganjar pranowo sempat ikut undang jalan sehat lapang renon ribu orang sambut beliau,senang
dipungkiri jokowi kader pdip dukung ganjar pranowo usung pdip merahtegakluru,netral
momen tarik lawat bacapres ganjarpranowo nusa tenggara barat ntb minggu sempat ganjar pranowo sopir ketua hari nasion partai perindo tuan guru bajang tgb hm zainul majdi,netral
kereeen gubernur jawa ganjar pranowo jalan sehat bareng masyarakat grobogan rangka ingat lahir pancasila kabupaten grobogan even yg hadir puluh ribu masyarakat ronaldo axelsen onad innalilahi mandalika onic ronaldo tomcat,senang
pentol pdip amp partai demokrat petinggi 2 partai temu bilang coba ma ahi msk radar pdip baca wapr ganjar pranowo nasdem ma ahi wapr ani dar saran ma ahi ani 1000 gagal nie sayang uang mu sblm lang,netral
romeowalker19 presiden pk cocok presiden indonesia ganjar pranowo aj,senang
terobos ganjar pranowo sempurna sekolah virtual warga miskin difabel iphon 14 onad gint ronaldo onic indonesiaopen2023,terkejut
tuan guru bajang tani ganjar pranowo ziarah makam pahlawan nasion maulanasyaikh tgkh zainuddin abdul madjid pancor selong lombok timur,netral
ganjar pranowo buka suara tgb masuk bursa cawapr damping,netral
thalomoan1 ganjar pranowo peneru pakdh jokowi,senang
calon menang ganjar pranowo,senang
ingat hut ganjarist ketua ganjarist torut menang ganjar pranowo presiden ri,senang
calon presiden ri partai demokrasi indonesia juang pdip ganjar pranowo angkat bicara kelak damping pilpr 2024 sindonew news,netral
lihat video ganjar pranowo tiktok,jijik
ganjar pranowo dorong ekonomi sirkular implementasi misi presiden joko widodo gubernur jawa ganjar pranowo upaya wujud ekonomi sirkular jateng jalan salah misi perintah presiden joko widodo,senang
lari pagi agusyudhoyono apakabar koalisi ubah ani baswedan ubah ganjar pranowo,netral
abaaah test lembaga survey undang istana milik hasil nilai dng pool random twitter ani baswedan prabowo rt ganjar pranowo like cc bangediii kafiradikali doktertif,takut
kunjung calon presiden pdip ganjar pranowo kantor dpw partai perindo ntb damping ketua hari dpp perindo tgb hm zainul majdi,netral
kabar lombok ganjar pranowo,netral
ketua dpw partai satu bangun ppp ntb muzihir aku bahagia kantor partai kunjung langsung ganjar pranowo beliau ganjarpranowo tang pilih presiden pilpr 2024,senang
ganjar pranowo sowan kantor dpw ppp ntb,netral
ganjar pranowo syukur sowan sangu restu moga kuat semangat ganjarpranowo,senang
usung partai gabung pdi juang gabung kerja calon negosiasi ganjar pranowo,netral
hadir ganjar sambut rawan berswafoto rawan rebut foto gubernur jawa ganjar pranowo,senang
bener banget bu atiqoh ganjar pranowo belanja produk umkm tinggal langsung gerak ekonomi otomat daya beli jaga menjngkat cakep smart nih nyuwun sewu,senang
kalung sorban kha ppp ganjar pranowo hadir kantor dpw ppp ntb ganjar pranowo partai logo sahabatganjar,netral
ganjar pranowo peduli seniman,netral
alam usia muda cawapr ganjar pranowo,senang
rapat baris ganjar pranowo sambut riah warga rawan ntb ganjarpresiden ganjarcapreses2024,senang
rawan ganjar menang suara ntb ganjar pranowo kairi blacklist tukeran kiboy gu muhaimin axelsen onic gg onic,netral
konsolidasi menang pilpr 2024 ntb ganjar pranowo kairi blacklist tukeran kiboy gu muhaimin axelsen onic,marah
silaturahmi dpw ppp ntb ganjar pranowo kairi blacklist tukeran kiboy gu muhaimin axelsen onic,marah
sambur riah rawan ganjar lombok ganjar pranowo kairi blacklist tukeran kiboy gu muhaimin axelsen onic,marah
rawan ganesa ntb tunggu datang capres baik ganjar pranowo lombok timur ntb menang pdi juang perindo hanura ppp serta kuat rawan ganjar pranowo semangat kawan everyon ganesa ganjaruntukindonesiasatu,senang
faktor adi cema jokowi jalan dukung ganjar pranowo presiden,senang
kandidat capres rambut putih ganjar pranowo klo belah ngklaim dpt dukung rambutni cat putih dlu,netral
ntb ayooo dukung pilih ganjar pranowo presiden ganjar menang indonesia gemilang ganjar menang total ganesantb ganesa ganjaruntukindonesiasatu,senang
calon presiden ri ganjar pranowo sepeda soekarno 83 ketua penguru anak cabang pac pdi juang sumbawa soekarno salah tokoh gaek pdi juang sumbawa sindonew news,senang
rawan ganjar indoneaia ntb ganesa memerihakan acara silaturohmi capres ganjar pranowo kantor dpd pdi juang ntb kota mataram lapang nasion selong kab lombok timur,senang
gertak pdip utk koalisi perobahan ani cepat pilih ahi utk cawapr gertak jebak cepat tentu siap yg pilih jd calon wakil timbang pdip tentu sesuai cawapr ganjar pranow,takut
dukung warga jateng jatim ganjar pranowo 2024 alir,senang
momen acara maju ganjar mabar bal kemarin ganjar pranowo kenal apk jeknyong kpd masyarakat ajak kolaborasi putri lingkung hidup 2020 putu ayu saraswati bal woow apk dngn ai investasi 80 m lho,netral
kompastv nasdem target pileg pilpr pakai teropong bintang bacapres ganjar pranowo menang pilpr 2024 nasdem perintah hasil survey pesan bayar maknyu bakar kemenyan jumat kliwon eyang,netral
ahi puan maharani singgung cawapr ganjar pranowo,netral
pokok yg baik yaa ganjar pranowo org tau pakdementorganjar,senang
ganjar pranowo imam aja,marah
ganjar pranowo target menang 51 persen suara ntb blacklist axelsen tukeran kiboy erina gg onic gu muhaimin wanwan yoshi junkyu ekonomi fisika,marah
ganjar pranowo ajak kader pdip raih menang ntb blacklist axelsen tukeran kiboy erina gg onic gu muhaimin wanwan yoshi junkyu ekonomi fisika,marah
ganjar pranowo silaturahmi dpw ppp ntb blacklist axelsen tukeran kiboy erina gg onic gu muhaimin wanwan yoshi junkyu ekonomi fisika,senang
survei bukti ganjar pranowo pimpin indonesia kerja ganjar bukti warga negara ganjar baik,senang
hasil survei cnbc indonesia 2 mei 2023 prabowo subianto 17 ganjar pranowo 16 ani baswedan 67,netral
romeowalker19 agu pintar gabung pdip cawapr pa biar ganjar pranowo menang presiden ahi menteri biar alam kerja perintah tpi klu ag dukung ani psti klh dn opsi lg,takut
safari politik ntb ganjar pranowo sambang marka dpw ppp nusa tenggara barat datang ganjar pranowo sambut hangat kader partai logo kalung selendang kader partai kunjung ganjar harap kolaborasi,senang
kalung sorban kha ppp ganjar pranowo hadir kantor dpw ppp ntb ganjar pranowo partai logo sahabatganjar ganjarpranowo ganjar menangkanganjar generasigotongroyong,senang
