quoted_text,emosi
dinihrdianti seruanhl tolakpelanggarham tolakpolitikidentita generasi z presiden humor dengar erti harap ganjarpranowo,senang
ganjarpranowo antusia warga lombok sambut datang ganjar pranow,senang
ahi puji sosok puan sbg politis hebat tulu gimmick bikin adem suasana puanmaharani ahi pdip demokrat aniesbaswedan tweetvir check out video tiktok,senang
ganjar pranowo sosok peneru jokowi ganjarcapres ganjarpranowo2024 ganjarpresiden,senang
ganjarpranowo mari dukung ganjar pranowo jdi presiden ri,senang
ganjar pranowo pimpin yg oke bgt sih beliau mumpuni prestasi lanjut bangun mantap pakdementorganja,senang
nugrohodjati76 doktertifa iya klo yg jd pleciden nya ani baswedan lahhh klo yg jd presiden nya ganjar pranowo yaaa nyanyi dgn lirik nya yg sumbang nyinyir,marah
ganjar pranowo milik rekam jejak prestasi orang terus juang jokowi pakdementorganja,senang
alhamdulillah ganjar pranowo emang keren bgt ga ragu deh lanjut bangun jadi baik pakdementorganja,senang
bobalvr ganjar pranowo milik rekam jejak prestasi orang terus juang jokowi pakdementorganja,senang
repyoureba alhamdulillah ganjar pranowo emang keren bgt ga ragu deh lanjut bangun jadi baik pakdementorganja,senang
kuahbasso ganjar pranowo pimpin yg oke bgt sih beliau mumpuni prestasi lanjut bangun mantap pakdementorganja,senang
kuahbasso ganjar pranowo emang keren ga ragu deh lanjut bangun jadi baik pakdementorganja,senang
kuahbasso ganjar pranowo emang keren bgt gausah ragu deh lanjut bangun jadi baik pakdementorganja,senang
ganjarpranowo optimi ganjar pranowo presiden r,senang
ganjar pranowo dialog gen z milleni bal ganjarberikankemajuan ganjarpilihanterbaik ganjarpranowo ganjarfor2024 pemiluserentak2024 pemilu2024 likeforlik trend follom,senang
ganjarpranowo mari kawal ganjar pranowo,senang
ganjar pranowo paktelur,marah
maju ganjar bukti dekat ganjar pranowo gen z ganjarcapres onad tita malm squidgame2 seventeen morninggg moonbyul innalillahi iphon 14 salmasalsabil onic indonesiaopen2023 ronaldo rafael leao,senang
mantap alumnus unpad sepakat dukung ganjar pranowo ganjarberikankemajuan ganjarpilihanterbaik ganjarpranowo ganjarfor2024 pemiluserentak2024 pemilu2024 likeforlik trend follom,senang
90 anak bandung dukung ganjar pranowo ganjarberikankemajuan ganjarpilihanterbaik ganjarpranowo ganjarfor2024 pemiluserentak2024 pemilu2024 likeforlik trend follom,senang
anak muda bandung dukung ganjar pranowo ganjarberikankemajuan ganjarpilihanterbaik ganjarpranowo ganjarfor2024 pemiluserentak2024 pemilu2024 likeforlik trend follom,senang
ganjar pranowo semangat muda indonesia ganjarcapres,senang
ribu masyarakat ntb antusia sambut hadir capres ganjar pranowo ganjarberikankemajuan ganjarpilihanterbaik ganjarpranowo ganjarfor2024 pemiluserentak2024 pemilu2024 likeforlik trend follom,senang
balenciagka ganjarpranowo indonesia butuh pimpin milik jejak pimpin bagu ganjar pranowo mari satu dukung beliau pimpin negara arah,senang
kosongsatumet ganjarpranowo ganjaranapp indonesia butuh pimpin milik jejak pimpin bagu ganjar pranowo mari satu dukung beliau pimpin negara arah,senang
warga ntb dukung ganjar pranowo ganjarberikankemajuan ganjarpilihanterbaik ganjarpranowo ganjarfor2024 pemiluserentak2024 pemilu2024 likeforlik trend follom,senang
balenciagka ganjarpranowo ganjar pranowo bukti pimpin hasil positif beliau pimpin indonesia lanjut bangun,senang
kosongsatumet ganjarpranowo ganjaranapp jejak pimpin bagu ganjar pranowo alas sempat pimpin indonesia,senang
bal totalita menang ganjar pranowo presiden ganjarcapres,senang
balenciagka ganjarpranowo jejak pimpin bagu ganjar pranowo bukti sosok layak pimpin indonesia,senang
repyoureba panutan ganjar pranowo beliau matang lanjut tuga perintah jokowi indonesia depan pakdementorganja,senang
ganjar pranowo peneru jokowi maju indonesia ganjarcapres,senang
bobalvr awal nol buang harga butuh pimpin ganjar pranowo milik alam hasil lanjut bangun pakdementorganja,senang
kosongsatumet ganjarpranowo ganjaranapp jejak pimpin bagu ganjar pranowo bukti sosok layak pimpin indonesia,senang
repyoureba ganjar pranowo paham banget nggak lanjut bangun jadi baik pakdementorganja,senang
balenciagka ganjarpranowo ganjar pranowo milik jejak pimpin bagu pimpin indonesia,senang
kosongsatumet ganjarpranowo ganjaranapp ganjar pranowo milik jejak pimpin bagu pimpin indonesia,senang
repyoureba ubah lanjut ganjar pranowo sosok terus juang pakdementorganja,senang
kuahbasso kerja ganjar pranowo oke lanjut juang jokowi pakdementorganja,senang
mabar maju ganjar bukti dekat ganjar pranowo gen z ganjarcapres ganjarmenangtot ganjarpranowo2024 ganjarpranowo sahabatganjar relawanganjar,senang
rapat baris ganjar pranowo sambut riah warga ntb rawan ntb ganjarcapres ganjarmenangtot ganjarpranowo2024 ganjarpranowo sahabatganjar relawanganjar,senang
repyoureba ganjar pranowo sosok cocok lanjut tongkat estafet pakdementorganja,senang
kuahbasso ganjar pranowo paham banget nggak lanjut bangun jadi baik pakdementorganja,senang
anak muda bandung dukung ganjar pranowo capres 2024 ganjarcapres ganjarmenangtot ganjarpranowo2024 ganjarpranowo sahabatganjar relawanganjar,senang
ribu masyarakat ntb antusia sambut hadir capres ganjar pranowo ganjarcapres ganjarmenangtot ganjarpranowo2024 ganjarpranowo sahabatganjar relawanganjar,senang
kosongsatumet ganjarpranowo ganjaranapp kagum sembah ganjar pranowo kepala daerah ubah signifikan hidup orang bukti nyata kehebatanni,senang
bobalvr tuju pandang jokowi butuh pimpin bangun sinergi bawa maju ganjar pranowo sosok cocok lanjut tongkat estafet pakdementorganja,senang
repyoureba pimpin lanjut kerja aset harga ganjar pranowo bukti pimpin lanjut kontribusi nyata pakdementorganja,senang
anak muda bandung dukung penuh ganjar pranowo ganjarcapres bruno mar lisa tvri iphon 14 gint kingthelandep1 jungkooki yeonjun namjoon gantung plossa,senang
kosongsatumet ganjarpranowo ganjaranapp sungguh hasil ganjar pranowo kepala daerah ubah hidup orang,terkejut
kuahbasso awal nol buang harga butuh pimpin ganjar pranowo milik alam hasil lanjut bangun pakdementorganja,senang
alumnus unpad nyata dukung ganjar pranowo presiden ganjarcapres,senang
suasana semangat limut kader sambut datang ganjar pranowo gedung dpd pdip ntb sahabatganjar,senang
ganjarsatukanrikuat ganjar pranowo pimpin peduli didik,senang
kosongsatumet ganjarpranowo ganjaranapp ganjar pranowo kepala daerah ubah hidup orang,terkejut
alumnus unpad dukung ganjar pranowo presiden ganjarcapres,senang
ganjar pranowo terima tepuk tangan riah masyarakat ntb onad malm iphon 14 pdiperjuangan,senang
anak muda bandung dukung ganjar pranowo presiden ganjarcapres,senang
menteri bumn erickthohir nilai sosok damping calon presiden pdi juang ganjarpranowo unggul erick thohir dunia ekonomi bisni lengkap ganjar pranowo birokrat politis tulen ganjarerickduetterbaik,terkejut
repyoureba kerja ganjar pranowo oke lanjut juang jokowi pakdementorganja,senang
halo sahabat ribu rawan sahabat ganjar masyarakat nusa tenggara barat sambut datang ganjar pranowo penuh antusiasm lombok intern airport ganjarpranowo sahabatganjar generasigotongroyong menangkanganjar ganjar,senang
rawat jiwa nusantara,terkejut
keren indonesia butuh pimpin ganjar pranowo ganjarcapres,senang
mantap potensi parpol dlm dukung penuh capres pdip ganjarpranowo milu keren,senang
bal kandang banteng amp 95 utk ganjarpranowo yg mustahil,marah
ria gembira gen z generasi mileni lontar sambut datang ganjarpranowo kebon vintag car cafe interaksi hangat riah mileni ganjaranapp ganjarforpresiden2024 ganjarpresiden2024,senang
waaah mantep nih ganjar lombok damping tgb gpdipulauseribumasjid,senang
ganjar pranowo sosok pimpin adab ganjarpranowo ganjarcapres,senang
wooooooowwww peopl poweeerrr ganjar pranowo semangat merah putih lombok,terkejut
fyi aja nih gae ditot ya 81 pasar jateng revitalisasi bangun ganjar pranowo hebat ya ganjarcapres ganjar ganjarpresiden2024 pdip pasukanganjarbali milu capreses2024 bal politik,marah
uyokback jangan2 program ganjar pranowo nih ga sopan kemenakertran kagok edan,takut
bobalvr keren yaa ken ikut selfi bareng ganjar pranowo sosok pimpin idola gua bpk jokowi gpdipulauseribumasji,senang
kakekhal ganjar pranowo menang total,senang
bal keren sekian ide kreatif inovatif atas lingkung ekonomi digit salut ganjarcapres ganjar pranowo tvri sd inpr iphon 14 ronaldo zoro inkigayo gantung plossa minggu,terkejut
yodisss wihhh ramee nihhh sampek rebut sambut ganjar pranowo semangat gpdipulauseribumasji,senang
bobalvr yaaa pendukungnyaaa semangat ganjar gpdipulauseribumasji,senang
bobalvr salah partai dukung ganjar pranowo dpw partai perindo ntb jamu datang capres gpdipulauseribumasji,marah
bobalvr kesini masyarakat yg dukung ganjar pranowo gpdipulauseribumasji,marah
nih temu orang keren banget nih dua semangat ganjar pranowo gpdipulauseribumasji,senang
ganjar pranowo sosok santun amp ramah,senang
ganjar pranowo calon presiden,senang
ganjar pranowo sosok pimpin ayom kalang,senang
ganjar pranowo sosok pimpin adab,senang
ganjarpranowo ganjar pranowo presiden peneru kerja presiden jokowi rampung indonesia maju sejahtera,senang
bal lombok ganjar pranowo sapa rakyat,senang
ganjar pranowo capres idam rakyat rakyat,senang
rstmbcl ganjarpranowo ganjar pranowo keren,senang
indonesia butuh pimpin hebat ganjar pranowo ganjarmenangtot,senang
ganjar pranowo abai aspirasi capresesganjar,marah
ganjar pranowo sosok pimpin adap ganjarcapres,terkejut
ganjar pranowo kaum meleni gen z ganjarcapres,senang
gaet mileni generasi z ganjar pranowo cawapresnya figur muda,senang
pilih ganjar pranowo,senang
cinta ganjar sambut riah semeton bal ganjar pranowo ganjarcapres,senang
ganjar pranowo suka masyarakat indonesia,senang
ganjar pranowo mantap,senang
ganjar pranowo the best,senang
ganjar pranowo semangat muda,senang
ganjar pranowo berani cerda,senang
ganjar pranowo ayom,senang
ganjar pranowo maju bangsa indonesia,senang
geloraco aniesbaswedan tipu lembaga survey,senang
tdk mudah goyah dgn iming2 apa dukung ganjar pranowo jg kritis krn sbg dukung bkn diam kritik yg dukung kritik yg dukung depan dp,terkejut
sikap tdk harga spr skr dukung ganjar pranowo jd capres krn sikap tdk mundur sedikit hr tunggu arah dlm politik etika sikap yg konsist,marah
ganjarpranowo mari sama2 gapai mimpi indonesia yg kuat berdikari 2045 ganjar pranow,senang
ganjarpranowo raja ngelucu ganjar pranowo,senang
tolakpelanggarham tolakpolitikidentita generasi z presiden humor dengar erti harap ganjar pranowo,marah
dukung ganjar pranowo,senang
ganjar pranowo pimpin,senang
kode alam tanda zaman presiden ri 8 mobil fatmawati isteri karno presiden ri 1 megawati soekarno putri presiden ri 5 kemarin tumpang ganjar pranowo calon presiden ri 8,terkejut
joko widodo mentor baik ganjar pranowo jokowi pimpin hati caci hina fitnah dera buat tumbang patah arang maju nkri salam merdeka nkrihargamati,senang
ambil positif aja milu riang gembira ganjar pranowo prabowo,senang
adu masyarakat lapor gub bukti direspon cepat langsung ditindaklanjuti gubernur jawa ganjar pranowo lapor adu masyarakat masuk lapor gub,senang
cengar cengir,jijik
