quoted_text,emosi
ganjar pranowo ajak warga ntb berita hoax majubersamaganjarbangunri ganjarpranowo,netral
orang provinsi ntb syukur pilih ganjar pranowo pilpr 2024,senang
ganjar pranowo kader ntb bunuh politik identita kuat jelang laksana pilpr milu 2024 majubersamaganjarbangunri,marah
ganjar pranowo dukung penuh masyarakat ntb ganjarcapres bruno mar lisa tvri iphon 14 gint kingthelandep1 jungkooki yeonjun namjoon gantung plossa,netral
suasana penuh bangga patut apresiasi peran ganjar pranowo maju indonesia bersamaganjar ganjaruntukindonesia ganjarpresiden2024 ganjarpranowo,netral
ganjar pranowo layak pimpin indonesia ganjarcapres ganjarpranowo,senang
ganjar pranowo ajak peran laku kerjasama budaya jawa bal majubersamaganjarbangunri,senang
bukti dukung lombok dukung penuh ganjar pranowo presiden 2024 ganjarcapres ganjarpranowo,netral
warga ntb menang ganjar pranowo presiden 2024 ganjarcapres ganjarpranowo,senang
antusia masyarakat ntb hadir ganjar pranowo ganjarcapres ganjarpranowo,senang
pesan ganjar pranowo masyarakat ntb ganjarcapres ganjarpranowo,netral
ganjar pranowo ajak warga ntb berita hoax majubersamaganjarbangunri,netral
ganjar pranowo dengar paham harap gen z ganjarcapres bruno mar lisa tvri iphon 14 gint kingthelandep1 jungkooki yeonjun namjoon gantung plossa,senang
yaq de jok mbe nike ketemu ganjar catat ne batur ganjarcapres bruno mar lisa tvri iphon 14 gint kingthelandep1 jungkooki yeonjun namjoon gantung plossapak ganjar pranowo dukung penuh masyarakat ntb,senang
hadir ganjar pranowo kantor dpp pdi juang ntb sambut antusia ribu dukung majubersamaganjarbangunri,senang
siticeriaselalu ganjarpranowo teman rawan dukung ganjar pranowo databas infografi prestasi bantu tambah amunisi temen temen perang udara silah d sebar anggota rawan terima kasih,senang
ganjar pranowo posisi elektabilita persen kitasemuabersatu neruskepakdh,netral
prabowo salip ganjar pranowo survei milik kitasemuabersatu neruskepakdh,netral
ganjar pranowo nilai ponp darunnahdlatain hasil didik formal perempuan majubersamaganjarbangunri ganjarpranowo,netral
ganjar pranowo sosok pimpin komitmen kuat maju indonesia visi kerja keras upaya wujud ubah dampak positif masyarakat bersamaganjar ganjaruntukindonesia ganjarpresiden2024 ganjarpranowo,netral
sambut riah ganjarpranowo masyarakat ntb menang ganjar pranowo pilpr 2024 ntb,senang
gubernur jawa ganjar pranowo harap hadir aplikasi kurang anggur buka provinsi jateng majubersamaganjarbangunri,senang
masyarakat lapis mana dukung ganjar pranowo presiden ri ganjarpranowo ganjarcapres ganjaruntuksemua ganjarpresiden,senang
program salah upaya gubernur jawa ganjar pranowo fasilita cari kerja hubung usaha majubersamaganjarbangunri,netral
kst jatim kuat dukung warga ganjar presiden rawan dukung ganjar pranowo gabung kst jatim bantu renovasi masjid desa jangkar politikpemerintahan bangkal jatim surabaya via beritajatimcom,senang
gubernur jawa ganjar pranowo progr tangan miskin ekstrem jawa jalan bagu majubersamaganjarbangunri,senang
gubernur jawa ganjar pranowo kerjasama usaha intervensi anggur wilayah jateng majubersamaganjarbangunri,senang
manfaat program bazna gubernur jawa ganjar pranowo bantu bedah rumah lansia kabupaten magelang majubersamaganjarbangunri,netral
emang ganjar pranowo idola gaspol 2024 timnasday vietnam love gisel bpj nabilataqiyyah pagiii onad aang apel pagi morninggg ganjarmenangtot,senang
emg ahi cari panggung utk naik elektabilita habi puan b jd ketemu ganjar pranowo,marah
gubernur jawa ganjar pranowo target turun stunt daerah 14 2023 majubersamaganjarbangunri,netral
bangun inklusif ala ganjar gubernur jawa ganjar pranowo bangun tdk bangun bentuk fisik ttpi jg bangun aspek layan msyrkt adil sosial bangun sumber daya manusia ganjaeuntukindonesiamaju,marah
puluh ribu masyarakat bal kompak nyanyi lagu ganjar pranowo ganjarpranowo onad wendi jenni pagiii morninggg nabilataqiyyah aespaatseenfestiv sore timnasday ganjarmenangtot,senang
gubernur jawa ganjar pranowo bantu keluarga kabupaten magelang milik rumah layak sehat majubersamaganjarbangunri,netral
ganjar pranowo sang jaga nkri timnasday vietnam love gisel bpj nabilataqiyyah pagiii onad aang apel pagi morninggg ganjarmenangtot,senang
unggul gubernur jawa ganjar pranowo mantan gubernur dki jakarta ani baswedan semuadukungprabowo neruskepakdh,senang
alumnus unpad dukung ganjar pranowo ganjarcapres,senang
rapat baris ganjar pranowo timnasday vietnam love gisel bpj nabilataqiyyah pagiii onad aang apel pagi morninggg ganjarmenangtot,senang
ganjar pranowo gubernur jawa catat prestasi gemilang infrastruktur baik didik tingkat sektor tani daya umkm kewirausahaan dorong dll bersamaganjar ganjaruntukindonesia ganjarpresiden2024 ganjarpranowo,netral
dukung ganjar pranowo presiden timnasday vietnam love gisel bpj nabilataqiyyah pagiii onad aang apel pagi morninggg ganjarmenangtot,senang
ganjar pranowo bantu lansia magelang rumah layak sehat majubersamaganjarbangunri,senang
alumnus universita padjadjaran jawa barat dukung ganjar pranowo ganjarcapres,senang
puan maharani ketua partai demokrat agu harimurti yudhoyono salah calon bacawapr ganjar pranowo,netral
jokowi ganjarpranowo indonesia maju ganjar pranow,senang
alumnus unpad nyata dukung ganjar pranowo ganjarcapres,senang
terang benderang joko widodo presiden ri 7 presiden ri 8 yg 11 12 dengan ya ma ganjar pranowo yg 100 siaaap lanjut k e r j a k e r a s karya2 ma jokowi,senang
hidayatnatari presiden indonesia 2024 ganjar pranowo,senang
ganjarpranowo indonesia maju ganjar pranow,senang
ntb sambut ganjar pranowo antusia,senang
lombok ganjarpranowo sambut warga hangat riah ntb lombok ganjaranapp ganjarforpresiden2024 ganjarpresiden2024 presiden2024 pemilu2024 ganjarcapres pilpres2024 ganjarpranowo2024,senang
program gubernur ajar jalan gubernur jawa ganjar pranowo ganjar tekan peran institusi didik cegah sebar radikalism rawan susup usia sekolah,netral
ganjarpranowo mantap ganjar indonesia butuh pimpin ganjar pranow,senang
ganjar pranowo ribu kader pdip nusa tenggara barat ntb kait potensi politik identita kuat pilpr 2024 majubersamaganjarbangunri giveaway challeng senin pagiii bruno mar treatment gg onic onad,netral
ganjar pranowo kantor dpd pdip ntb datang calon presiden bacapres sambut ribu dukung seni gamelan majubersamaganjarbangunri giveaway challeng senin pagiii bruno mar treatment gg onic onad,netral
dilamb sekolah virtual gagas ganjarpranowo hasil lulus 68 siswa,netral
didki lawan ani ahok hukum 212 kadrun dki demo lawan ani pribumi ganjar benci fitnah asumsi sesat dukung bodoh pro ani,marah
ganjar pranowo ajak warga ntb satu ganjarcapres,senang
gunung rinjani sirkuit mandalika ntb ganjar pranowo unjung majubersamaganjarbangunri,netral
ganjar pranowo dorong gen z rawat kembang seni budaya bangsa indonesia majubersamaganjarbangunri giveaway challeng senin pagiii bruno mar treatment gg onic onad,netral
ketua dpd pdip ntb rachmat hidayat sebut orang provinsi syukur pilih ganjar pranowo pilpr 2024,senang
ganjar pranowo presiden 2024 majubersamaganjarbangunri,senang
ganjar pranowo ajak gen z mileni tentu arah politik majubersamaganjarbangunri,senang
kesittt ganjar pranowo presiden peneru kerja presiden jokowi rampung indonesia maju sejahtera nkri harga mati ani minat,senang
ganjar pranowo ingat jajar hindar kkn terima gratifikasi ganjar tindak oknum bukti ancam pecat oknum libat kkn terima gratifikasi ganjaruntuksemua lanjutkanbersamaganjar,takut
ganjar pranowo ajak warga ntb berita hoax majubersamaganjarbangunri,takut
ganjar pranowo sambut ribu dukung lombok rebut selamat salam ganjarcapres,senang
ganjar pranowo ajak pdi juang ntb lawan politik identita majubersamaganjarbangunri,netral
ganjar pranowo sapa ribu sukarelawan ntb majubersamaganjarbangunri,netral
ganjar pranowo sambut ribu dukung rebut foto majubersamaganjarbangunri,senang
jokowi percaya ganjar pranowo indonesia bangun negara maju sejahtera bersamaganjar ganjaruntukindonesia ganjarpresiden2024 ganjarpranowo,senang
rapat baris ganjar pranowo sambut riah warga rawan ntb,senang
ganjar pranowo ntb ingat kader lawan politik identita majubersamaganjarbangunri,netral
ganjar pranowo hasil bawa provinsi jawa oleh harga tim kendali inflasi baik kali majubersamaganjarbangunri,senang
ganjar pranowo ntb damping tgb majubersamaganjarbangunri,netral
tinggal si milik rambut putih ganjar pranowo langgan buzzer kampany kotor duit ya dipak sen buzzer duit rakyat partai rakyat jateng warga miskin ganjarpranowo,marah
ganjar pranowo damping tgb ntb majubersamaganjarbangunri,netral
warga ntb hormat ganjar pranowo semat pin majubersamaganjarbangunri,netral
dengar program gubernur ajar program diinisasi ganjar pranowo gubernur jawa jd program program peduli ganjar didik langsung yg program ajar dr antikorupsi anti radikalism,senang
gubernur jawa ganjar pranowo aplikasi sihati patok harga produk komunita majubersamaganjarbangunri,senang
tokoh rakyat dukung rakya,senang
ganjar tumpang mobil presiden ri 1 5 ratu ayu indigo ramal tanda tanda menang ganjar pranowo,senang
asliindonesia11 ganjar pilih capres 2024 ganjarpranow,senang
moga kode alam payung ganjar pranowo sbg presiden republik indonesia 8 aamiin,senang
mutiaraskin69 ganjar pranowo capres baik ganjarcapres,senang
mutiaraskin69 ganjar pilih capres 2024 ganjarpranow,senang
agung baskoro jokowi nyaman dukung prabowo subianto ketimbang ganjar pranowo semuadukungprabowo neruskepakdh,jijik
capres pdi juang ganjar pranowo dialog tokoh muda bal salah satu putri lingkung hidup 2020 putu ayu saraswati,netral
ganjar pranowo cocok mileni gen z ganjarcapres ganjarpranowo,netral
ribu masyarakat ntb antusia sambut hadir capres ganjar pranowo ganjarcapres,senang
ganjarpranowo selamat juang calon presiden ganjar pranow,senang
hasil ganjar pranowo pimpin jawa modal bangun indonesia depan ganjarcapres,senang
dekat sahabat ganjar masyarakat jalin ramah kabupaten banyuwangi sosialisasi ganjar pranowo keren ciamik mboi iki lur,senang
ganjar pranowo cinta masyarakat ntb ganjarcapres,senang
jennycantika18 ganjar pranowo bangun indonesia depan ganjarcapres,senang
teri presiden ganjar pranowo gema ntt,senang
ganjar pranowo kolaborasi gen z ganjarcapres,senang
basi dukung jokowi monopoli ganjar pranowo semuadukungprabowo neruskepakdh,marah
nilai prabowo sulit jadi bacawapr ganjar pranowo semuadukungprabowo neruskepakdh,marah
dukung ganjar pranowo cabut semuadukungprabowo neruskepakdh,marah
kode presiden jokowi gamblang tunggu telunjuk jokowi smua yg utara jokowi ganjar pranowo klu yg capresesnya ganjar diendors jokowi suruh mutihin rambut,marah
baik ganjar pranowo ganjarpranowo ganjarcapres ganjarpresiden ganjarpilihanrakyat,senang
warga ntb dukung ganjar pranowo ganjarcapres,senang
ganjar pranowo next presiden ganjarcapres,senang
dukung jokowi ganjar pranowo ganjarpranowo ganjarcapres ganjarpresiden ganjarpilihanrakyat,senang
cilik dukung ganjar maju capres ganjarcapres ganjarkita ganjaruntukindonesi,netral
ganjar pranowo sosok lanjut program presiden jokowi ganjarcapres,senang
ganjar pranowo gen z rawat kembang seni budaya majubersamaganjarbangunri,netral
asliindonesia11 cilik dukung ganjar maju capres ganjarcapres ganjarkita ganjaruntukindonesi,senang
al ustadz muhammad zainul imam salat ganjarpranowo rombong ziarah makam pahlawan,senang
istri ganjar pranowo siti atiqoh supriyanti nilai perempuan indonesia orang tangguh onad gu muhaimin modric axelsen pontianak rodri one piec al nassr,netral
ganjar pranowo dialog ratus gen z bal acara maju ganjar kebon vintag car bal timnasday wendi modric one piec pagiii bpj ruben neve,senang
pole pilih ri 1 like ganjar pranowo retweet ani baswedan,senang
nongkrong diskusi bareng ganjar pranowo kan program lapak ganjar,senang
istri ganjar pranowo siti atiqoh supriyanti nilai perempuan indonesia orang tangguh wendi gantung plossa bpj one piec bruno mar pagiii timnasday,senang
ganjar pranowo hati ganjar pranowo presiden ri 2024 ganjarpranowo ganjar generasigotongroyong menangkanganjar,senang
iwanf mk ambang bata usia cawapr 35 kabul gibran cawapr prabowo ganjar pranowo dinasti politik kkn juang demokrasi dikadalin rezim tipu tipu muslihat curang,marah
mabar bal ganjarpranowo highlight kolaborasi z partisipasi perintah diskusi santai calon presiden pdip ganjar pranowo generasi z muda bal acara mabar maju ganjar tema kaum,senang
dpw sahabat ganjar jatim ada senandung sholawat doa raih menang ganjar pranowo pilpr wendi gantung plossa pagiii morninggg bpj onad,senang
acara temu budaya utk indonesia raya sambut koster ajak bupati n wali kota pulau bal menang capres pdip ganjar pranowo absen bupati walikota cc aniespresidenrakyatwara aniespresidenrakyatwara,netral
mutiaraskin69 ganjar pranowo bangun indonesia depan ganjarcapres,senang
mari selesai meja makan selesai meja makan menu istimewa santap bareng istimewa istimewa selamat makan lur,jijik
ganjar pranowo nilai ponpr darunnahdlatin hasil didik formal perempuan majubersamaganjarbangunri,senang
safari politik bal ntb ganjar pranowo merespon masuk radar bacawapr dai sandiaga unu ahi tgb via,senang
ganjar pranowo dialog ratus gen z bal acara maju ganjar kebon vintag car bal onad one piec pontianak axelsen gu muhaimin bruno mar rodri aang,senang
asliindonesia11 pilih ganjar pranowo ganjarcapres,senang
rapat baris ganjar pranowo sambut riah warga rawan ntb ganjarcapres,netral
aniespresidenrakyatwara judul acara temu budaya indonesia raya sambut koster ajak bupati n wali kota pulau bal menang capres pdip ganjar pranowo absen bupati walikota cc,netral
ganjar pranowo bangun indonesia depan ganjarcapres,senang
bukti dekat ganjar pranowo gen z ganjarcapres,senang
ganjar pranowo ajar arti nyali sesunggungnya langsung sang mentor jokowi wajah ekspresi suara intonasi ganjar sadar amp berani yg penting bangsa,terkejut
bal totalita menang ganjar pranowo ganjarcapres,senang
ganjarpranowo kalung selendang tenun kha lombok tanda tamu hormat bacapres pdip ganjar pranowo hadir konsolidasi menang pilpr 2024 kota lombok nusa tenggara barat ntb minggu 18 juni,netral
alvaro16273300 fakta data begitun baik nyata era ganjar pranow,marah
anak muda bandung dukung ganjar pranowo ganjarcapres,senang
ganjar pranowo ingat kader pdip ntb politik identita kuat majubersamaganjarbangunri,netral
alumnus unpad jawa barat dukung ganjar pranowo ganjarcapres,senang
kunker politik ganjar pranowo ntt,netral
ganjar pranowo utk indonesia ganjarcapres,netral
ganjar pranowo sambut merah lombok ntb radarjabar disway news nasion berita beritaterkini ganjarpranowo pdip ntb lomboktimu,senang
ganjar pranowo dukung industri kreatif anak mileni gen z maju bangsa ganjarcapres,senang
ganjar pranowo ganjarcapres,netral
alumnus unpad dukung ganjar pranowo,senang
maju ganjar pranowo capres 2024,senang
ganjar pranowo temu kalang gen z mileni bal,terkejut
dukung ganjar pranowo capres 2024 ganjarcapres,senang
amat politik nilai nyata adi khawatir jokowi loyal dukung ganjar pranowo infoterkini info beritahariin,senang
ruhutsitompul ganjar pranowo ri1 gibran rakabum yan eth 2224 arb p kalo,senang
bursa buka cawapr ganjar pranowo,netral
ppp usul sandiaga uno cawapr ganjar pranowo pilpr 2024 sesuai hasil rapimna vi newsupd updat news text,netral
upaya sempat didik lua rata ganjar pranowo pimpin peduli generasi muda ambil langkah berani tambah kuota ppdb putus tuju,senang
mabar maju ganjar bukti dekat ganjar pranowo gen z ganjarcapres,senang
ganjar pranowo capres baik ganjarcapres,senang
ganjar pranowo capres pilih rakyat indonesia ganjarcapres,senang
ganjar pranowo dialog gen z mileni bal ganjarcapres,senang
ganjar apresiasi temu komunikasi politik puanmaharani ahi malangpost,netral
dukung warga ntb ganjar pranowo ganjarcapres,senang
mantap masyarakat ntb menang ganjar pranowo ganjar presiden 2024 ganjarcapres,senang
ribu masyarakat ntb sambut ganjar pranowo ganjar presiden 2024 ganjarcapres,senang
rstmbcl ganjarpranowo teman rawan dukung ganjar pranowo databas infografi prestasi bantu tambah amunisi temen temen perang udara silah d sebar anggota rawan terima kasih,netral
antusia masyarakat nusa tenggara barat sambut datang capres ganjar pranowo ganjar merah ntb rakyat ntb percaya ganjar terus jokowi ganjarpenerusjokowi ganjarmenangtot ntb nusatenggarabarat ganjaruntukindonesiamaju,senang
sama2 muda sama2 wawas lua sama2 tulu sama2 smart beliau dua ganjar pranowo amp erickthohir pasang lengkap tunggu ganjarerickduetterbaik true,senang
kamek warg kalbar pileh prestasiny ganjar pranowo,senang
cume ganjar pranowo layak pileh mileni kalbar bukti prestasiny,netral
kamek mileni kalbar mayorita mendukong ganjar pranowo,senang
mimpi kejar siti atikoh sang suami ganjar pranowo,takut
anak mude kalbar semangat untok pileh menang ganjar pranowo,senang
rapat baris ganjar pranowo warga bal ntb,senang
pakai kao warna hijau gubernur ntb zulkieflimansyah temu ganjar pranowo kota mataram temponasion,senang
alumnus universita padjajaran jawa barat dukung ganjar pranowo ganjarcapres,senang
karakt pimpin ganjar pranowo luw rakyat nyaman beliau sekat pimpin rakyat gaya pimpin tenang rakyat coba hadap bangsa ganjaruntuksemua lanjutkanbersamaganjar,netral
banjir masyarakat rawan ntb hadir ganjar pranowo bukti dukung,senang
dukung ani baswedan tingkat krn rakyat indonesia ubah arah yg dukung ganjar pranowo gugur,senang
mantap plt tum partai ppp muhamad mardiono instruksi wajib sosialisasi tuju menang presiden ri bpk ganjarpranowo yg sdh tetap capres mardiono buka rapimna ppp,senang
momen ganjar pranowo temu soekarno ganjarpranowo ganjarmenangtot ganjarcapres ganjarmajurimakmur ganjarberikesejahteraan ganjarmenang,netral
dukung alir dera ganjar pranowo,senang
temu ahi puan nama ahi muncul salah bacawapr ganjar pranowo,netral
komunita pijar kaum perempuan dukung ganjar pranowo ganjarpranowo ganjarmenangtot ganjarcapres ganjarmajurimakmur ganjarberikesejahteraan ganjarmenang,senang
kalbar dukung ganjar pranowo ri indonesia maju gajarcapres pemilu2024,senang
calon presiden pdip ganjar pranowo olahraga pagi rawan lapang renon denpasar bal blacklist tukeran kiboy wanwan gu muhaimin axelsen erina markhyuck jaya jaya jaya fisika tudum karina kingtheland ganjarpranowo bal ganjarpresiden2024,netral
masyarakat indonesia satu dukung ganjar pranowo capres 2024,senang
ganjar pranowo presiden mileni gen z,senang
kunci entas miskin tingkat sdm masyarakat ganjar pranowo komitmen rang miskin dgn didik grati 2014 smk negeri jateng biaya tanggung pemprov seragam biaya praktek ganjar bangun 3 smkn grati,takut
ganjar pranowo ngeklik mileni gen z,senang
mmargani5 2014 samp 2024 kadrun twittnya model kyak gin utk lampias sakit hati yg peri brlanjut samp 2034 tp sasar ganjar pranowo,marah
ganjar pranowo rakyat pan pdip jawatengah malaysiatiktok malaysia pdip pejuangdevisa prabowosubianto tenagakerjaindonesia sandiagauno erickthohir onad timnasgaruda indonesiavsargentina messi matchday,netral
warg kalbar percaya ganjar pranowo bise lanjut bangun indonesia ganjarcapres ganjarpranowo ganjarhebat ganjarpresiden2024 kalbarpilihganjar,senang
warga bal lari pagi bareng sang idola bal menang ganjar pranowo timnasday jenni one piec bruno mar vietnam love gisel aang,senang
jadwal ganjar pranowo ntb,netral
ganjar pranowo negeri,netral
ganjar pranowo temu tuan guru bajang tgb m zainul majdi ziarah makam pahlawan maulana syaikh lombok nusa tenggara barat ntb ganjarmenangtot,senang
puan maharani propos cawapr ganjar pranowo tempovideo,netral
jawa barat hadir ganjar pranowo,netral
mayorita mileni indonesia dukung ganjar pranowo presiden 2024,senang
rakyat indonesia sabar ganjar pranowo presiden 2024,takut
wajar mileni dukung ganjar ganjar pranowo mileni,senang
hidayatnatari sandiaga uno daulat cawapresnya si ganjar pranowo ppp ahi masuk bursa cawapr si ganjar pranowo ahi pikir,netral
tuan guru dukung ganjar pranowo,senang
udah cocok ganjar pranowo terus estafet presiden jokowi,senang
masyarakat dukung ganjar dpw mpg bal sah bentuk menang ganjar pranowo bal,senang
for ganjar pranowo,senang
ganjar pranowo nyata laksana program gubernur ajar smk negeri 2 wonogiri ganjar sedia ak didik grati program gubernur ajar padu didik vokasi,senang
betapa antusia nya anak muda gen z ganjar pranowo one piec spain senin aang,senang
gubernur jawa jateng ganjar pranowo gulir program gubernur ajar salah unggul program fasilita didik grati ajar,senang
bacapres 2024 ganjar pranowo sambang kebon vintag car bal classic denpasar bal ganjar mobil sejarah milik istri presiden ri ir soekarno fatmawati,netral
alumnus unpad jabar dukung ganjar pranowo ganjarcapres,senang
alumnus ganjar jawa barat dukung penuh ganjar pranowo pimpin pimpin indonesia,senang
ppp sodor nama sandiaga uno cawapr ganjar pranowo maju pilpr 2024,senang
rawan ganjar pranowo dukung ganjarcapres  20 ,senang
thi is bal ribu warga bal antusia dgn datang bacapres ganjar pranowo lapang renon bal ganjar pranowo,senang
bagai sempat jelas jokowi dukung ganjar pranowo rapat kerja nasion pdi juang 6 juni 2023 jokowi yakin ganjar pranowo,senang
tawar arsen rice tolak ganjar pranowo damping tgb,netral
ganjar anggap temu tokoh beda partai komunikasi politik,netral
kode dukung jokowi ganjar pranowo ganjarcapres day beal sun,senang
ganjar pranowo sosok pimpin yg hau kritik lisa timnasday one piec vietnam love gisel onad bruno mar,jijik
lombok menang ganjar pranowo jisoo newjean vietnam love gisel onad aang aang,senang
indonesia butuh calon presiden ganjar pranowo milik sifat humor dengar sesuai harap masyarakat,senang
dukung ganjar mantap ganjarcapres,senang
sahabat ganjar dukung ganjarcapres,senang
ganjar pranowo wejang santriwati pesantren darunnahdkatain nwdi raih radarjabar disway news nasion berita beritaterkini safaripolitik ganjarpranow,netral
hallo gae nih simak ya poin kembang dunia didik ala ganjar pranowo tiru utk daerah ganjarpranowo,senang
asliindonesia11 capres pilih ganjarcapres,senang
poin ala ganjar pranowo maju dunia didik jawa ak baik dapat guru inovasi teknolog,senang
mutiaraskin69 rawan ganjar pranowo dukung ganjarcapres,senang
terobos ganjar pranowo tuk maju didik jawa sekolah asrama grati gubernur ajar pendidkkan antikorupsi kam inklusif hinhha tingkat kualita didik vokasi sejahtera guru honor,senang
ganjar pranowo kuota ppdb 7920 ppdb jawa wujud komitmen ganjar pranowo perata ak didik jawa tanggulang miskin melslui jalur priorita didik,senang
edyjanto007 firzahusaininc tetep pilih capres baik ganjar pranow,senang
dukung ganjar pranowo capres 2024 ganjarcapres,senang
alumnus unpad nyata dukung ganjar pranowo,senang
pilih ganjar pranowo ganjarcapres,senang
larismi11 indonesia maju pimpin presiden jokowi lanjut ganjar pranowo presiden,senang
ntb dukung ganjar pranowo ganjarcapres,senang
maju bareng ganjar pranowo ganjarcapres,senang
gae netizen geruduk akun instagram ganjar pranowo indonesia batal tuan rumah pildun,marah
3 nama kandidat capres muncul pilpr kali pranowo subianto tambur,netral
ganjar tumpang mobil presiden ri 1 5 ratu ayu indigo ramal tanda tanda menang ganjar pranowo,netral
ganjar pranowo sosok pimpin sederhana peduli rakyat indonesia butuh sosok pimpin ganjar pranowo ganjar pranowo layak presiden,netral
alumnus universita dukung ganjar pranowo ganjarforpresiden2024,senang
tolakpelanggarham tolakpolitikidentita generasi z presiden humor dengar erti harap ganjar pranowo,takut
dennysiregar7 cemana ni bang,marah
rapat baris ganjar pranowo viral semangat keren,senang
siti atiqoh ingin jalan backpack suami ganjar pranowo celebritiesdotid infocelebterkini,netral
kpop pa ganjar pranowo idola anak muda keren nih sob yuk tonton ganjaruntuksemua lanjutkanbersamaganjar,senang
husinshihab ganjar pranowo heli nikah adik menag tel emisi,netral
warga ntb dukung ganjar pranowo ganjarcapres ganjarpilihanterbaik ganjarbawakemajuan ganjarpresiden2024 ganjarpresiden,senang
ntb dukung ganjar pranowo ganjarcapres ganjarpilihanterbaik ganjarbawakemajuan ganjarpresiden2024 ganjarpresiden,senang
ganjar mantap alumnus unpad nyata dukung ganjar presiden 2024 ganjarcapres ganjarpranowo viral fyp skecher vietnam love gisel one piec axelsen uefa nation leagu gu muhaimin hello futur newsingleforsalma,senang
tuan guru haji hazmi hamzar doa ganjar tetes air mata air mata tuan guru haji tgh hazmi hamzar net doa ganjar pranowo presiden 2024 ganjar silaturahmi kantor dpw ppp ntb minggu suara getar,sedih
berani nyali wajah garang intonasi bicara wajah tenang pikir jernih ambil putus indonesia ganjar pranowo nilai milik kriteria pakdementorganjar,terkejut
target 95 persen 92,netral
habib syarif razi habaib habib ahmad alaydru habib husein muhdor al muhdar sama lantun doa salawat ganjarpranowo ri 1 2024 yg gabung dlm saga sahabat ganjar allahumma shollu alaih,sedih
ganjar pranowo presiden mileni gen z ganjarcapres,netral
rapat baris ganjar pranowo ganjarcapres,netral
ganjarpranowo ganjar pranowo presiden 202,senang
pagi ribu warga bal sambut ganjar pranowo lapang renon bal,senang
pencapresesan 2024 2 lolo yapitu ganjar pranowo prabowo subianto yg penuh sarat 2 kandidat yg tarung wawas bangsa lanjut bangun yg indonesia,senang
hadir ganjar langsung sambut antusia warga bal gubernur bal i wayan koster kena baju merah lambang pdip sambut datang ganjar pranowo,senang
90 dukung ganjar pranowo ganjarcapres,senang
ganjar pranowo dialog gen z mileni bal,netral
ganjar lanjut bumi ajar sabar pimpin sabar muncul trust percaya ganjar pranowo,senang
semangat merah bara masyarakat lombok menang ganjar pranowo blacklist tukeran kiboy wanwan gu muhaimin axelsen erina markhyuck jaya jaya jaya fisika tudum karina kingtheland ganjarpranowo ganjarmenangtot lombok ganjaruntuksemua capreses2024,senang
