quoted_text,emosi
ribu simpatisan sahabat ganjar mengaw datang ganjar pranowo kabupaten lombok timur minggu masyarakat lengkap atribut dukung pasti lewat momen temu sang calon presiden sambut,senang
ganjar dukung alih ganjar pranowo bukti ganjar pimpin indonesia,senang
calon presiden ri ganjar pranowo tekan kader penguru pdi juang ntb hasil baik presiden joko widodo masyarakat ntb sindonew news,senang
ganjar pranowo pilih rakyat indonesia blacklist pontianak axelsen kiboy honda erina tukeran wanwan besok senin choi seungcheol aang kairi worst concert gu muhaimin gg onic yoshi,marah
narasi kecuali jegal ani ulang ulang cm biar exi dimedso sdh alami buntu tau yg tampil sosok ani baswedan yg elektabilitasnya terjun beba ganjar pranowo menang 1 putar,terkejut
ganjar pranowo langsung tinjau baik sekolah komitmen blacklist bruno mar kairi erina kiboy worst concert pontianak tukeran axelsen choi seungcheol wanwan aang honda markhyuck jaya jaya jaya besok senin gg onic,senang
alfatih212426 yg tau kalo ganjar pranowo d dukung tukang sebar berita hoax jhonnisinaga2,marah
ratus kader pdip lombok amp masyarakat riuh sambut capres ganjar pranowo bandara lombok jokowi moga ganjar kelak menang lanjut cepat bangun ntb yg canang presiden jokowi,senang
sandiaga uno nilai cawapr jiwa muda tuga aspirasi generasi muda juang selara visi calon presiden besut pdi juang ganjar pranowo,senang
setyaki22965702 ganjarpranowo bpk ganjar pranowo lanjut mantap,senang
ganjar pranowo lombok internasion airport nusa tenggara barat datang calon presiden rambut putih langsung serbu ratus warga rawan sahabat ganjar sahabatganjar,senang
pimpin ganjar pranowo moga lanjut estafet pakdementorganjar,senang
capres pdi juang ganjar pranowo sebut partai ppp partai istimewa sikap politik partai lambang kakbah tentu helat politik nasion menangkanganjar generasigotongroyong sahabatganjar ganjarpranowo ganjar,netral
ballambinlov yulham rekam jejak ganjar pranowo 2 period jateng,marah
kmer212 bbrp dedengkot diri bara jp yg dukung ganjar pranowo,marah
rapimna vi ppp putus sandiaga ketua bapilu cawapr damping ganjar pranowo panglima tempur ppp simak lengkap pidato sandiaga uno panglimatempurppp,netral
ganjar pranowo temu rawan ziarah makam pahlawan ntb tempofoto,netral
rela rumah ajar guru honor motor ganjar aulia rizkia rahmawati guru honor sdn 1 karangwad camat tawang grobogan hadiah motor gubernur jawa ganjar pranowo hadiah aulia,senang
mari dukung ganjar pranowo pilpr 2024 ganjarcapres,senang
mantap ganjar pranowo dukung alumnus unpad ganjarcapres,senang
menteri bumn erick thohir konsisten posisi teras sanding prabowo subianto 4ni baswedan ato ganjar pranowo ganjarerickduetterbaik,netral
respon cepat adu aplikasi laporgub ganjar pranowo langsung tinjau baik sekolah komitmen gg onic erina axelsen besok senin tukeran honda pontianak blacklist aang tolol bruno mar kiboy ducati al hilal gu muhaimin yoshi,senang
mas ntb temu ganjarpranowo datang ganjar pranowo sambut sorak sorai nusa tenggara barat rawan sahabat ganjar warga semangat menangkanganjar generasigotongroyong sahabatganjar,senang
buka erickthohir damping ganjar pranowo kontestasi demokrasi berkat negosiasi pan pdip ganjarerickduetterbaik,senang
erick thohir pimpin oleh hasil survei lembaga survei erick thohir cawapr favorit ganjar pranowo oleh dukung kalah mahfud md ahi ridwan kamil ganjarerickduetterbaik,senang
erick thohir gaet suara jawa duet ganjar pranowo nilai potensi menteri bumn erickthohir pasang potensi kuat pilpr duet duet isi ganjarerickduetterbaik,senang
calon presiden pdi juang pdip ganjar pranowo sempat dialog temu kalang santri safari lombok nusa tenggara barat minggu sindonew news,netral
calon presiden capres ganjar pranowo dukung indonesia capres kontestasi pilpr 2024 sindonew news,senang
video jokowi bilang sila maki sila hina suka harap tahu henti utk bangun negeri sosok bilang plonga plongo kuru kere ceke motivasi idola ganjar pranowo,marah
si kutu loncat calon calon wakil ganjarpranowo doa moga gak wujud,jijik
bacapres ganjar pranowo sopir ketua hari nasion partai perindo tuan guru bajang tgb m zainul majdi kota mataram sindonew news,netral
suasana haru ganjar pranowo kunjung kantor dpw ppp ntb minggu doa ganjar air mata tuan guru haji tgh hazmi hamzar net sindonew news,sedih
calon presiden bacapres pdi juang pdip ganjar pranowo aku kagum pondok pesantren darunnahdlatain nwdi pancor lombok timur nusa tenggara barat ntb sindonew news,terkejut
kuat negara ganjar pranowo percaya rakyat kpd pimpin ganjar sabar tampung inspirasi aspirasi ekspresi masyarakat sukses ganjar buah sabar ganjaruntukindonesiamaju,senang
rawan santri dukung ganjar ajak santri doa latih ekonomi kreatif santri kripik singkong pondok pesantren rhodotul uqul ganjarforpresident2024 santridukungganjar ganjarpilihanrakyat,senang
mudah mudah ntb menang ganjar pranow,senang
kmer212 ganjarpranowo ratus kader indramayu asli kader nasdem danberalih perindo dukung ganjar pranowo,senang
nampaknya satu2nya capres yg dukung alas hasil ganjar pranowo salut utk rawan ganjar pranowo dlm ganjar terobos utk hasil rakyat jawa kenegarawanan hadap resesi globa,senang
ganjar pranowo hadir nikah putri politiku pdip aria bima jakarta okezon beritaterkini berita news beritanasion,netral
ayo satu baris dukung ganjar pranowo for presiden 2024 ganjarbawakemajuan ganjarfor2024 dukungganjar,senang
rapat baris ganjar pranowo ganjarbawakemajuan ganjarfor2024 dukungganjar,senang
calon presiden bacapres pdi juang pdip ganjar pranowo kagum pondok pesantren darunnahdlatain nwdi pancor lombok timur nusa tenggara barat ntb sahabatganjar ganjarpranowo ganjar menangkanganjar generasigotongroyong,terkejut
capres pdi juang ganjar pranowo sebut partai ppp partai istimewa sikap politik partai lambang kakbah tentu helat politik nasion sahabatganjar ganjarpranowo ganjar menangkanganjar generasigotongroyong,senang
calon presiden capres pdip ganjar pranowo aku kagum indah alam lombok nusa tenggara barat ntb salah yg blm wujud lombok daki gunung rinjani sahabatganjar ganjarpranowo ganjar menangkanganjar generasigotongroyong,terkejut
ganjar pranowo pimpin sabar sahabatganjar ganjarpranowo ganjar menangkanganjar generasigotongroyong,senang
komunita crypto indonesia ganjarpranowo milik hold ganjar tunjuk dukung ganjar pranowo presiden indonesia price chart buy from pancak swap,senang
salawat kumandang sambut datang ganjar pranowo kantor dpw ppp ntb,senang
dukung gari kera padeh ganjar pranowo masmen bumn erick suara dua tokoh bangsa calon pimpin baik mengggantikan padeh jokowi lanjut program kerja bangun,senang
ayo brsama dukung ganjar pranowo the next presiden ri ganjarcapres,senang
ganjar pranowo yg ganti jokowi mendkung ganjar sosok pimpin yg cinta rakyat ganjarcapres,senang
alumnus unpad nyata dukung ganjar pranowo dkungan ganjar sbg capres 2024 smakin kuat ganjarcapres,senang
alumnus muda unpad ganjar pranowo sosok pimpin berani komunikatif peduli luw,senang
ganjarpranowo bagu dlm bikin kata2 nya sebagu ganjar pranowo capres pdip yg menang pilpr 2024,netral
pilih rakyat yg asli anak pribumi nusantara yai ganjar pranowo yg peneru jokowidodo yg klopun yg asli pribumi ahli capres ngerecokin aja bodoh goblok,marah
mabar maju ganjar ganjarcapres,senang
mutiaraskin69 hasil ganjar pranowo pimpin jawa modal bangun indonesia depan ganjarcapres,senang
bacapres pdip ganjar pranowo temu puluh ribu gemar ntb,senang
asliindonesia11 hasil ganjar pranowo pimpin jawa modal bangun indonesia depan ganjarcapres,senang
jennycantika18 dukung warga ntb ganjar pranowo ganjarcapres,senang
asliindonesia11 ganjar pranowo next presiden ganjarcapres,senang
mutiaraskin69 pilih ganjar pranowo ganjarcapres,senang
asliindonesia11 ganjar pranowo bangun indonesia depan ganjarcapres,senang
asliindonesia11 ganjar pranowo capres baik ganjarcapres,senang
ribu simpatisan sahabat ganjar mngawal datang ganjar pranowo kabupaten lombok timur minggu masyarakat lengkap atribut dukung pasti tdk lewat momen temu sang capres sahabatganjar ganjarpranowo ganjar menangkanganjar,senang
jennycantika18 hasil ganjar pranowo pimpin jawa modal bangun indonesia depan ganjarcapres,senang
jennycantika18 pilih ganjar pranowo ganjarcapres,senang
jennycantika18 ganjar pranowo capres baik ganjarcapres,senang
gen z mileni bal diskus ganjar pranowo,netral
ucap adlh doa amp ucap yg hr negara sbesar indonesia hr dpimpin org yg mncintai agam org yg rawat kebhinekaan krn indonesia trdiri dri brbagai suku agama amp adat istiadat bkn dpimpin sm org yg robek tenun kbangsaan,takut
moga orang ntb pilih ganjar pranowo petuga partai pdip jokowi,senang
alumnus universita padjadjaran dukung ganjar pranowo,senang
gen z mileni ganjar pranowo capres 2024 ganjarcapres,senang
ganjar pranowo ketar tir,takut
ganjar pranowo presiden 2024 pilih rakyat ganjarcapres,senang
ganjar pranowo presiden ganjarcapres,senang
lapang nasion lombok timur nusa tenggara barat ntb merah sambut hadir calon presiden capres ganjar pranowo minggu sore sindonew news,senang
warga rawan ganjar pranowo ntb rapat baris dukung ganjar pranowo presiden 2024 ganjarcapres,senang
ganjartanggungjawab ganjarpranowo tanggung bunuh jawa ganjar presiden boneka ganjarcapreses2024 ganjarmenang,marah
bacapres ganjar pranowo pdip tingkat dpd dpc rant anak rant gerak upaya menang aspek kecil mengaw suara tingkat tp milu 2024 ganjarforal ganjarpranowo menangkanganjar generasigotongroyong,senang
tolakpelanggarham tolakpolitikidentita generasi z presiden humor dengar erti harap ganjar pranowo,senang
ganjar bawa berkah bal totalita menagkan ganjar pranowo,senang
amat nilai unggul menteri bumn erick thohir ekonomi bisni lengkap ganjar pranowo politis tulen erickthohir ganjarerickduetterbaik,senang
ganjar pranowo tekan silaturahmi kunjung ntb ganjarcapres,netral
warga rawan ntb rapat baris sambut ganjar pranowo ganjarcapres,senang
ganjar pranowo dgn pilih ganjar hapu kenang pahit bangsa dgn pilih ganjar menghapu sedih keluarga korban jahat jahat ham berat pilih bicara layak,sedih
ganjar pranowo pilih,senang
asliindonesia11 mabar maju ganjar ganjarcapres,senang
utj jokowi ani baswedan ganjar pranowo ketua dpp pdip megawati soekarnoputri ketua,netral
calon presiden ganjar pranowo ketua hari nasion perindo tuan guru bajang tgb m zainul majdi menjaj arif lokal tarung rotan kerap peresean tandang lombok ntb sindonew news,netral
jennycantika18 ganjar pranowo next presiden ganjarcapres,senang
anak muda bandung 90 dukung ganjar pranowo ganjarcapres,senang
jokowi baik ganjar pranowo pilih baik udah gitu aja si,senang
ribu warga serbu ganjar bal bule kejar selfi ganjar pranowo magnet warga bal kunjung pulau dewata sabtu mana ganjar rebut warga salam foto,senang
mutiaraskin69 mabar maju ganjar ganjarcapres,senang
rekam jejak kali pilih dpr kali pilih gubernur jawa alam ganjar pranowo,senang
rinaldelapanen2 hancur akhlak umat minum itu akhlaq mu hancur total juriyah nabi sanggup qm fitnah kau tau ganjar pranowo banyak istighfar bos,marah
partai satu bangun ppp rekomendasi sandiaga salahudin uno calon wakil presiden simak video lengkap flashon cariberitaditvon ppp sandiagauno ganjarapranowo cawapres2024,netral
tau mar ganjar ganjar pranowo lirik lagu lirik si rambut putih mari joget serasi gera ayo sama suara ma ganjar indonesia bulat tekad satu suara pilih si rambut putih,senang
suka ajar woooowoooo cah lanang deh besok le tambah capres ganjar pranowo iki bos qu rakyat rakyat amp rakyat ganjar peneru jokowi ganjarpranowo semarang,senang
ganjar pranowo temu rawan lombok timur,netral
ganjar pranowo doa presiden,senang
ganjarpranowo peneru jokowi cocok ganjar pranowo kandidat capres yg pa indonesia ganjaruntuksemua lanjutkanbersamaganjar,senang
masyarakat ntb dukung ganjar pranowo presiden ri,senang
tutor cari prestasi gubernur jawa ganjarpranowo mudah klik ketik prestasi ganjar pranowo medium mainstream muncul tolong link ya khawatir tersepona,senang
ganjar pranowo next ramal dennysiregar7 turut pimpin aura kuat gak tolak kera apa orang singkir,senang
idola ku renyah baur masyarakat ket video ganjar pranowo henti ajar main gamelan pemuda iring serta jalan santai bal pagi,netral
dukung ganjar pranowo presiden ri 2024 makganjarofc makganjar makganjarntt makganjaruntukpakganjar ganjarpresiden2024 ganjarforpresident2024,senang
gdanjar pranowo lanjut aktivitas ari bal lombok terbang pesawat komersil aja gak beneran sambut warga lombok rebut salam selfi bareng,marah
rapat baris ganjar pranowo sambut riah warga rawan ntb ganjar sosok pimpin,senang
turut kandidat capres gadang maju pilpr 2024 ganjar pranowo ani baswedan putra baik bangsa tuga partai politik maju calon presiden,senang
nama tgb uno mahfud erickthohir agu masuk daftar bursa cawapr utk ganjarpranowo klw gw sih dukung pasang ganjarpranowo amp erickthohir klw uno sih cocok wowo aj lg agu abud aja ribut,netral
lapang nasion ntb merah sambut ganjar pranowo,netral
kakekhal cara promosi ku jamin ganjar pranowo presiden r,jijik
ganjarpranowo kawal ganjar pranowo presiden,senang
ntb dah rapat baris okezonenew,netral
gerindra hormat putus ppp usul sandiaga uno cawapr ganjar pranowo,netral
mutiaraskin69 dukung warga ntb ganjar pranowo ganjarcapres,senang
ribu masyarakat ntb antusia sambut hadir capres ganjar pranowo,senang
ganjarpranowo satu kuat ganjar pranowo,senang
gas menang ganjar pranowo,senang
ganjar pranowo percaya indonesia ema 2045 capai,netral
elektabilita ganjar pranowo pengaruh faktor magnet politik ganjar kuat jokowi jelang pilpr 2014 2019,netral
simulasi 3 capres kompa ganjar 40 persen kalah prabowo ani survei nasion litbang kompa simulasi nama capres catat elektabilita gubernur jawa ganjar pranowo unggul banding ketua gerindra prabowo subianto mantan,senang
jennycantika18 mabar maju ganjar ganjarcapres,senang
cintada16 goyah pilih ganjar pranow,takut
peluang tgb ahi cawapr ganjar pranowo ganjar pranowo capres 2024 pdip bicara peluang tgb ahi cawapresnya simak dapat reaksi ganjar beritabaik indonesiapositif jurnalismepositif,netral
hasil prabowo subianto unggul provinsi ganjar pranowo dominan provinsi ani baswedan pimpin provinsi provinsi saing prabowo ganjar ketat sulit simpul unggul,netral
yunartowijaya ganjar pranowo yg dukung tukang survei bayar kolega partai warga jateng hasil tukang survei bayar unggul,netral
thet4ntrys1 ganjarpranowo mantap ganjar pranowo peneru jokowi,senang
ganjar pranowo kemeja gar sambang kantor perindo ntb sahabatganjar ganjarpranowo ganjar menangkanganjar generasigotongroyong,netral
kelompok rawan sahabat ganjar daya masyarakat kenal ganjar pranowo okezon beritaterkini,netral
warga bal allout dukung ganjar pranowo presiden ganjarcapres,senang
giat medium sosial dukung ganjar pranowo pinang erick thohir cawapr bagi pasang ganjarpranowo pilpr klop dgn ganjar tambah nilai plu figur,senang
ganjar pranowo aku ken tgb hubung akrab gubernur benang merah komunikasi inten sindonew news,netral
lengkap usaha ulung unggul bidang ekonomi bisni erick thohir lengkap ganjar pranowo politis erickthohir ganjarerickduetterbaik,netral
anak muda bandung dukung penuh ganjar pranowo,senang
politis pdip sosok cawapr ganjar pranowo,netral
capres ganjar pranowo dialog kalang santri kunjung ponp darunnahdlatain nwdi lombok nusa tenggara barat ntb minggu sindonew news,netral
capres ganjar pranowo ziarah makam pahlawan nasion syekh muhammad zainuddin abdul majid pancor camat selong kabupaten lombok timur ntb minggu sindonew news,sedih
membenc maki lawan politik turut kandidat capres gadang maju pilpr 2024 ganjar pranowo ani baswedan putra baik bangsa tuga partai politik maju calon presiden,marah
asliindonesia11 dukung warga ntb ganjar pranowo ganjarcapres,senang
capres idam rakyat indonesia ganjar pranowo ajak warga ntb satu dukung ganjar,senang
yanharahap kemarin abang ngetweet hutang udah gunung muji muji koalisi ganjar pranowo,marah
mileni ntb kerah massa dukung ganjar pranowo calon presiden harap generasi muda indonesia menangtot 2024menangtot jenni gint bruno mar erina axelsen puan onic nabilataqiyyah lisa besok senin tvri aang yoshi lombok arin,marah
ganjar pranowo indonesia ema 2045 capai ganjarcapreses2024 ganjarpranowo ganjarcapres,senang
hadir ganjar pranowo sambut antusia masyarakat lombok riuh ria ganjar calon presiden menangtot 2024menangtot jenni gint bruno mar erina axelsen puan onic nabilataqiyyah lisa besok senin tvri aang yoshi lombok arin,marah
ganjar pranowo dialog gen z mileni bal ganjarcapreses2024 ganjarpranowo ganjarcapres,senang
ntb dukung ganjar pranowo ganjarcapreses2024 ganjarpranowo ganjarcapres,senang
ganjarpranowo bravo ganjar pranowo,senang
mesin partai konstituen partai gerindra solid dukung capres usung partai urai elektabilita ganjar pranowo pengaruh faktor,netral
dprd jateng ingat kera ganjar pranowo pangeran tiktok ganjar sibuk nyapr amp bikin konten tauu rabu siang pegang beig tele sugeng erina aduk peopl power istora islam jakarta selamat 10 rezim petuga partai video,senang
ganjar pranowo menang total,senang
rawa cocok ahi rapat pdip harap cawapresnya ganjar ani rapat gerindra cawapresnya tarung ganjar ahi v prabowo,netral
agenda temu ahi puan maharani gbk senayan baha cawapr ganjar pranowo,netral
petuga kewalahan mengaw datang ganjar pranowo banyak simpatisan antar ganjar mataram prediksi simpatisan kader pdip bandara lombok sambut datang ganjar capai 500 orang,terkejut
propinsi bal metal merah total dukung ganjar pranowo bal bludak,terkejut
bawaslu ri lapor kpai duga libat anak deklarasi rawan bacapres ganjar pranowo,netral
cutiekriesha che20palma ganjarpranowo roflgptbot ganjar pranowo a presid might a well turn indonesia into a dang dang empir,takut
rawan sahabat ganjar gelar acara senandung selawat amp doa raih menang utk ganjar pranowo amp indonesia 2024 ponp sirojul anwar jember jatim acara tsb hadir habib ahmad alaydru amp habib husein muhdor al muhdar santri amp masyarakat,senang
ganjar pranowo pengaruh faktor magnet politik ganjar kuat jokowi jelang pilpr 2014 komponen masyarakat komunita dukung ganjar banding jokowi sambung,netral
provinsi ganjar pranowo dominan provinsi ani baswedan pimpin provinsi provinsi saing prabowo ganjar ketat sulit simpul unggul temu lsn kecenderunga,netral
ganjar pranowo dialog gen z mileni bal,senang
ribu masyarakat ntb antusia sambut ganjar pranowo ganjarcapres,senang
amat politik emru sihomb hasil manajer erickthohir transformasi bumn nilai guna tempat posisi strategi wakil presiden lengkap ganjar ganjarerickduetterbaik,netral
ganjar pranowo pimpin lanjut kontribusi nyata kerja bagu pakdementorganjar,netral
lepa pribadi ganjar pranowo cinta agam mudah terima mana bal,senang
ganjar pranowo temu tgb ntb perindo wajar bangun chemistri temponasion,netral
maki lawan politik turut kandidat capres gadang maju pilpr 2024 ganjar pranowo ani baswedan putra baik bangsa tuga partai politik maju calon presiden,netral
hubung hotlin san follow medso tahura mangkunagoro informasi lengkat tahuramangkunagoro karanganyar jateng,netral
tgb hadap ribu santri,netral
ketua gp lukman nurhakim sosialisasi program gp mileni gen z susun program menang ganjar pranowo lingkung keluarga bear alumnus masyarakat dekat,netral
suasana semangat limut kader sambut datang ganjar pranowo gedung dpd pdip ntb hadir kemeja nuansa hitam ganjar sapa kader lanjut jalan pasuk gedung sahabatganjar ganjarpranowo ganjar menangkanganjar,senang
bonu demograsi generasi muda mileni gen z perhati capres ganjar pranowo peneru bangsa,senang
usung ppp cawapr ganjar pranowo sandiaga uno innalillahi wainnailaihirojiun tuga berat,sedih
lekmarteg ganjarpranowo karakt ganjar pranowo 1 nyali 2 persuasif 3 sekat,terkejut
pdip kompak megawati apit prananda ganjar pranowo hadir konsolidasi pdip gelar konsolidasi intern partai agenda bahas kuat menang ganjarpranowo pranowo pilpr 2024,terkejut
gen z dukung ganjar pranowo ganjarcapres,senang
ganjarpranowo ketemu dgn tgp lgsg ramai duet ganjar tgp sih gak presiden 2024 2034 ganjar,senang
politik turut kandidat capres gadang maju pilpr 2024 ganjar pranowo ani baswedan putra baik bangsa tuga partai politik maju calon presiden,netral
ganjar pranowo dukung industri kreatif anak mileni gen z maju bangsa indonesia butuh sosok pimpin ganjar pranowo,senang
gubernur bal wayan koster bupati wali kota dukung ganjar pranowo beda partai,senang
inget rawan jokowi yg ganjar pranowo tuli presiden bidden sdh buka seluruh dunia ngapsin ngirim2 jamp mama iya kukuh nm org udah laporin,netral
ziarah makam tuan guru kh zainuddin abdul madjid ganjar pranowo gpdipulauseribumasjid ronaldo tita tvri coldplay onad mandalika nami zoro germangp onad,sedih
tarik minat anak muda ma ganjar pranowo dekat diskusi membaha sejarah indonesia anak muda paham ada kontributor ambil putus bijak,netral
simpatisan ganjar pranowo sasar pacu roda ekonomi masyarakat olah rumput laut produk kerupuk stik okezon,netral
partai satu bangun ppp gercep rapat pimpin nasion rapimna struktur partai kampanye ganjarpranowo sbg capres yg usung kerja cerda utk menang ganjar pranowo,netral
dukung gw ud ganjar mentor yg bukti hasil pimpin indonesia klo yg kaleng2 pantesan aja gercep vision nya ganjar pranowo jokowi,senang
tegsun780 tempodotco aniesbaswedan beliau presiden biarin yg bilang jawa suku nusantara dukung trah jawa presiden sukarno suharto jokowi ganjar jawa jawa dimana2 jawa flexibel luw layan top ganjar pranowo,netral
antusia masyarakat ntb dukung ganjar pranowo presiden 2024 ganjarcapres ganjarpranowo,senang
rawan ntb dukung ganjar pranowo presiden 2024 dukung ganjar pranowo presiden 2024 ganjarcapres ganjarpranowo,senang
ganjar dukung generasi gen z mileni bal ganjar pranowo presiden 2024 dukung ganjar pilpr 2024 ganjarpranowo ganjarpranowofor2024 ganjarcapres,senang
muchnasikhin sutanmangara beliau presiden biarin yg bilang jawa suku nusantara dukung trah jawa presiden sukarno suharto jokowi ganjar jawa jawa dimana2 jawa flexibel luw layan top ganjar pranowo,senang
sutanmangara beliau presiden biarin yg bilang jawa suku nusantara dukung trah jawa presiden sukarno suharto jokowi ganjar jawa jawa dimana2 jawa flexibel luw layan top ganjar pranowo,senang
ganjarpranowo beliau presiden biarin yg bilang jawa suku nusantara dukung trah jawa presiden sukarno suharto jokowi ganjar jawa jawa dimana2 jawa flexibel luw layan top ganjar pranowo,senang
tempodotco beliau presiden biarin yg bilang jawa suku nusantara dukung trah jawa presiden sukarno suharto jokowi ganjar jawa jawa dimana2 jawa flexibel luw layan top ganjar pranowo,senang
menteri bumn erick thohir sosok cawapr pdip ganjar pranowo pilpr 2024 unggul erick thohir dunia ekonomi bisni lengkap ganjar pranowo birokrat politis tulen erickthohir ganjarerickduetterbaik,netral
sambut riah ganjar pranowo masyarakat rawan ntb indonesia tang ganjar pranowo ganjar pranowo layak presiden,senang
ganjar pranowo presiden 2024 dukung ganjar pilpr 2024 ganjarpranowo ganjarpranowofor2024 ganjarcapres,senang
dukung ganjar pranowo presiden 2024 ganjarcapres ganjarpranowo,senang
dukung ganjar pranowo presiden 2024 ganjarcapres ganjarpranowo,senang
ganjarpranowo satu menang ganjar pranowo,senang
dpw sahabat ganjar jatim ada senandung sholawat doa raih menang ganjar pranowo pilpr ronaldo onad tvri gint gu muhaimin sd inpr aang bruno mar thoma doll,netral
tokoh agama politik masyarakat sambut jago pdip pilpr 2024 ganjar pranowo unjung nusa tenggara barat ntb minggu salah satu gubernur ntb zulkieflimansyah sindonew news,netral
ganjar pranowo erick thohir nilai cocok pasang capres cawapr pilpr 2024 erickthohir ganjarerickduetterbaik,netral
mantap pa ganjar pranowo ganjaruntuksemua lanjutkanbersamaganjar,senang
ganjar pranowo joget bumbung ganjarsatukanrikuat ganjarsatukanrikuat,jijik
air mata tuan guru haji hazmi hamzar net doa ganjar pranowo presiden 2024 acara silaturahmi kantor dpw ppp ntb,sedih
fransiskusjurin prabowo the best for ri moga pilih presiden republik indonesia elektabilita prabowo kubu ganjar panik2nya elektabilita ganjar pranowo lorot,senang
momen ganjar pranowo sambut tgb lombok singgung sahabat jalin lombok insid ganjar thb ani ahi puan prabowo,senang
ganjar pranowo tumpang mobil sejarah ganjarsatukanrikuat ganjarsatukanrikuat,netral
prabowo the best for ri moga pilih presiden republik indonesia elektabilita prabowo kubu ganjar panik2nya elektabilita ganjar pranowo lorot,jijik
ken sosok siti atikoh istri ganjar pranowo publik penasaran tarik dibaha fdl inew ganjar sitiatikoh ganjarpranowo pilpr pilpres2024 pemilu2024,netral
besti ganjar target oleh suara ganjar pranowo 75 persen kab malang jawa timur,senang
bobalvr ganjar pranowo udah ga ragu pokok beliau maju tinggal lanjut bangun jadi baik pakdementorganja,netral
workshop sarana sosialisasi ganjar pranowo warga kabupaten banyuwangi,netral
bobalvr ganjar pranowo sosok pimpin oke mumpuni prestasi lanjut bangun jadi baik pakdementorganja,senang
bobalvr ganjar pranowo emang udah oke sih sosok pekimpin pokok ga lanjut aja bangun jadi baik pakdementorganja,senang
kompastv ahi masuk radar pdi juang sepenuh megawati pilih cocok bacapres ganjar pranowo,senang
bobalvr ganjar pranowo emang nggak ragu aksi nyata nya lanjut bangun jadi baik pakdementorganja,senang
gubernur jawa ganjar pranowo hadir ingat lahir pancasila kabupaten grobogan acara jalan sehat even gelar purwodadi hadir puluh ribu masyarakat ronaldo axelsen onad innalilahi,netral
bobalvr ganjar pranowo pimpin oke bener mumpuni prestasi lanjut bangun jadi baik pakdementorganja,senang
gelora bhinneka tunggal ika ganjar pranowo rangkul masyarakat ntb mengkaw sejahtera masyarakat pdiperjuangan 50tahunpdip bangunlahjiwadanbadannya solidbergerak menangkanganjar,terkejut
bobalvr ganjar pranowo sosok pimpin oke mumpuni tinggal lanjut bangun jadi baik pakdementorganja,senang
