quoted_text,emosi
nilai prabowo sulit jadi bacawapr ganjar pranowo semuadukungprabowo neruskepakdh,marah
dukung ganjar pranowo cabut semuadukungprabowo neruskepakdh,marah
kode presiden jokowi gamblang tunggu telunjuk jokowi smua yg utara jokowi ganjar pranowo klu yg capresesnya ganjar diendors jokowi suruh mutihin rambut,marah
baik ganjar pranowo ganjarpranowo ganjarcapres ganjarpresiden ganjarpilihanrakyat,senang
warga ntb dukung ganjar pranowo ganjarcapres,senang
ganjar pranowo next presiden ganjarcapres,senang
dukung jokowi ganjar pranowo ganjarpranowo ganjarcapres ganjarpresiden ganjarpilihanrakyat,senang
ganjar pranowo sosok lanjut program presiden jokowi ganjarcapres,senang
asliindonesia11 cilik dukung ganjar maju capres ganjarcapres ganjarkita ganjaruntukindonesi,senang
al ustadz muhammad zainul imam salat ganjarpranowo rombong ziarah makam pahlawan,senang
ganjar pranowo dialog ratus gen z bal acara maju ganjar kebon vintag car bal timnasday wendi modric one piec pagiii bpj ruben neve,senang
pole pilih ri 1 like ganjar pranowo retweet ani baswedan,senang
nongkrong diskusi bareng ganjar pranowo kan program lapak ganjar,senang
istri ganjar pranowo siti atiqoh supriyanti nilai perempuan indonesia orang tangguh wendi gantung plossa bpj one piec bruno mar pagiii timnasday,senang
ganjar pranowo hati ganjar pranowo presiden ri 2024 ganjarpranowo ganjar generasigotongroyong menangkanganjar,senang
iwanf mk ambang bata usia cawapr 35 kabul gibran cawapr prabowo ganjar pranowo dinasti politik kkn juang demokrasi dikadalin rezim tipu tipu muslihat curang,marah
mabar bal ganjarpranowo highlight kolaborasi z partisipasi perintah diskusi santai calon presiden pdip ganjar pranowo generasi z muda bal acara mabar maju ganjar tema kaum,senang
dpw sahabat ganjar jatim ada senandung sholawat doa raih menang ganjar pranowo pilpr wendi gantung plossa pagiii morninggg bpj onad,senang
mutiaraskin69 ganjar pranowo bangun indonesia depan ganjarcapres,senang
mari selesai meja makan selesai meja makan menu istimewa santap bareng istimewa istimewa selamat makan lur,jijik
ganjar pranowo nilai ponpr darunnahdlatin hasil didik formal perempuan majubersamaganjarbangunri,senang
safari politik bal ntb ganjar pranowo merespon masuk radar bacawapr dai sandiaga unu ahi tgb via,senang
ganjar pranowo dialog ratus gen z bal acara maju ganjar kebon vintag car bal onad one piec pontianak axelsen gu muhaimin bruno mar rodri aang,senang
asliindonesia11 pilih ganjar pranowo ganjarcapres,senang
ganjar pranowo bangun indonesia depan ganjarcapres,senang
bukti dekat ganjar pranowo gen z ganjarcapres,senang
ganjar pranowo ajar arti nyali sesunggungnya langsung sang mentor jokowi wajah ekspresi suara intonasi ganjar sadar amp berani yg penting bangsa,terkejut
bal totalita menang ganjar pranowo ganjarcapres,senang
alvaro16273300 fakta data begitun baik nyata era ganjar pranow,marah
anak muda bandung dukung ganjar pranowo ganjarcapres,senang
alumnus unpad jawa barat dukung ganjar pranowo ganjarcapres,senang
ganjar pranowo sambut merah lombok ntb radarjabar disway news nasion berita beritaterkini ganjarpranowo pdip ntb lomboktimu,senang
ganjar pranowo dukung industri kreatif anak mileni gen z maju bangsa ganjarcapres,senang
alumnus unpad dukung ganjar pranowo,senang
maju ganjar pranowo capres 2024,senang
ganjar pranowo temu kalang gen z mileni bal,terkejut
dukung ganjar pranowo capres 2024 ganjarcapres,senang
amat politik nilai nyata adi khawatir jokowi loyal dukung ganjar pranowo infoterkini info beritahariin,senang
ruhutsitompul ganjar pranowo ri1 gibran rakabum yan eth 2224 arb p kalo,senang
upaya sempat didik lua rata ganjar pranowo pimpin peduli generasi muda ambil langkah berani tambah kuota ppdb putus tuju,senang
mabar maju ganjar bukti dekat ganjar pranowo gen z ganjarcapres,senang
ganjar pranowo capres baik ganjarcapres,senang
ganjar pranowo capres pilih rakyat indonesia ganjarcapres,senang
ganjar pranowo dialog gen z mileni bal ganjarcapres,senang
dukung warga ntb ganjar pranowo ganjarcapres,senang
mantap masyarakat ntb menang ganjar pranowo ganjar presiden 2024 ganjarcapres,senang
ribu masyarakat ntb sambut ganjar pranowo ganjar presiden 2024 ganjarcapres,senang
antusia masyarakat nusa tenggara barat sambut datang capres ganjar pranowo ganjar merah ntb rakyat ntb percaya ganjar terus jokowi ganjarpenerusjokowi ganjarmenangtot ntb nusatenggarabarat ganjaruntukindonesiamaju,senang
sama2 muda sama2 wawas lua sama2 tulu sama2 smart beliau dua ganjar pranowo amp erickthohir pasang lengkap tunggu ganjarerickduetterbaik true,senang
kamek warg kalbar pileh prestasiny ganjar pranowo,senang
kamek mileni kalbar mayorita mendukong ganjar pranowo,senang
mimpi kejar siti atikoh sang suami ganjar pranowo,takut
anak mude kalbar semangat untok pileh menang ganjar pranowo,senang
rapat baris ganjar pranowo warga bal ntb,senang
pakai kao warna hijau gubernur ntb zulkieflimansyah temu ganjar pranowo kota mataram temponasion,senang
alumnus universita padjajaran jawa barat dukung ganjar pranowo ganjarcapres,senang
banjir masyarakat rawan ntb hadir ganjar pranowo bukti dukung,senang
dukung ani baswedan tingkat krn rakyat indonesia ubah arah yg dukung ganjar pranowo gugur,senang
mantap plt tum partai ppp muhamad mardiono instruksi wajib sosialisasi tuju menang presiden ri bpk ganjarpranowo yg sdh tetap capres mardiono buka rapimna ppp,senang
dukung alir dera ganjar pranowo,senang
komunita pijar kaum perempuan dukung ganjar pranowo ganjarpranowo ganjarmenangtot ganjarcapres ganjarmajurimakmur ganjarberikesejahteraan ganjarmenang,senang
kalbar dukung ganjar pranowo ri indonesia maju gajarcapres pemilu2024,senang
masyarakat indonesia satu dukung ganjar pranowo capres 2024,senang
ganjar pranowo presiden mileni gen z,senang
kunci entas miskin tingkat sdm masyarakat ganjar pranowo komitmen rang miskin dgn didik grati 2014 smk negeri jateng biaya tanggung pemprov seragam biaya praktek ganjar bangun 3 smkn grati,takut
ganjar pranowo ngeklik mileni gen z,senang
mmargani5 2014 samp 2024 kadrun twittnya model kyak gin utk lampias sakit hati yg peri brlanjut samp 2034 tp sasar ganjar pranowo,marah
warg kalbar percaya ganjar pranowo bise lanjut bangun indonesia ganjarcapres ganjarpranowo ganjarhebat ganjarpresiden2024 kalbarpilihganjar,senang
warga bal lari pagi bareng sang idola bal menang ganjar pranowo timnasday jenni one piec bruno mar vietnam love gisel aang,senang
ganjar pranowo temu tuan guru bajang tgb m zainul majdi ziarah makam pahlawan maulana syaikh lombok nusa tenggara barat ntb ganjarmenangtot,senang
mayorita mileni indonesia dukung ganjar pranowo presiden 2024,senang
rakyat indonesia sabar ganjar pranowo presiden 2024,takut
wajar mileni dukung ganjar ganjar pranowo mileni,senang
tuan guru dukung ganjar pranowo,senang
udah cocok ganjar pranowo terus estafet presiden jokowi,senang
masyarakat dukung ganjar dpw mpg bal sah bentuk menang ganjar pranowo bal,senang
for ganjar pranowo,senang
ganjar pranowo nyata laksana program gubernur ajar smk negeri 2 wonogiri ganjar sedia ak didik grati program gubernur ajar padu didik vokasi,senang
betapa antusia nya anak muda gen z ganjar pranowo one piec spain senin aang,senang
gubernur jawa jateng ganjar pranowo gulir program gubernur ajar salah unggul program fasilita didik grati ajar,senang
alumnus unpad jabar dukung ganjar pranowo ganjarcapres,senang
alumnus ganjar jawa barat dukung penuh ganjar pranowo pimpin pimpin indonesia,senang
ppp sodor nama sandiaga uno cawapr ganjar pranowo maju pilpr 2024,senang
rawan ganjar pranowo dukung ganjarcapres  20 ,senang
thi is bal ribu warga bal antusia dgn datang bacapres ganjar pranowo lapang renon bal ganjar pranowo,senang
bagai sempat jelas jokowi dukung ganjar pranowo rapat kerja nasion pdi juang 6 juni 2023 jokowi yakin ganjar pranowo,senang
kode dukung jokowi ganjar pranowo ganjarcapres day beal sun,senang
ganjar pranowo sosok pimpin yg hau kritik lisa timnasday one piec vietnam love gisel onad bruno mar,jijik
lombok menang ganjar pranowo jisoo newjean vietnam love gisel onad aang aang,senang
indonesia butuh calon presiden ganjar pranowo milik sifat humor dengar sesuai harap masyarakat,senang
dukung ganjar mantap ganjarcapres,senang
sahabat ganjar dukung ganjarcapres,senang
hallo gae nih simak ya poin kembang dunia didik ala ganjar pranowo tiru utk daerah ganjarpranowo,senang
asliindonesia11 capres pilih ganjarcapres,senang
poin ala ganjar pranowo maju dunia didik jawa ak baik dapat guru inovasi teknolog,senang
mutiaraskin69 rawan ganjar pranowo dukung ganjarcapres,senang
terobos ganjar pranowo tuk maju didik jawa sekolah asrama grati gubernur ajar pendidkkan antikorupsi kam inklusif hinhha tingkat kualita didik vokasi sejahtera guru honor,senang
ganjar pranowo kuota ppdb 7920 ppdb jawa wujud komitmen ganjar pranowo perata ak didik jawa tanggulang miskin melslui jalur priorita didik,senang
edyjanto007 firzahusaininc tetep pilih capres baik ganjar pranow,senang
dukung ganjar pranowo capres 2024 ganjarcapres,senang
alumnus unpad nyata dukung ganjar pranowo,senang
pilih ganjar pranowo ganjarcapres,senang
larismi11 indonesia maju pimpin presiden jokowi lanjut ganjar pranowo presiden,senang
ntb dukung ganjar pranowo ganjarcapres,senang
maju bareng ganjar pranowo ganjarcapres,senang
gae netizen geruduk akun instagram ganjar pranowo indonesia batal tuan rumah pildun,marah
alumnus universita dukung ganjar pranowo ganjarforpresiden2024,senang
tolakpelanggarham tolakpolitikidentita generasi z presiden humor dengar erti harap ganjar pranowo,takut
dennysiregar7 cemana ni bang,marah
rapat baris ganjar pranowo viral semangat keren,senang
kpop pa ganjar pranowo idola anak muda keren nih sob yuk tonton ganjaruntuksemua lanjutkanbersamaganjar,senang
warga ntb dukung ganjar pranowo ganjarcapres ganjarpilihanterbaik ganjarbawakemajuan ganjarpresiden2024 ganjarpresiden,senang
ntb dukung ganjar pranowo ganjarcapres ganjarpilihanterbaik ganjarbawakemajuan ganjarpresiden2024 ganjarpresiden,senang
ganjar mantap alumnus unpad nyata dukung ganjar presiden 2024 ganjarcapres ganjarpranowo viral fyp skecher vietnam love gisel one piec axelsen uefa nation leagu gu muhaimin hello futur newsingleforsalma,senang
tuan guru haji hazmi hamzar doa ganjar tetes air mata air mata tuan guru haji tgh hazmi hamzar net doa ganjar pranowo presiden 2024 ganjar silaturahmi kantor dpw ppp ntb minggu suara getar,sedih
berani nyali wajah garang intonasi bicara wajah tenang pikir jernih ambil putus indonesia ganjar pranowo nilai milik kriteria pakdementorganjar,terkejut
habib syarif razi habaib habib ahmad alaydru habib husein muhdor al muhdar sama lantun doa salawat ganjarpranowo ri 1 2024 yg gabung dlm saga sahabat ganjar allahumma shollu alaih,sedih
ganjarpranowo ganjar pranowo presiden 202,senang
pagi ribu warga bal sambut ganjar pranowo lapang renon bal,senang
pencapresesan 2024 2 lolo yapitu ganjar pranowo prabowo subianto yg penuh sarat 2 kandidat yg tarung wawas bangsa lanjut bangun yg indonesia,senang
hadir ganjar langsung sambut antusia warga bal gubernur bal i wayan koster kena baju merah lambang pdip sambut datang ganjar pranowo,senang
90 dukung ganjar pranowo ganjarcapres,senang
ganjar lanjut bumi ajar sabar pimpin sabar muncul trust percaya ganjar pranowo,senang
semangat merah bara masyarakat lombok menang ganjar pranowo blacklist tukeran kiboy wanwan gu muhaimin axelsen erina markhyuck jaya jaya jaya fisika tudum karina kingtheland ganjarpranowo ganjarmenangtot lombok ganjaruntuksemua capreses2024,senang
insha allah masyarakat ntb mayorita dukung ganjar pranowo blacklist tukeran kiboy wanwan gu muhaimin axelsen erina markhyuck jaya jaya jaya fisika tudum karina kingtheland ganjarpranowo ganjarmenangtot ntb ganjarsatukanrikuat ganjarpilihanterbaik capreses2024,senang
gengsi jaga lingkung,marah
ganjar pranowo pimpin sejahtera rakyat,senang
ganjar serbu ribu warga bal sambut lapang renon bal datang ganjar pranowo hadir acara creativ fun walk lapang lokasi pers kantor gubernur bal wayan koster,senang
ganjar pranowo pimpin idam kalang,senang
ganjar pranowo pimpin idam rakyat indonesia,senang
ribu masyarakat ntb antusia sambut ganjar pranowo,senang
ganjar pranowo presiden ri 2024,senang
warga ntb dukung ganjar pranowo,senang
ayikmz mencarisejati28 aniesbaswedan tyrexmaximu iya ganjar pranowo nonton bokep hobi,marah
moga besok senin berita kejut gu muhaimin gu imin masuk radar cawapr ganjar pranowo lanta lanjut netizen gelar tiket yuk seru nih erina tukeran honda pontianak lombok,takut
ntb dukung ganjar pranowo,senang
ganjar pranowo mobil fatmawati terawang indigo,terkejut
ganjar pranowo dukung industri kreatif anak mileni ganjarcapres ganjarpilihanterbaik ganjarbawakemajuan ganjarpresiden2024 ganjarpresiden,senang
ketua dpd pdip ntb rachmat hidayat provinsi syukur pilih ganjar pranowo pilpr 2024,senang
bal with ganjar pranowo mentari pagi sari lapang renon serta senyum mere ganjarpranowo yg sambut hangat warga ganjar spesial bkan sehat badan tp jg membungahkan hati warga amp yg pandang menangkanganjar,senang
ganjar pranowo taat atur bawaslu aman ya gak langgar atur menangtot 2024menangtot tag jenni demonslay jisoo aang morningg axelsen sore one piec kingthelandep2 bongkarkasusancol lovestori bobbi jeon wonwoo gu muhaimin,marah
ganjar pranowo no aniesbaswedan ye,jijik
ganjar pranowo capres idam rakyat suka kalang,senang
acara temu budaya indonesia raya sambut koster ajak bupati n wali kota pulau bal menang capres pdip ganjar pranowo absen bupati walikota cc aniespresidenrakyatwara aniespresidenrakyatwara,senang
ganjar pranowo ajak kelola bangsa,terkejut
satu rawan satrel ganjarist jakarta selatan dki deklarasi ganjarpranowo bacapres mantap ganjarist optimi ganjar pranowo menang,senang
masyarakat ntb sambut gembira hadir ganjar pranowo bukti ganjar cinta rakyat mana menangtot 2024menangtot tag jenni jisoo onad demonslay one piec kingthelandep2 jeon wonwoo lisa seeyouinmy19thlif theuncannycounter2 axelsen junkyu pledi aang,senang
alumnus unpad nyata dukung ganjar pranowo presiden ri,senang
ganjar pranowo cinta masyarakat ntb ganjarcapres bruno mar lisa tvri iphon 14 gint kingthelandep1 jungkooki yeonjun namjoon gantung plossa,senang
kunjung ntb ganjar pranowo sapa rawan dukung lapang nasion lombok lapang nasion lombok ganjar pranowo rendah hati dengar cerita alam rawan dukung,senang
ganjar pranowo puji sosok tgb kenal dpr gubernur ganjarpranowo,senang
dongeng ganjar pranowo baik gaji honor jawa bijak gaji yg sesuai umk guru yg bantu bijak yg laku ganjar pranowo gaji honor baik kualita didik,marah
mantap dukung ganjar pranowo capres idam rakyat,senang
puluh ribu penguru kader simpatisan pdip temu bacapres pdip ganjar pranowo lapang nasion selong lombok timur konsolidasi akbar rawan ganjar sindonew news,senang
poin tuk kembang dunia didik ala ganjar pranowo ak didik rata penetapam umk guru pegawai honor lingkung didik inovasi teknolog dunia didik,senang
sandiaga uno dekat kalang muda modal pilih ganjar pranowo,jijik
yunartowijaya pimpin inga rasa damai nya bawah pimpin presiden jokowi rusa terang tidaaaaaaak butuh sang peneru kalem ramah congkak jiwa asih ganjar pranow,marah
asyiapp mba,jijik
hobahhhh gaskeun ganjar dukung ganjar santuy hoak fitnah ganjar pranowo hati salam metal,marah
atikoh ganjar pranowo pesan khusu perempuan indonesia perempuan kuat ajar lupa bahagia pesan singkat makna kaum hawa dengar,senang
cnnindonesia terang klo dukung prabowo jd percaya dech sdh 2x kalah pilpr klo kalah u tiga klnya hati jd malumaluin aja mend dukung ganjar pranowo dech yg sdh lanjut kerja jokowi suka kerja jokowi lumayan,jijik
anak bandung dukung ganjar pranowo,senang
dialog perempuan indonesia pilih ganjar pijar rumah aspirasi rawan menteng atiqoh cinta produk negeri tuju utk beranta miskin,senang
kopi malang daerah amstirdam ampelgad sumbermanj tirtoyudo dampit ken dg citra yg kha dunia fokus kopi rawan cangkir kopi nusantara malang selatan menang ganjarpranowo,senang
mediaindonesia ketawa bro jd kasihan lihat org ganjar pranowo prestasi jateng terus kerja jokowi sdh tarik hati org tp loe dgn prestasi dki doang 100 malu lanjut kerja jokowi loe dibenc org,marah
sambut warga ntb ganjar pranowo lepa jokowi effect kali kalah berturut2 tp jokowi bangun ntb tanda terimakasih dukung capres pdip,senang
ganjar pranowo dukung bulli capres myganjar ganjarpranowo ganjar ganjarforpresident2024,senang
salah beda berita dukung pd ganjarpranowo amp abud klw ganjar berita jendral dukung ganjar dukung ganjar klw abud berita teror amp ex hti dukung abud gmn,jijik
hushbear40 netipedia ganjar pranow,marah
dekat ma ganjarpranowo tgb masyarakat lombok harap inspirasi warga ntb pilih presiden peneru jokowi,senang
logistik dalem prabowo ani baswedan sandiaga uno kubu ganjar pranowo udah paham,jijik
dpw sahabat ganjar jatim ada senandung sholawat doa raih menang ganjar pranowo pilpr onad bruno mar axelsen pontianak bt is back gint one piec,senang
anak muda bandung dukung ganjar pranowo presiden ri 2024,senang
dukung ganjar pranowo capres ri 2024 ganjarcapres,senang
ani top pilih ani pimpin berani putra tomo pranowo bicara adil komitmen rakyattolakpemilutertutup rakyattolakpemilutertutup,terkejut
warga ntb dukung ganjar pranowo presiden 2024 ganjarpranowo ganjarcapres ganjarpresiden ganjarmenangtot ganjarpilihanrakyat presiden2024 ganjarpresiden2024 pilpres2024 pemilu2024,senang
ganjar pranowo dukung industri kreatif anak mileni gen z maju bangsa ganjar pimpin indonesia,senang
dukung ganjar pranowo presiden ganjarcapres,senang
alumnus universita padjadjaran dukung ganjar pranowo ganjarcapres,senang
dukung ganjar pranowo presiden 2024 ganjarcapres,senang
dukung ganjarpranowo makkkk wuzzzzz ganjar lampung gabung gelar deklarasi rawan utk menang ganjar pranowo presiden ri,senang
ganjar pranowo figur pimpin masuk kalang sosok muda humor santuyi sesi gen z bikin suasana cair ganjaruntuksemua lanjutkanbersamaganjar,senang
damping tuan guru bajang muhammad zainul majdi ganjar pranowo interaksi dg gen z lombok ntb sesi foto2an selfienya lewat,senang
ganjar pranowo indonesia ema 2045 capai ganjarpranowo ganjarcapres ganjarpresiden ganjarmenangtot ganjarpilihanrakyat presiden2024 ganjarpresiden2024 pilpres2024 pemilu2024,senang
kaum mileni gen z dukung ganjar pranowo presiden 2024 ganjarpranowo ganjarcapres ganjarpresiden ganjarmenangtot ganjarpilihanrakyat presiden2024 ganjarpresiden2024 pilpres2024 pemilu2024,senang
alumnus unpad nyata dukung ganjar pranowo presiden 2024 ganjarpranowo ganjarcapres ganjarpresiden ganjarmenangtot ganjarpilihanrakyat presiden2024 ganjarpresiden2024 pilpres2024 pemilu2024,senang
alumnus universita padjajaran jawa barat dukung ganjar pranowo presiden 2024 ganjarpranowo ganjarcapres ganjarpresiden ganjarmenangtot ganjarpilihanrakyat presiden2024 ganjarpresiden2024 pilpres2024 pemilu2024,senang
warga bal dukung ganjar pranowo presiden 2024 ganjarpranowo ganjarcapres ganjarpresiden ganjarmenangtot ganjarpilihanrakyat presiden2024 ganjarpresiden2024 pilpres2024 pemilu2024,senang
ganjar pranowo peneru presiden jokowi ganjarpranowo ganjarcapres ganjarpresiden ganjarmenangtot ganjarpilihanrakyat presiden2024 ganjarpresiden2024 pilpres2024 pemilu2024,senang
alumnus unpad dukung ganjar pranowo presiden 2024 ganjarpranowo ganjarcapres ganjarpresiden ganjarmenangtot ganjarpilihanrakyat presiden2024 ganjarpresiden2024 pilpres2024 pemilu2024,senang
90 persen anak muda bandung dukung ganjar pranowo presiden 2024 ganjarpranowo ganjarcapres ganjarpresiden ganjarmenangtot ganjarpilihanrakyat presiden2024 ganjarpresiden2024 pilpres2024 pemilu2024,senang
calon presiden bacapres ganjar pranowo ajak suami kasih sayang pasang sindonew news,senang
bagi2 sembako rawan ganjar pranowo ricuh lampung utara koalisibonekaistana koalisibonekaistana,marah
partai satu bangun ppp percaya figur menparekraf sandiaga uno penuh kriteria calon wakil presiden cawapr ganjar pranowo sindonew news,marah
serius org mw dijadiin cawapr ganjarpranowo doa airin tuh moga org gk jd cawapr ganjarpranowo kasi partai amp gp kewalahan utk jwb prtnyaan org tingkah konyol org,jijik
tgh tetes air mata doa ganjar pranowo presiden,sedih
erickthohir cawapr teras joss duet ganjar pranowo ganjarerickduetterbaik,terkejut
setyaki22965702 ryu53944310 ganjarpranowo mantap banget ganjar pranowo presiden peneru kerja presiden jokowi rampung indonesia maju sejahtera,senang
ganjar pranowo calon presiden baik ganjarcapres,senang
knp dengar nama uno yg ad dpikiran gw tampil debat it setip atm halal mandi lumpur bu li yg gk dicov bpj nurjanah yg tinggal ad yg msi halu uno in,marah
alumnus unpad nyata dukung ganjar pranowo ganjarcapres ganjarpilihanterbaik ganjarbawakemajuan ganjarpresiden2024 ganjarpresiden,senang
dukung ganjar pranowo alir dera kalang komunita ganajrcapres,senang
jokowi ganjarpranowo ganjar pranowo bawa indonesia man,senang
jokowi ganjarpranowo ganjar pranowo the next presid,senang
bungkustukang ganjarpranowo ga polllll ganjar pranowo presiden peneru kerja presiden jokow,senang
subur0204 iyusrusliadi73 ganjar pranowo harga mati nkri harga mati salam wara,senang
jhonnisinaga20 ganjarpranowo inti pilih ganjar pranowo bere,senang
masyarakat 90 dukung ganjar pranowo,senang
rstmbcl ganjarpranowo ganjar pranowo presiden peneru kerja presiden jokowi cepat prose bangun ikn nkri harga mati ani rasyid baswedan minat,senang
dukung alir ganjar pranowo sang presiden ganjarcapres,senang
eksklusif ganjar pranowo maju calon presiden beritasat,senang
warga rawan ganjar sambut riah datang ganjar pranowo ntb,senang
ganjar pranowo pimpin pidato kunjung marka dpw ppp ntb hadap penguru kader ppp ganjar bagi kesan politik lalu pdiperjuangan 50tahunpdip bangunlahjiwadanbadannya solidbergerak menangkanganjar,senang
hansssolo preeeet akal2an dukung capres abadi narik dukung ganjar pranow,marah
mayorita warga ntb rapat dukung penuh ganjar pranowo ganjarcapres,senang
anak muda antusia sambut ganjar pranowo,senang
alumnus unpad dukung ganjar pranowo presiden 2024,senang
survey ani yg buncit serang uji poll buka ganti nama ani sandal jepit tentu pilih sandal jepit retweet ganjar pranowo like prabowo subianto,marah
bal menang ganjar pranowo,senang
mhdyusufhandok1 jokowi bentar pensiun yg gantiin ya ganjar pranowo,senang
ganjar pranowo pimpin indonesia 2024,senang
ganjar pranowo dukung kalang,senang
dukung masyarakat bal ganjar pranowo ganjarcapres ganjarpranowo jokowi milu ganjarcapres ganjarcapresespdip ganjarcapreses2024 ganjarcapres indonesiamaju,senang
masyarakat bal dukung ganjar pranowo presiden ganjarcapres ganjarpranowo jokowi milu ganjarcapres ganjarcapresespdip ganjarcapreses2024 ganjarcapres indonesiamaju,senang
poll yuk biar rekayasa rakyat indonesia pilih salah capres favorit tunjuk capres pilih benar2 raih suara prabowo like ani baswedan retwit ganjar pranowo komen pollingcapres capreses2024,senang
dukung ganjar pranowo for presiden indonesia 2024 ganjarcapres ganjarpranowo jokowi milu ganjarcapres ganjarcapresespdip ganjarcapreses2024 ganjarcapres indonesiamaju,senang
dukung warga ntb ganjar pranowo ganjarcapres salmasalsabil gu muhaimin onad iphon 14 pontianak axelsen aang one piec,senang
antusiasm masyarakat ntb sambut ganjar pranowo ganjarcapres salmasalsabil gu muhaimin onad iphon 14 pontianak axelsen aang one piec,senang
warga ntb dukung ganjar pranowo ganjarcapres salmasalsabil gu muhaimin onad iphon 14 pontianak axelsen aang one piec,senang
pekik ganjar pranowo presiden gema lapang nasion selong lombokitaid,terkejut
ganjar pranowo sapa ribu masyarakat lombok timur lapang nasion ntb penuh hangat menangkanganjar generasigotongroyong sahabatganjar ganjarpranowo ganjar,senang
minggu 18 juni 2023 suasana penuh hangat sama liput lapang nasion ntb ganjar pranowo sapa ribu masyarakat lombok timur ada ganjar masyarakat lombok timur lapang nasion bukti nyata,senang
ajak puan masuk poro ubah ambyaaarr ganjar pranowo,marah
detikcom tohir ani baswedan puan maharani ganjar pranowo ahi cebong kampret autobingung cebong kampret auto akur oligarki tertawa,marah
pasang gaet idam amat mileni nilai unggul erickthohir bidang ekonomi bisni lengkap posisi capres ganjar pranowo politis tulen gaspol erick ganjar ganjarerickduetterbaik,senang
gak sabar nunggu ganjar pranowo presiden 10 genap 20 sakit,senang
amat politik uph emru sihomb sebut unggul erick thohir dunia ekonomi bisni lengkap ganjar pranowo birokrat politis tulen piawai pimpin bumn nilai erick thohir ganjarerickduetterbaik gantung plossa,senang
jabar deklarasi dukung ganjar pranowo bacapres 2024,senang
cocok presiden pk presiden indonesia biar ganjar pranowo aj,senang
calon presiden capres pdip ganjar pranowo hadir resepsi nikah putri politiku senior pdi juang aria bima the dharmawangsa jakarta kebayoran jakarta selatan minggu malam sindonew news,senang
yg sungguh elektabilita yg sbg capres pdip puan maharani retweet ganjar pranowo like,marah
hadir acara dinas penandatanganan kerjasama bidang seni sanur ganjar pranowo sempat ikut undang jalan sehat lapang renon ribu orang sambut beliau,senang
kereeen gubernur jawa ganjar pranowo jalan sehat bareng masyarakat grobogan rangka ingat lahir pancasila kabupaten grobogan even yg hadir puluh ribu masyarakat ronaldo axelsen onad innalilahi mandalika onic ronaldo tomcat,senang
romeowalker19 presiden pk cocok presiden indonesia ganjar pranowo aj,senang
terobos ganjar pranowo sempurna sekolah virtual warga miskin difabel iphon 14 onad gint ronaldo onic indonesiaopen2023,terkejut
thalomoan1 ganjar pranowo peneru pakdh jokowi,senang
calon menang ganjar pranowo,senang
ingat hut ganjarist ketua ganjarist torut menang ganjar pranowo presiden ri,senang
lihat video ganjar pranowo tiktok,jijik
