quoted_text,emosi
pan ppp demokrat sadar patut dukung ganjar pranowo seteru yg perna dgn pdip abai damai bangsa sempurna teriak jegal,netral
bule istri idola ganjar pranowo silah berselfi ganjar timnasday axelsen senin apel pagi,netral
ganjar pranowo program jokowi kawal lanjut,netral
kwalita didik jawa ganjar pranowo baik gaji guru honor bijak sambut guru honor ganjar pranowo,senang
ganjar peduli budaya nusantara bangga calon presiden indonesia ganjar pranowo respect peduli budaya nusantara ganjar yg ganti jokowi ntah nasib budaya nusantara depan ganjar peneru jokowi,senang
peduli ganjar pranowo didik spp grati honor sejahtera non formal sejahtera virtual solusi anak putu sekolah,senang
elektabilita calon presiden bacapres usung koalisi ubah satu kpp ani baswedan unggul gubernur jawa ganjar pranowo,netral
dear warga lombok calon presiden 2024 ayoo rapat baris amp ganjarpranowo istana utk lanjut visi misi jokowi bangun indonesia,senang
antusiasm masyarakat bagai daerah ganjar pranowo real coba donk yg foto ani dtg kunjung ga brp juta kira2 yg sambut kepo nih,terkejut
batas beliau stempel pki kalah kontestasi serah bagi,jijik
1 juta miskin entas ganjar pranowo jawa mengiki miskin turun angka mesti langkah nyata smk board jateng adl investasi kelak warga jateng jatuh jurang miskin,takut
ganjar pranowo dorong gen z rawat kembang seni budaya bangsa indonesia majubersamaganjarbangunri jenni bruno mar one piec onad wendi loudest concert rate r powerpuff girl sarap,senang
ken sosok siti atikoh istri ganjar pranowo publik penasaran tarik dibaha pasal sang suami gubernur jawa didapuk calon presiden pilpr 2024 usung pdi juang pepatah balik,netral
rapat baris ganjar pranowo,senang
era ganjar pranowo angka partisipasi kuliah tingkat jabat naik 100 antusias masyarakat jateng kuliah didik berband luru ekonomi masyarakat,senang
ganjar pranowo ribu kader pdip nusa tenggara barat ntb kait potensi politik identita kuat pilpr 2024 majubersamaganjarbangunri jenni bruno mar one piec onad wendi loudest concert rate r powerpuff girl sarap,netral
ganjar pranowo kantor dpd pdip ntb datang calon presiden bacapres sambut ribu dukung seni gamelan majubersamaganjarbangunri jenni bruno mar one piec onad wendi loudest concert rate r powerpuff girl sarap,netral
bule istri idola ganjar pranowo silah berselfi ganjar salmasalsabil nabilataqiyyah one piec pledi,netral
bacapres pdi juang ganjar pranowo masyarakat cerita hasil presiden joko widodo bangun sirkuit mandalika ntb via,senang
putra baik bangsa ganjar pranowo tgb muhammad zainul majdi nya makan canda pikir masalah bangsa,senang
wan ambruk aplikasi sprti ehh hasil yg lapor persekusi jancuuukk,marah
hadir raya ultah barajp jokowi ulang sikap dukung ganjar pranowo,senang
kaum bongdrun partisan hore sorak gembira krn temu ahi puan runtuh koalisi minim informasi benar nya mengganj ganjar fakta trah soekarno jatuh non soekarno,marah
calon presiden indonesia ganjar pranowo silaturahmi dpw ppp safari politik ntb sahabatganjar ganjarpranowo ganjar menangkanganjar generasigotongroyong,senang
cantik sederhana enerjik cerda banget dr sosok atiqoh supriyanti istri dr ganjar pranowo beliau sdh selesai tipe istri yg antar suami anak suks seep,senang
ingat ganjar pranowo sambut hangat riah daerah kunjung rekam jejak capai jabat layak apresiasi layak pilih presiden,senang
puan ahi masuk radar bacawapr pendamp ganjar pranowo kursi menteri tang ahi ganjarmenangtot,netral
gagas ganjar pranowo sekolah virtual program indonesia luncur 2020 silam tuju kurang angka putu sekolah,senang
perhati khusu ajar agama ganjar pranowo kucur rp 277 m utk insentif guru agama,netral
daerah ntb benar2 bilang wooouw ya masyarakat tumpah ruah jalan sambut hadir ganjar pranowo bukti gp kharisma kuat daya tarik daerah tsb,senang
erickthohir chhuda5 mana hadir erik ganjar pranowo ketemu heboh riah amp seru lanjut pimpin negara indonesia cinta,senang
perna kepala daerah peduli dgn didik terkhusu utk warga miskin didik salah kurang angka miskin ganjar pranowo bantu,senang
ganjar pranowo merah renon bal yg warga batas sambut hadir gp renon bal duga saudara bal hadir lebih kapasita laut manusia satu hati saudara indonesia timur lanjut bangun jokowi,senang
hasil capres ganjar pranowo menang lawan capres ani baswedan semuadukungprabowo neruskepakdh,senang
prabowo subianto 38 ganjar pranowo ani baswedan semuadukungprabowo neruskepakdh,netral
semuadukungprabowo neruskepakdh,netral
sejahtera guru honor baik gaji guru honor baik kualita didik ganjar pranowo tetap honorarium gtt satu didik negeri utk umk tambah 10,senang
momen tarik akrab ganjar pranowo tgb zainul majdi makan bareng tokoh masyarakat ganjar menang total ntb,netral
2020 ganjar pranowo bebas biaya spp siswa negeri jateng biaya ambil tanggung bop bantu operasion selenggara,senang
coba poll kotak kosong gp anda lawan ganjar kotak kosong pilpr 2024 pilih kotak kosong retweet ganjar pranowo like aja biar simpel berani jujur hebat,marah
90 persen masyarakat dukung ganjar pranowo ganjarcapres,senang
ganjar pranowo kriteria bacawapr damping hr visi jiwa muda b paham holistik byk anak muda pikir tua byk jg orang tua pikir muda yg jiwa,senang
capres pdip ganjar pranowo sambut riah ribu kader rawan tunggu pagi ria ganjar presiden 2024 gema iring jalan ganjar pranowo masuk lokasi acara,netral
ma ganjar pranowo tani ketua hari nasion dpp perindo tgb muhammad zainul majdi ziarah makam pahlawan nasion tgkh zainuddin abdul madjid silaturahmi tuan guru jemaah lingkup yayasan didik hamzanwadi pancor selong lombok timur,netral
pengaruh tgb ganjar pranowo menang ntb lampau persentas target cc ganjarpranowo,senang
ganjar pranowo tumpang mobil milik istri presiden ri soekarno fatmawati laku kebon vintag car bal classic denpasar hadir lokasi ikut acara gen z tajuk mabar akronim maju ganjar,netral
diskusi santai ganjar pranowo acara mabar maju ganjar tema kaum muda bicara kebon vintag car bal hadir ratus generasi z penuh tepuk tangan gelak tawa ganjar santai humor laden papar,senang
ganjar pranowo tunjuk semesta jaya nusantara,senang
ganjar pranowo bandara internasion lombok wita bandara ganjar sambut ketua dpd pdi juang ntb rachmat hidayat kader pdi juang ntb ganjar kalung selendang tenun kha lombok tanda tamu hormat,senang
ganjar pranowo temu soekarno kunjung kota mataram ntb momen ganjar pranowo pidato hadap kader partai kantor pdip provinsi ntb ganjar pranowo panggil salah kader nama soekarno 83 sumbawa,netral
ntb sambut ganjar pranowo ganjarpranowo ganjar pranowo ri1,senang
pencawapresan 10 nama 6 dr 10 nama bursa cawapr ganjar pranowo puan maharani mahfud md erick thohir ridwan kamil sandiaga uno ahi airlangga nama2 lebih masing2 pdip kerucut mjd 1 nama bacawapr ganjar,netral
ganjar pranowo hadir konsolidasi menang pilpr 2024 kota lombok nusa tenggara barat ntb minggu 18 juni,senang
kagum ridwan kamil ganjar pranowo indomi battl one piec baekhyun vietnam love gisel bpj powerpuff girl wendi bruno mar aang nonton balap mark lee thank you senin sarap junkyu,senang
ganjar pranowo sopir ketua hari nasion partai perindo tgb hm zainul majdi kunjung kota mataram nusa tenggara barat ntb momen bacapres ganjar pranowo makan siang tokoh agama tokoh masyarakat elemen,netral
pasang baik yg terus bangun jokowi jaga pancasila kadrun orma larang ganjarpranowo erickthohir giat medium sosial dukung ganjar pranowo pinang erick thohir cawapr,senang
jateng provinsi kaya tp uang negara benar2 manfaat ganjar pranowo utk tekan angka miskin,senang
coba test klo berani ani baswedan retweet prabowo komen ganjar pranowo lik,netral
ekspresi ekspresi jokowi makan ganjar pranowo nyaman senyum foto suasana penuh tegang,takut
strategi program entas miskin ala ma ganjar pranowo mudah lacak jejak digitigalnya contoh salah satu program didik grati,terkejut
strategi gagas ganjar pranowo kikis miskin dunia didik smkn jateng sekolah grati siswa berpretasi tekan angka putu sekolah entas ribu keluarga miskin ganjarpranowo,terkejut
ga pakai jet pribadi payah ga keren jongo oligarki ani ganjar pranowo sambut hangat riah warga lombok rebut selfi salam ganjaruntuksemua lanjutkanbersamaganjar,senang
dukung ganjar pranowo sodara2,senang
elektabilita ani salip ganjar pranowo pepet prabowo,terkejut
kantor dpw partai perindo calon presiden pdi juang ganjar pranowo ziarah makam pahlawan nasion lombok nusa tenggara barat ketua hari nasion partai perindo tuan guru bajang tgb,netral
masyarakat bal all out dukung ganjar pranowo,senang
bacapres ganjar pranowo temu puluh ribu gemar ntb,senang
gubernur bal ajak bupati walikota dukung ganjar pranowo rawan optimi menang putar hattrick ganjaruntuksemua lanjutkanbersamaganjar,senang
elektabilita ganjar persen margin of error survei persen hasil prabowoaja puncak salip ganjar pranowo prabowo subiant,senang
direktur eksekutif syndic ari nurcahyo nilai elektabilita ketua partai gerindra prabowoaja subianto salip gubernur jawa ganjar pranowo buah ubah strategi politik gerindra prabowo subiant,netral
bal totalita dukung ganjar pranowo presiden 2024,senang
ppp usung nama sandiaga uno maju pendamp ganjar pranowo ajang milu partai gerindra,terkejut
ganjar pranowo the next presiden ri 2024 masuk lapang masyarakat lombok timur penuh lapang nasion selong,senang
ganjar pranowo tekan semangat bangun koalisi gotong royong sama solid majubersamaganjarbangunri,senang
ganjar pranowo ulama santri lombok doa presiden 2024 okezonenew alhamdulillah yg doa ganjarpranowo moga ijabah doa doa aami,senang
gubernur ganjar pranowo baik gaji honor kualita didik yes ganjarpranowo,terkejut
dorong maju cawapr ganjar pranowo tgb putus serah publik putus hasil murni suara aspirasi masyarakat,netral
ganjar pranowo harap hadir kurang anggur buka jateng majubersamaganjarbangunri,senang
ketua hari dpp partai perindo tuan guru bajang tgb muhammad zainul majdi kabar temu ganjar pranowo lombok minggu tokoh membaha agenda strategi utk kontek menang ganjar 2024 gpdipulauseribumasjid,netral
ganjar pranowo capres 2024,senang
ganjar pranowo bantu 2 lansia magelang majubersamaganjarbangunri,terkejut
ppdb sman smkn jateng 2023 buka terima siswa dgn tambah kuota kursi warga jateng didik grati nya ganjar pranowo,senang
pimpin amp bijak peneru yg percaya dr ganjar dahulu lanjut sejahtera rakyat dukung ganjar pranowo sodara2,senang
berkat program gaga ganjar pranowo sektor didik sempat warga kuliah tingkat pesat,senang
giat wita hadir langsung gubernur jawa capres usung pdip ganjar ganjar pranowo,netral
gin dengar aspirasi anak muda gen z ganjar pranowo dialog gen z muda bal buka anak muda industri kreatif libat ak perintah,senang
wooh banget kuota ppdb saman smkn 2023 ganjar pranowo kursi lulus smp thn lbh loh banding thn ganjarpranowo,senang
bal gaspol lombok pesawat kela ekonomi privat jet lombok ganjar pranowo sambut antusia laut massa hati antar anak kandung reformasi bawa tongkat estafet jokowi ganjarpilihanrakyat,senang
gubernur jawa ganjar pranowo inisiasi program guru agama guru agama agama insentif islam kristen katolik hindu buddha,netral
ganjar pranowo capres yg tangan berani pegang merah putih cc,senang
era pimpin ganjar pranowo angka partisipasi sekolah jateng tingkat antusiasm masyarakat kuliah tingkat,senang
pengentasn miskin adl program yg sngat utama gubernur ganjar pranowo salah adl dgn buka sekolah smkn jateng grati bgi warga miskin sdh bnyk lulus smkn jateng yg bkerja prusahaan dlm negeri shngga bnyak rakyt miskin yg sdh hidup lbih layak,terkejut
ganjar pranowo milik peduli guru agama ganjar pranowo guru agama ujung tombak edukasi kait ilmu agama budi pekerti kebhinekaan,terkejut
pesan ganjar pranowo perempuan indonesia ajar meni,takut
elektabilita ani baswedan salip ganjar pranowo pepet prabowo subianto survei baru ipo,takut
terobos gubernur jawa ganjar pranowo dunia didik insentif ajar agama agama jateng anggar rp 277 miliar total terima ganjarpranowo timnasday,terkejut
gen z maju ganjar pranowo ganjarmenangtot,senang
setyaki22965702 laingenlisa ganjarpranowo pilih ganjar pranow,senang
hasil rapimna vi ppp resmi usul nama sandiaga uno calon wakil presiden damping bacapres ganjar pranowo ganjarpranowo sandiuno pppmenang,netral
siappp tum pppmenang partaipersatuanpembangunan,senang
sahhh ppp resmi usul sandiaga uno cawapr ganjar pranowo ganjarpranowo sandiuno,netral
pimpin nyali sungguh wajah garang intonasi pimpin berani tindak,senang
wajib sosialisasi tuju menang presiden ri ganjar pranowo tetap capres tum ppp mardiono ganjarpranowo ganjarpresiden2024,netral
ganjar pranowo dukung penuh masyarakat ntb ganjarcapres,senang
ganjarpranowo pin pemaj kunjung ntb bacapres pdip ganjar pranowo kunjung nusa tenggara barat kunjung kali masyarakat sasak semat pin pemaj ganjar ganjaruntuksemua lanjutkanbersamaganjar,senang
ketua dpw partai satu bangun ppp ntb muzihir aku bahagia kantor partai kunjung langsung ganjar pranowo ganjar tang pilih presiden pilpr 2024 ganjarpranowo sandiuno,senang
ganjar pranowo dengar paham harap gen z ganjarcapres,senang
ganjar pranowo tuan guru bajang zainul majdi kumpul kerumun ntb interaksi antusiasm cipta momen penuh bahagia ajak ganjar foto ada kamera,senang
mari syukur 10thn perhati jokowi pd ntb dngn pilih ganjar pilpr diband,senang
nek ngomongin cawapr yo sing cocok erickthohir ganjar pranowo nek sing liyan mbuh kerjon piy slurr erickthohir pilihanrakyat erickthohircawapr pilpres2024 relawansatset indonesia,netral
ganjar freeport nikel ambil alih olah nilai calon presiden pdi juang ganjar pranowo sukses presiden joko widodo jokowi catat program fondasi wujud indonesia,marah
silaturahmi ganjar pranowo masyarakat ntb jalin ganjarcapres,senang
ganjar pranowo antusia nyobain mobil fatmawati bal ganjaranapp ganjarpranowo ganjarforpresiden2024 ganjarpresiden2024 presiden2024 pemilu2024 ganjarcapres pilpres2024 ganjarpranowo2024,senang
ganjar pranowo kan program lapak ganjar,netral
alumnus universita padjadjaran jawa barat dukung ganjar pranowo,senang
rapat baris ganjar pranowo warga ntb ganjarcapres,senang
alumnus unpad nyata dukung ganjar pranowo presiden 2024,senang
capres pdi juang pdip ganjar pranowo dialog gen z muda bal buka anak muda industri kreatif libat ak perintah one piec kairi iphone14 axelsen,senang
ganjar pranowo magnet warga bal mana ganjar rebut warga salam foto ganjar ikut jalan santai lapang puput margarana denpasar one piec kairi iphone14 axelsen,netral
warga lombok dukung ganjar pranowo ganjarcapres,senang
ganjar pranowo sosok pimpin pegang teguh prinsip integrita sosok ganjar nilai layak lanjut perintah presiden jokowi one piec kairi iphone14 axelsen,senang
ganjar jalan sehat bal rawan harap ganjar lanjut program jokowi datang warga daerah bal ikut acara jalan santai ganjar pranowo gubernur bal wayan koster one piec kairi iphone14 axelsen,senang
ganjarpranowo tuan guru bajang adu rotan kunjung kantor dpw partai perindo ntb calon presiden partai pdi juang ganjar pranowo lombok nusa tenggara barat ganjar kunjung kantor dpw kunjung kantor dpw partai perindo ganjar pranowo,netral
nongkrong diskusi bareng ganjar pranowo ganjarcapres,netral
teman2 yg bal nih yg rapat jalan sehat bareng ganjar seru ya datang ganjar sambut tepuk tangan histeria dukung daru masyarakat bal dukung ganjar pranowo one piec kairi iphone14 axelsen pontianak morningg iphon 14 rodri,senang
anak muda bandung 90 persen dukung ganjar pranowo ganjarcapres,senang
ganjar pranowo dialog gen z mileni bal ganjarpresiden ganjarcapres,netral
ganjar kualita ganjar pranowo nobat mentor bangun daerah papar ganjar sebut prose bangun jateng rencana libat elemen masyarakat ronaldo axelsen onad innalilahi,netral
momen makan jokowi pranowo ganjar capres dukung presiden ani baswedan,netral
pijar sembah cerita atikoh rumah aspirasi rawan ganjarpranowo perempuan indonesia pilih ganjar pijar komunita rawan perempuan indonesia dukung calon presiden ganjar pranowo pilih presiden ri 2024,senang
sah ppp resmi usul sandiaga uno bacawapr ganjar pranowo,netral
dukung ganjar pranowo presiden 2024,senang
mileni gen z dukung ganjar pranowo ganjarcapres,senang
ganjarpranowo damping tgb temu tokoh masyarakat ntb calon presiden capres ganjar pranowo kunjung lombok nusa tenggara barat minggu ketua hari dpp partai perindo tuan guru bajang tgb zainul majdi damping ganjar,senang
angka partisi sekolah anak usia tingkat 12 ganjarpranowo jabat bukti didik jateng maju era ganjar pranowo,senang
rapat baris ganjar pranowo sambut riah warga rawan ntb ganjarpresiden ganjarcapres,senang
gubernur ntb sambang capres ganjar pranowo tgb,netral
dukung fanatik ganjar pranowo pribadi edit gambar yg diskredit dang gambar amor suka,jijik
ganjar sosok pimpin ruang generasi muda gen z mileni bal ganjar pranowo,senang
respon temu ganjar pranowo bagu,senang
sukarelawan santri dukung ganjar pranowo sdg edukasi amp kenal kitab karya karya alim ulama tgh moh shaleh hambali kpda anak didik kawasan lombok mana ganjarpranowo jg dgn ulama santri lombok doa ganjar,senang
ahi cawapr ganjar ya no problemo biaya milu 2024 gede hmpr 50 triliun sih coba2 pilkada 2017 tuk tau mampu gubnya yg zonk bolehh ganjar pranowo tgb zainul majdi aja yaa,netral
ken sosok siti atikoh istri ganjar pranowo publik penasaran tarik dibaha pasal sang suami gubernur jawa didapuk calon presiden pilpr 2024 usung pdi juang pepatah,senang
bal allout dukung ganjar pranowo ganjarpresiden ganjarcapres,senang
calon presiden capres 2024 ganjar pranowo sebut partai satu bangun ppp partai istimewa sikap politik partai lambang tentu helat politik nasion solidbergerak,netral
acara bal ganjar pranowo mabar gen z mileni ganjarcapres ganjarpranowo,senang
dukung ganjar pranowo ganjarpresiden ganjarcapres,senang
baru elektabilita ani salip ganjar pranowo pepet prabowo,netral
rakyat indonesia dukung ganjar pranowo presiden indonesia 2024 powerpuff girl baekhyun wendi onad one piec bpj bruno mar apel pagi indomi battl pagi senin sarap mark lee thank you,senang
ga poll dukung ganjar pranowo pilpr 2024 utk bangun indonesia sambung salam metal,senang
musniumar kelola parpol ubah ubah profesion komitmen intern nya brengsek dukung ganjar pranowo ahi anjangsana dg brengsek banget tunda rampung milu,marah
setyaki22965702 dinakusmayanti9 ganjar pranowo putih bacapres yg abu abu karna takut hilang suara pilih 2024 jatuh pilih bacapres yg benar2 nasional sejati kaleng beka pecat tri pecat milit ok,marah
ganjar pranowo gagal nyapr evaluasi calon gp,marah
dapat generasi muda yg milik wawas pandang tsamara aman ganjar pranowo sosok pimpin yg milik kwalita pimpin prestasi layak jg jadi bacapres dr pdip period smoga suks menang menjdi presiden ri 8,senang
rapat baris ganjar pranowo ayodukungganjar ganjarcapres ganjardihati ganjarthebest ganjaruntukindonesia,senang
ganjar pranowo sosok pimpin indonesia ganjardihati ganjarthebest ganjaruntukindonesia ayodukungganjar,senang
alumnus unpad jawa barat dukung ganjar pranowo ganjarpresiden ganjarcapres,senang
ganjarpranowo erickthohir emang duet pa utk pimpin indonesia utk terus mimpi jokowi utk indonesia ema,netral
wowwww masyarakat ntb ganjar pranowo figur pimpin rakyat cinta masyarakat,senang
kabar gak kayak partai raja kebo yg paksa anak manja kudu jdi uda bener sandi pasang lg klw ganjarpranowo biar erickthohir,marah
bacapres ganjar pranowo hadir acara jalan sehat kantor gubernur bal sabtu pagi ganjar kao olahraga warna hitam langsung kerumun awak medium potret hadir one piec kairi iphone14 axelsen,senang
anak muda bandung dukung ganjar pranowo ganjarpresiden ganjarcapres,senang
ganjar pranowo ikut jalan sehat creativ fun walk kawasan renon denpasar bal giat jalan sehat tsb ikut ribu warga rawan daerah bal ria dukung thd ganjar gema one piec kairi iphone14 axelsen jenni tidur,senang
ganjar pranowo nilai sbg figur pimpin yg rakyat milik integrita gerak dasar peduli masyarakat krn ganjar pegang teguh prinsip integrita dlm laksana tuga layan masyarakat one piec kairi iphone14 axelsen,senang
ganjar pranowo sosok pimpin pegang teguh prinsip integrita salah pilih pimpin dukung ganjar presiden 2024 one piec kairi iphone14 axelsen,senang
ganjar pranowo jalan sehat bal ribu warga bal sambut riah hadir ganjar keren nih bal dukung ganjar one piec kairi iphone14 axelsen,senang
calon presiden partai pdi juang ganjar pranowo lombok nusa tenggara barat bel inew adurotan main kha ntb perindo ganjarpranowo pdip,netral
ganjarpranowo tipe vision mision gen z ye ganjar pranowo jen,netral
optimi menang putar ganjaruntuksemua lanjutkanbersamaganjar gubernur bal ajak bupati wali kota pulau dewata menang capres ganjar pranowo target 90 persen,senang
dukung ganjar pranowo for presiden 2024 capresesganjar,senang
catat ya jadwal ganjar pranowo ntb ganjarcapres ntb,senang
ganjar pranowo pilih rakyat ganjarcapres,senang
ganjar pranowo the next presiden 2024 timnasday vietnam love gisel bpj nabilataqiyyah pagiii onad aang apel pagi morninggg ganjarmenangtot,senang
program sekolah virtual gaga ganjar pranowo harap warga lanjut didik ijazah didik sekolah jokowi ganjaranapp ganjarpranowo ganjarforpresiden2024 ganjarpresiden2024,senang
ganjar pranowo pilih ganjarcapres,senang
publik percaya ganjar pranowo figur lanjut sukses program jokowi ganjar dukung kalang masyarakat,senang
ganjar pranowo ragu prestasi nya ganjarpresiden,takut
ganjar pranowo baik ganjarpresiden,senang
ganjar pranowo pimpin tangguh suka masyarakat ganjarpresiden,senang
ketua hari dpp partai perindo zainul majdi akrab sapa tuan guru bajang tgb cawapr ganjar geliat transaksion,senang
ganjar pranowo pimpin berani suka jokowi ganjarpresiden,senang
siap diri inspirasi ganjar pranowo gen z satu jajah inovatif diskusi cari solusi cerah bersamaganjar ganjaruntukindonesia ganjarpresiden2024 ganjarpranowo,senang
ganjar pranowo pimpin peduli didik majubersamaganjarbangunri ganjarpranowo,senang
mimpi siti atikoh ganjar pranowo istri anak mandiri antar ma ganjar capai ganjar pranowo ri1,senang
ganjar pranowo geber bangun infrastruktur jateng maju majubersamaganjarbangunri ganjarpranowo,senang
ganjar pranowo ken dedikasi daya pemuda hadir libat diskusi makna bagi wawas harga inspirasi generasi peneru bersamaganjar ganjaruntukindonesia ganjarpresiden2024 ganjarpranowo,senang
masyarakat bal lapis mana dukung ganjar pranowo presiden ri ganjarpranowo ganjarcapres ganjaruntuksemua ganjarpresiden,netral
ganjar pranowo terus hilir industri perintah majubersamaganjarbangunri ganjarpranowo,senang
siti atiqoh suks rumah tangga istri jabat,senang
sambut riah warga rawan ntb ganjar pranowo ganjarcapres,senang
ganjar pranowo sambut ribu dukung lombok rebut selfi salam ganjar capres idam rakyat indonesia,senang
gak ganti presiden presid indonesia kecuali ganti ganjar pranowo ganjarmenangtot wowo yg berani,senang
pdip orang ntb pilih ganjar capai target aku segan sanksi pecat kader menang ganjar pranowo pilpr,senang
ganjar pranowo ajak masyarakat nusa tenggara barat berita hoax majubersamaganjarbangunri,senang
partburunggalak ganjar pranowo presiden peneru kerja presiden jokowi rampung indonesia maju sejahtera nkri harga mati ani baswedan minat,senang
ganjar pranowo ingat kader pdip ntb politik identita kuat majubersamaganjarbangunri ganjarpranowo,takut
ganjar pranowo tekan semangat bangun polisi gotong royong sama solid majubersamaganjarbangunri,senang
alumnus universita jabar ganjar pranowo,senang
ganjar pranowo yg dtg kalang politi n solidar maker erick thohir pimpin yg sgt paham ekonomi n administr milik alam kelola organisasi ganjarerickduetterbaik,marah
ganjar pranowo harap pondok pesantren darunnahdlatain nwdi lanjut juang cerdas anak bangsa majubersamaganjarbangunri,netral
puan maharani peluang ahi bacawapr ganjar pranowo,netral
penuh semangat kumpul tokoh inspiratif ganjar pranowo gabung temu raya kuat kreativita potensi generasi muda bersamaganjar ganjaruntukindonesia ganjarpresiden2024 ganjarpranowo,senang
kerjasama usaha ganjar pranowo intervensi anggur majubersamaganjarbangunri ganjarpranowo,senang
ganjar pranowo hormat pin pemaj masyarakat sasak nusa tenggara barat majubersamaganjarbangunri,netral
sandiuno resmi tugas partai satu bangun ppp ketua badan menang milu bappilu nasion ppp capres pdi juang pdip ganjarpranowo merespon,senang
ganjar pranowo bantu lansia magelang rumah layak sehat majubersamaganjarbangunri ganjarpranowo,terkejut
ganjar pranowo kerjasama pariwisata gint tvri wang yibo zoro arin sd inpr malm onad onic tomcat minggu gantung plossa innalillahi,netral
calon negara q siti atikoh ganjar pranowo,senang
laskar sesak indonesia nilai ganjar pranowo pimpin peduli rawat budaya bangsa indonesia majubersamaganjarbangunri,terkejut
ketemu ganjar pranowo kesan anak muda lombok ntb,senang
ganjar pranowo the next presiden pilih rakyat indonesia ganjarbawakemajuan ganjarfor2024 dukungganjar,senang
milleni gen z mabar maju bareng ganjar pranowo ganjarbawakemajuan ganjarfor2024 dukungganjar,senang
ganjar pranowo tuan guru bajang muhammad zainul majdi teman anggota dpr ri majubersamaganjarbangunri,netral
ompungguru ganjarpranowo prabowo hati masyarakat riau ganjar pranowo 2924 hora riau hora jambi hara batam hora tanjung balai karimun,netral
ganjar pranowo damping tuan guru bajang temu tokoh masyarakat provinsi nusa tenggara barat majubersamaganjarbangunri,netral
ganjar pranowo gen z rawat kembang seni budaya indonesia majubersamaganjarbangunri,senang
anak muda bandung dukung ganjar pranowo,senang
ganjar pranowo daki gunung rinjani wujud mahasiswa majubersamaganjarbangunri,senang
ganjar pranowo libat anak muda rawat budaya majubersamaganjarbangunri,senang
ganjar pranowo hadap kader pdip ntb guna politik identita guna gagas majubersamaganjarbangunri,marah
ganjar pranowo tulang punggung hasil berfoku sejahtera tingkat kualita hidup bersamaganjar ganjaruntukindonesia ganjarpresiden2024 ganjarpranowo,netral
